Datetime,Tweet Id,Text,User Name,Language,GPE
20221201,1598312254541365250,"Prices at the pump continue to plunge, dropping the US average for gasoline below where it was when Russia invaded Ukraine. https://t.co/USY6WowTGi",CNN,en,Russia
20221203,1599074763820892166,"For many trans people, Russia's invasion of Ukraine has made it much more difficult to be who they are. https://t.co/o910PFy3Me",CNN,en,Russia
20221204,1599408742084366337,"""Why haven't you labeled Russia a state sponsor of terrorism?""
CNN's @jaketapper questions Sec. Antony Blinken about the US response to Russian President Vladimir Putin's war in Ukraine. @CNNSotu #CNNSOTU https://t.co/xE8EfrZJqy",CNN,en,Russia
20221205,1599853082388664341,"Watch: @kileycnn speaks with members of Ukraine's Russian Legion, comprised of Russian defectors and volunteers who fled their country to protect Ukraine, about defending the city of Bakhmut and their hopes for Russia's future. https://t.co/D38xUggkq6",CNN,en,Russia
20221205,1599799531398479872,"Russian President Vladimir Putin has signed into law a bill banning so-called LGBTQ ""propaganda"" in Russia https://t.co/2kFW17Ch6j",CNN,en,Russia
20221206,1600149110090260482,"An airfield in Russia's Kursk region that borders Ukraine was hit with a drone strike. Ret. US Army Major Mike Lyons explains how the attack, which Ukraine has not taken responsibility for, is an advantage for Ukraine. Watch: https://t.co/Bv9JLtEQxK",CNN,en,Russia
20221206,1600099018729660417,"Here are 5️⃣ things you need to know today:

1️⃣ Georgia runoff

2️⃣ Mauna Loa eruption

3️⃣ SCOTUS

4️⃣ Flu vaccine

5️⃣ Russia missiles

https://t.co/zqFABQx9rM",CNN,en,Russia
20221206,1599946028420997120,Explosions at two Russian air bases have focused attention on Ukraine’s efforts to develop longer-range combat drones. Retired Lt. Gen. Ben Hodges explains why this development could be significant in the war with Russia. Watch here: https://t.co/rkzUm6quzf,CNN,en,Russia
20221207,1600503913433686019,".@willripleyCNN travels to an undisclosed location near the Russian border to witness the arrival of two buses carrying 60 Ukrainian prisoners released in a swap with Russia.

Watch the exclusive report here: https://t.co/tTHKL8sv0v",CNN,en,Russia
20221209,1601306953048891392,"Russia demanded that a spy held in Germany be freed in exchange for Paul Whelan, even as the US offered up the names of several other Russian prisoners in US custody that they would be willing to trade https://t.co/bZ91sM5d8i",CNN,en,Russia
20221209,1601176004478877696,"WNBA star Brittney Griner arrived in San Antonio, Texas, after a prisoner exchange with Russia.

Watch the moment she touched down on US soil: https://t.co/V4AwVJXMwD",CNN,en,Russia
20221209,1601166722756648961,WNBA star Brittney Griner lands in the US after prisoner exchange with Russia https://t.co/Lpm09gy0Mz,CNN,en,Russia
20221209,1601022081281544192,"Former US Ambassador to the UN Bill Richardson, who helped secure Brittney Griner’s release, explains to @wolfblitzer how the geo-political differences between Russia and the US affected the chances of being able to swap two Americans for two Russian prisoners. https://t.co/mJuPWgQ2qb",CNN,en,Russia
20221209,1601007229234302978,Prolonged negotiations and a key point on which Putin wouldn't budge led to the deal that freed Brittney Griner but left Paul Whelan in Russia. https://t.co/mPbx7HPa7x,CNN,en,Russia
20221210,1601712980491739139,"Russian President Vladimir Putin floated the possibility that Russia may formally change its military doctrine of not being the first to use nuclear weapons in a conflict, days after he warned of the “increasing” threat of nuclear war https://t.co/7zLConxIFO",CNN,en,Russia
20221210,1601640380369457164,"What Russia cannot win on the battlefield, it is seeking to win by casting Ukrainian cities into the dark and cold as a long winter sets in https://t.co/TOCEjB6Opb",CNN,en,Russia
20221210,1601604149589729286,"Russian President Vladimir Putin floated the possibility that Russia may formally change its military doctrine of not being the first to use nuclear weapons in a conflict, days after he warned of the “increasing” threat of nuclear war https://t.co/hoWIYa8lV5",CNN,en,Russia
20221210,1601539970019348483,"After being imprisoned in Russia for nearly 10 months, WNBA star Brittney Griner’s safe return to the US on Friday was marked by a stop at a Texas military medical facility for a routine evaluation, the US State Department said https://t.co/ohYYslhCtB",CNN,en,Russia
20221210,1601517043777421312,"What Russia cannot win on the battlefield, it is seeking to win by casting Ukrainian cities into the dark and cold as a long winter sets in https://t.co/T4PSZZ0XQc",CNN,en,Russia
20221210,1601373660371091456,"Russian President Vladimir Putin floated the possibility that Russia may formally change its military doctrine of not being the first to use nuclear weapons in a conflict, days after he warned of the “increasing” threat of nuclear war https://t.co/43P538HV4T",CNN,en,Russia
20221212,1602390804999307313,"Biden administration officials met virtually with Elizabeth Whelan, whose brother Paul Whelan remains detained in Russia, she told CNN https://t.co/U4gDd00uHQ",CNN,en,Russia
20221212,1602219246423052288,President Joe Biden and Ukrainian President Volodymyr Zelensky spoke on Sunday to discuss Russia’s invasion and recent US efforts to strengthen Ukraine’s air defenses. https://t.co/m2ZkyaHbqx,CNN,en,Russia
20221214,1603113888924721152,President Joe Biden welcomes nearly 50 leaders from Africa on Wednesday for a summit intended to reset Washington’s commitment to a region where China and Russia are also working to expand their influence https://t.co/mDCcWnzGwf,CNN,en,Russia
20221214,1602843463837519874,CNN's @willripleyCNN reports from Ukraine's border with Belarus where there is growing concern about Russia once again assembling troops and holding joint-combat drills: https://t.co/7N0Xg5IT9X,CNN,en,Russia
20221216,1603863811953262592,"The global energy crisis caused by Russia’s war on Ukraine has pushed global demand for coal – the most polluting of all fossil fuels – to a record high in 2022, the International Energy Agency said https://t.co/04HL4xyO81",CNN,en,Russia
20221220,1605171716837212160,Senior International Correspondent @willripleycnn visits Snake Island in the Black Sea. See what he found at the strategically significant location in the Russia-Ukraine war. https://t.co/nJuYduT3Kg,CNN,en,Russia
20221221,1605673475670171663,"EXCLUSIVE: The Biden administration has launched an expansive task force to investigate how US and western components are ending up in Iranian-made drones Russia is launching into Ukraine, multiple officials familiar with the effort tell CNN https://t.co/UPTZYeRzig",CNN,en,Russia
20221221,1605643124298088448,Ukrainian President Volodymyr Zelensky has arrived at the White House – his first trip outside his homeland since it was invaded by Russia 300 days ago – to rally his top international partner behind sustained military and economic assistance. https://t.co/9CJouce9nF https://t.co/406VniPCVo,CNN,en,Russia
20221221,1605612831415713795,"Russia has continued expanding its military bases in the Arctic region despite significant losses in its war on Ukraine, according to a new series of satellite images obtained by CNN https://t.co/N1uG3Uwbx9",CNN,en,Russia
20221221,1605520256373497857,"EXCLUSIVE: The Biden administration has launched an expansive task force to investigate how US and western components are ending up in Iranian-made drones Russia is launching into Ukraine, multiple officials familiar with the effort tell CNN https://t.co/4GoNyaBVe7",CNN,en,Russia
20221222,1605979001499127808,"Zelensky took the opportunity in his speech to thank the US for assisting Ukraine in the war against Russia
https://t.co/xQa9Fz7rTr",CNN,en,Russia
20221222,1605967686311321607,"Russia’s foreign ministry condemned what it called the “monstrous crimes” of the “regime in Kyiv,” after US President Joe Biden promised more military support to Ukraine during Zelensky’s summit at the White House https://t.co/d9UThJ6nrJ",CNN,en,Russia
20221222,1605729888077549568,"Three-hundred days after his country was invaded by Russia, Ukrainian President Volodymyr Zelensky jetted to Washington, DC, for talks on what the next 300 days might bring. https://t.co/OsbNHfImDo",CNN,en,Russia
20221223,1606379402115354625,"John Durham, the special counsel investigating potential misconduct in the Trump-Russia probe, has spent nearly $6.5 million on his inquiry, according to financial documents released by the Justice Department. https://t.co/NYApQ4NcuP",CNN,en,Russia
20221224,1606786886093225986,"From Russia's war in Ukraine to the mass shooting at an elementary school in Uvalde, Texas, to the death of Queen Elizabeth II, these are some of the remarkable stories of 2022 https://t.co/bLl1F3TwpW",CNN,en,Russia
20221226,1607436353020596227,"Russia has put the investigative journalist Christo Grozev on its “wanted” list, according to the Russian Interior Ministry https://t.co/qeqBxTPhNR",CNN,en,Russia
20221227,1607827934533881857,"As a year dominated by Russia’s war on Ukraine draws to a close, Vladimir Putin has made a point of suggesting he is open to peace talks despite evidence to the contrary, with comments that have been roundly dismissed by Kyiv and the West as a ruse. https://t.co/eKra6I3LyB",CNN,en,Russia
20221227,1607802275874983936,"From Russia’s war in Ukraine, to the Queen’s death, to the first Black woman being seated on the US Supreme Court -- these were some of the biggest and most remarkable stories of the year. Explore our special feature “2022: The Year in Pictures” here: https://t.co/NgxQHiEUoY https://t.co/BSNZb2RN6V",CNN,en,Russia
20221228,1608229893594030082,"From Russia’s war in Ukraine to the mass shooting at an elementary school in Uvalde, Texas, to the death of the Queen, these were some of the biggest and most remarkable stories of the year. Explore our special feature “2022: The Year in Pictures"" here: https://t.co/UU0mkdESBo https://t.co/xCYNQPUv2R",CNN,en,Russia
20221228,1608121058078429186,"Russian soldiers taking part in the war on Ukraine will be eligible for free sperm freezing and storage in cryobanks, Russia’s state news agency Tass reported, citing a lawyers union https://t.co/iEyjvED146",CNN,en,Russia
20221229,1608583705278255104,"Russia’s currency hit an eight-month low Thursday, adding to sharp declines in December as global oil prices fell, and Western sanctions targeted Russia’s energy sector https://t.co/IUhiQVpSYE",CNN,en,Russia
20221230,1608779080387776512,"Ukraine said its forces shot down 16 Iranian-made drones launched by Russia overnight, a day after what appeared to be one of Moscow's largest missile barrages since the war began.

Follow live updates: https://t.co/mPnpSSbAI6",CNN,en,Russia
20221230,1608759819560681474,Vladimir Putin invites Xi Jinping to Moscow in 2023 during video meeting as the Ukraine war tests the Russia-China partnership https://t.co/IZLHNaVA3M,CNN,en,Russia
