Datetime,Tweet Id,Text,User Name,Language,GPE
20221213,1602636191232249856,"Many Chinese netizens joked that the fortune cookie phrase “be positive, be patient” means “COVID positive and become a patient.” But more believed that the phrase can also be China’s response to the exit wave. https://t.co/08Tqikdjjw",globaltimesnews,en,China
20221213,1602632282975928320,Border troops of PLA Western Theater Command were on a routine patrol on Chinese side of #LAC on eastern section of China-India border on Fri when Indian troops illegally crossed the line&amp;blocked the Chinese forces: a PLA spokesperson https://t.co/PtDM8bzIjp https://t.co/JVluoPr2Dm,globaltimesnews,en,China
20221213,1602623238021881857,"The number of China-Europe freight trains is expected to surge ahead of the Christmas holidays, and some Chinese companies are actively booking containers for Europe-bound exports: industry insiders https://t.co/6UpUEYBGJ9",globaltimesnews,en,China
20221213,1602622652170080259,"Hype about Germany’s new infrastructure plan won’t hinder pragmatic cooperation with China, which has been gaining new momentum after German Chancellor Olaf Scholz’s recent visit to China, analysts said. https://t.co/rA2RSV17J8",globaltimesnews,en,China
20221213,1602620420435447809,"The US’ scheme is to use the hypersonic missile and the recently revealed B-21 stealth bomber to penetrate China’s air defense, but the PLA has what it takes to defend the country, experts said. https://t.co/vbtCskx7Ug",globaltimesnews,en,China
20221213,1602620376240070657,"After a series of failures, the US Air Force on Monday announced that it has finally succeeded in the test launch of its air-launched hypersonic missile, a technology China has long mastered and has even put on public display in a recent air show. https://t.co/vbtCskx7Ug",globaltimesnews,en,China
20221213,1602607535990652928,"A local court in Shenyang, NE. China's Liaoning, announced on Tue that the trial of Yu Zhigang, a former member of the Standing Committee of the 13th NPC accused of taking bribes, was terminated in accordance with the law, after he suffered a sudden cerebral hemorrhage &amp; died. https://t.co/6Bg0r6R8Wm",globaltimesnews,en,China
20221213,1602600373381898240,"HK’s security chief criticized Google for refusing to correct China’s national anthem as its top search term, saying Google’s refusal claim was unbelievable and a double-standard as it obeyed EU’s top court’s order to remove manifestly inaccurate data. https://t.co/4hewdaoLxl",globaltimesnews,en,China
20221213,1602586926300667905,"China’s CDC said on Tue that BQ.1.1 shows no higher pathogenicity than BA.5. as rumors circulating on Chinese social media platforms claim that the variant, nicknamed Felhunter, was “highly contagious and deadly.” https://t.co/S3Z2aF3K7L",globaltimesnews,en,China
20221213,1602578984172417024,"China held its ninth national memorial ceremony Tue for the victims of the Nanjing Massacre, serving as a reminder that the massacre that took place 85 years ago should never be forgotten or distorted and militarism in Japan must not be allowed to revive. https://t.co/xHWAzCLJGG https://t.co/R1Md9mvAdG",globaltimesnews,en,China
20221213,1602578289272537095,"China was shocked at the hotel attack in #Kabul, firmly opposes any terrorism. China has asked the Afghan authorities to make all-out efforts to search and rescue Chinese nationals, punish murders and protect Chinese citizens, organizations: FM https://t.co/xQev8zb94K",globaltimesnews,en,China
20221213,1602559389826940928,"A memorial ceremony was held in Beijing on China's 9th national memorial day Tuesday to commemorate the 300,000 victims killed by Japanese invaders in Nanjing city in 1937, reminding people to remember the history and cherish peace. https://t.co/ecosVu1RHE https://t.co/6hLAcwidej",globaltimesnews,en,China
20221213,1602557140517982208,"China is likely to roll out a second booster shot, or the fourth shot, for high-risk groups, including those aged 60 and above and those with serious underlying diseases or hypoimmunity: source close to China’s disease control and prevention system https://t.co/xq3k36Zmru",globaltimesnews,en,China
20221213,1602494895998275590,"China and Japan should treat each other in a sincere manner, draw on historical experience, grasp the general direction of bilateral relations from a strategic height and build a China-Japan relationship that meets the demands of the new era, Cai Qi added.",globaltimesnews,en,China
20221213,1602494831150137345,"Since the normalization of China-Japan relations 50 years ago, exchange and cooperation in various fields have yielded fruitful results, bringing important benefits to the two peoples and promoting regional peace, development and prosperity, Cai Qi said. https://t.co/7jTZu89VwZ",globaltimesnews,en,China
20221213,1602481537169371136,The national flag was at half-mast at the Memorial Hall of the Victims of the Nanjing Massacre by Japanese Invaders on China's ninth national memorial day on Tuesday to commemorate the victims of the Nanjing Massacre. The national memorial ceremony is set to start at 10 am. https://t.co/Oher4Zrkm0,globaltimesnews,en,China
20221214,1603147823683346432,"#环球时报Editorial: African countries hope to build good relationship with the US, but they don’t want to achieve it at the cost of China-Africa development and cooperation. https://t.co/8JbjH6ePhb https://t.co/B3GlvnJy4f",globaltimesnews,en,China
20221214,1603107556125073408,#COVID19 #vaccine producers have started to prepare for increased vaccine production after China issued a plan to roll out second booster shots on Wed. https://t.co/LigDvNMEIW,globaltimesnews,en,China
20221214,1603102526793998337,"China #Meheco Corp has signed an agreement to supply #Pfizer's COVID-19 treatment #Paxlovid in the Chinese mainland, it said in a filing on Wednesday. https://t.co/pUdgbMhvHH",globaltimesnews,en,China
20221214,1603097489736966146,"When US Defense Secretary Lloyd Austin warned African leaders that “China and Russia were destabilizing Africa,” he probably forgot about the pain &amp; chaos the US has brought to the continent, and how much infrastructure China has built for Africa: experts
https://t.co/EeycrNScuc",globaltimesnews,en,China
20221214,1603092458216341504,Overseas #financial infrastructure that provides domestic institutions or individuals with cross-border supply services would require access granted by financial management departments under China's State Council: new draft rules released on Wed https://t.co/XG8ysKVyj2,globaltimesnews,en,China
20221214,1603077357140672512,"The production capacity for key #medical supplies such as antigen detection reagents, #vaccines and #masks is sufficient in China, the Ministry of Industry and Information Technology told a press conference on Wednesday. https://t.co/VTggDxe76s",globaltimesnews,en,China
20221214,1603072326337077248,"China’s re-opening road will be “safe and orderly,” instead of “bumpy,” as the country relaxed restrictions when virus becomes less lethal and preparation in place; unlike Western countries, forced to surrender in face of even deadly variants.
https://t.co/LuShWdT7gZ",globaltimesnews,en,China
20221214,1603066237067710465,"#环球时报Editorial: US has made its Africa strategy a Gordian knot. It has set its goal to prevent China’s development instead of helping African countries, which fundamentally goes against the wishes of African countries and damages their interests. https://t.co/8JbjH6ePhb https://t.co/y3ZnHobDgv",globaltimesnews,en,China
20221214,1603059157468434434,"#GTVoice: At a time when China and Germany have shown their willingness to further deepen cooperation, it is selfish of a few German politicians to choose to play tough with China, which only reflects their disregard for Germany’s interests. https://t.co/7GIKDfrnOQ",globaltimesnews,en,China
20221214,1603044396114526211,"…Washington’s policy toward Africa has been driven by its outdated and unrealistic Cold War mentality with obvious anti-China sentiment, rather than focusing on real development for Africa. So there is no need to be worried, and Africans won’t be fooled. https://t.co/EeycrNScuc",globaltimesnews,en,China
20221214,1603044201758953473,"The US is holding a summit with African countries and will try to convince Africans that the US offers a “better option” than other major powers, especially China, but Chinese analysts said… https://t.co/EeycrNScuc",globaltimesnews,en,China
20221214,1603037107882115072,China on Wednesday revealed a guideline aimed at further expanding domestic demand with the goal to raise the scale of consumption and investment to a new level by 2035. https://t.co/lD0GO8Xo9f,globaltimesnews,en,China
20221214,1603033217908424705,"China’s BeiDou Navigation Satellite System (BDS) has become the top guidance service provider for domestic Gaode Map, according to a statement released by the Beijing Institute of Space Science and Technology Information on Wed.
https://t.co/ZNRCQKIdJL",globaltimesnews,en,China
20221214,1603029425578287112,"In NE China's Jilin Province, Ren Jianguo has been voluntarily protecting wild birds along the #SonghuajiangRiver, as every year in this season thousands of #migratorybirds fly from Siberia down south to survive winter. #COP15
https://t.co/VBsb2YerSg",globaltimesnews,en,China
20221214,1603019727206776834,"China views its ties with Iran from a strategic perspective and will not waver in its determination to develop their comprehensive strategic partnership, said Chinese Vice Premier Hu Chunhua during Iran visit. https://t.co/fpv1wbrLyY",globaltimesnews,en,China
20221214,1603018927948587008,"#GTGraphic: One year after #COP15 phase one, what achievements has China made in biodiversity conservation? Check out this info to explore more: https://t.co/W6RfC24eey",globaltimesnews,en,China
20221214,1603011542915907584,"China vows to guarantee the access to medical services &amp; drugs amid surging public demand. It would add fever clinics, expand resources for critical cases, boost online diagnosis and promote increased manufacture of fever drugs and antigen test kits. https://t.co/E0ppC0ex8w",globaltimesnews,en,China
20221214,1603010306858684416,"Stop reporting asymptomatic cases, roll out second booster for vulnerable group and double down on medical preparedness… China’s COVID-19 fight pivots from curbing infection to shoring up resources to bolster medical system for first exit wave. https://t.co/LuShWebgv7",globaltimesnews,en,China
20221214,1603002765269082112,China’s transport sector has rebounded significantly over the past week after authorities announced 10 optimized measures against COVID-19 that eased restrictions. Rapid recovery expected. https://t.co/myMGFHxdQp,globaltimesnews,en,China
20221214,1602985932055252994,"China gives full play to the advantages of new national system to increase production and supply of medical services, fever and cold drugs and other much-needed personal protection items amid a fast rise in COVID-19 cases. https://t.co/jdlRG8qpyp",globaltimesnews,en,China
20221214,1602969255238328320,"China opposes US' generalization of concept of national security &amp; unreasonable suppression of Chinese firms, an approach that will backfire, the FM said in response to a report that US Congress introduced bills to keep foreign firms like Huawei out of its financial system. https://t.co/CMJ63qDhPR",globaltimesnews,en,China
20221214,1602964014354825218,"China urges Japan to implement consensus of the four China-Japan political documents, which clarified that the two countries should ""be partners, not threats."" Wang said Japan’s attempt to find an excuse to expand military by hyping China’s ‘threat’ will not succeed.",globaltimesnews,en,China
20221214,1602963931030761474,"Japan’s documents on defense policies go against the truth and commitments of China-Japan ties. China firmly opposes it and has expressed solemn representations, FM spokesperson Wang Wenbin said after Japan called China a “threat” in revised documents. https://t.co/SJTF233VvC",globaltimesnews,en,China
20221214,1602960393155973121,"Positive progress has been achieved &amp; difficult issues are expected to be addressed through meetings with all parties’ wisdom &amp; determination to close gaps &amp; divides at UN biodiversity conference: Huang Runqiu, China's Minister of Ecology and Environment https://t.co/ka6hD4aeVg",globaltimesnews,en,China
20221214,1602944059714437121,China supports HKSAR govt firmly upholding the dignity of the national anthem. Internet firms are obliged to convey correct information: Chinese FM commented on Google's refusal to correct China’s national anthem search  https://t.co/4hewdapjmT,globaltimesnews,en,China
20221214,1602932519787433984,"#Opinion: Stability, condition for sustained development, is time &amp; space to explore their own development path, including gradual political reform. This is key to common will of China &amp;Arab countries to further enhance cooperation, writes @dinggangchina https://t.co/GLo86AQtDQ",globaltimesnews,en,China
20221214,1602926934379618304,"China's State Post Bureau announced Wednesday it will ramp up more delivery capacity in Beijing city amid a spike in orders, adding that human resources will pivot  towards ensuring the delivery of medicine and essential goods. https://t.co/WKBXTAz5D7",globaltimesnews,en,China
20221214,1602909032292810754,"As of Nov 2022, China has invested over 1 trillion yuan ($143.69 bln) in water conservancy construction, up 33% y-o-y, the largest annual investment in history, said Water Resources Ministry on Wed, while 10 provinces have completed 50 billion yuan of investment in 2022. https://t.co/jc0FtLgEZU",globaltimesnews,en,China
20221214,1602875795084828673,"Starting from Wed, China no longer reports asymptomatic #COVID19 cases following the removal of mandatory testing requirements. C.China's Hubei encouraged people to update own antigen self-test results, in a move to increase the validity of home testing. https://t.co/lx0QNdej94 https://t.co/a0YdMezyrq",globaltimesnews,en,China
20221214,1602858310210052096,"China's top health body issued a plan to roll out second booster shot on Wednesday. High risk groups: elderly above 60 years and people with underlying diseases, weak immune system, who received the first boost shot, will be the first to receive the second booster. https://t.co/imELDPPBPJ",globaltimesnews,en,China
20221214,1602844423427358721,"China announced not to publish daily tally of asymptomatic COVID-19 cases starting Wednesday, as many silent carriers no longer take nucleic acid test and the exact number of this group is hard to collect. https://t.co/uN9kfxX4Lu",globaltimesnews,en,China
20221214,1602819407054606337,"Market regulators across China’s cities have initiated inspections targeting medicine, speculation regarding self-testing kits and illicit sales amid a surge in market demand. https://t.co/397Wyl6gz9",globaltimesnews,en,China
20221215,1603490076276789248,"But considering Japan’s recent provocations, including calling China a “challenge” in its defense strategy, Chinese observers warn that Beijing should be on high alert over Tokyo’s provocative moves. https://t.co/jv9plvEfri https://t.co/V7iWM1NiHo",globaltimesnews,en,China
20221215,1603474977113706531,"For many Chinese, hunkering down is only a preceding step for spring forward in a more adroit manner for the Spring that lies ahead. Experts expect an economic rebound stronger than the one China experienced in 2020 and 2021.
https://t.co/VYNpzWF6zp",globaltimesnews,en,China
20221215,1603454844538437645,"China's #transport ministry on Thu released a notice on further implementing optimized #epidemic prevention and control measures for people arriving in #Beijing, removing the requirement for them to do nucleic acid testing. https://t.co/0lTViMH8kA",globaltimesnews,en,China
20221215,1603449815207006208,China’s medical institutions are ramping up efforts to allocate resources to relieve pressure among medical institutes – allocating more manpower from upper-level medical institutes or rehiring retired medical personnel to alleviate pressure. https://t.co/zIJPo5GIx9,globaltimesnews,en,China
20221215,1603444778024292352,"#China strongly urges the #UK to stop political manipulation and take credible measures to enable the normal performance of Chinese diplomatic and consular missions in the UK, the Chinese FM said on Thu. https://t.co/s1Wh5PM4PE https://t.co/OawQb4xFto",globaltimesnews,en,China
20221215,1603439744511270914,"This routine exercise sent a signal amid Japan’s recent militaristic moves, including updates to its security strategies with the plan to increase military spending and referring to China as a ""strategic challenge,"" experts said. https://t.co/6dHSpH21XB https://t.co/ElkEaMop6x",globaltimesnews,en,China
20221215,1603429678446006275,China's State Council on Thursday called for efforts to improve #logistics and safeguard the delivery of #epidemic prevention supplies after the country eased anti-virus restrictions. https://t.co/XJT1bTLD14,globaltimesnews,en,China
20221215,1603427403463655426,"#环球时报Editorial: UK should make a solemn apology to Chinese Consulate General and make a serious guarantee: stop shielding anti-China forces, and ensure that the premises and personnel of Chinese embassies and consulates are not violated. https://t.co/bbdavfMXbc https://t.co/bS9oiTkOKh",globaltimesnews,en,China
20221215,1603424567292067850,"Japanese FM is reportedly eyeing his first China visit in about 3 years, which observers believe would be a good sign for managing differences on sensitive topics, including the Diaoyu Islands issue and Taiwan question. https://t.co/jv9plvVQiQ",globaltimesnews,en,China
20221215,1603422704031236102,"ASEAN and EU, two of China’s major trade partners, have concluded their first-ever summit in Brussels. China holds a positive and open attitude to any cooperation between its partners that doesn’t target any third party: experts
https://t.co/7M3S47SJ0U",globaltimesnews,en,China
20221215,1603414579274358784,"It is definitely a Super 2022 for China space, with record-breaking number of orbital launches and world-amazing qualities with #ChinaSpaceStation missions as absolute highlights 
https://t.co/x8BplF2r62",globaltimesnews,en,China
20221215,1603413194554630145,#GTVoice: The potential increase in Chinese demand for energy products doesn’t necessarily mean China will exacerbate the global energy crunch. Imbalance in the global energy supply is the root cause of the current energy crisis. https://t.co/sVmvm52so0,globaltimesnews,en,China
20221215,1603408562054569984,"#Opinion: The border disputes have long plagued China-India relations. But between the two countries, common interests far outweigh differences. The two sides should enhance cooperation rather than hinder their relations due to border disputes. https://t.co/5pztADX9cb https://t.co/zkykmfQ01G",globaltimesnews,en,China
20221215,1603401828296704001,"Addressing the 15th China-Latin America Entrepreneurs Summit on Wed, President Xi urged businesses from both sides to seek shared development. LAC firms eye more opportunities in Chinese market. https://t.co/Q7AkBtUTAa https://t.co/EoglfYIHCa",globaltimesnews,en,China
20221215,1603397117359587329,"Will #AvatarTheWayOfWater be able to make another miracle with the reopening of Chinese cinemas and eager moviegoers, and pave the way for China’s #thewanderingearth 2? Chinese film critics say the #Avatar miracle will not repeat.
https://t.co/zbVuZiJr8F https://t.co/D5FSpXc97Q",globaltimesnews,en,China
20221215,1603392836258365440,"The adventurous elephants in SW China’s #Yunnan Province became famous around the world for their epic journey. A year on, their story continues. #COP15 #WildlifeInChina https://t.co/qLUXH9XLAw",globaltimesnews,en,China
20221215,1603392150384918530,"What are China’s first national parks? Why are they important? What progress China has made in recent years? The infographics illustrate China’s treasures in nature.
https://t.co/hDhr7f01AB https://t.co/q4XfbfQPGt",globaltimesnews,en,China
20221215,1603391537223958531,"The 10th edition of China’s COVID-19 control protocols will be released soon, which will help economic development on the basis of active epidemic prevention, said China’s top respiratory disease expert Zhong Nanshan. https://t.co/nbpL1OznlD https://t.co/CZfTUtfdE5",globaltimesnews,en,China
20221215,1603382558745858049,"#Opinion: Four complex mindsets have long influenced India’s China policy: the victim mentality, the superiority complex, the chaser mentality, and the speculator mentality. https://t.co/sFrRILhTws",globaltimesnews,en,China
20221215,1603381041083060230,"A suspected falling meteorite was seen in Hangzhou, East China’s Zhejiang Province on Thursday night. The meteorite fell in just a few seconds and illuminated the night sky, according to local reports. https://t.co/Agk42YtASe",globaltimesnews,en,China
20221215,1603379949330911232,"China's economic planner NDRC released on Thursday an implementation plan to boost domestic demand during the 14th Five-Year Plan period (2021-25), as the nation strives to boost its recovery&amp;realize high-quality growth amid global economic downturn.
https://t.co/Xde3bshZsg",globaltimesnews,en,China
20221215,1603372324362674178,"#Opinion: The fact that Western media have not praised China’s decision to change anti-epidemic course, but only launched new attacks attempting to frame the situation as a catastrophe, shows how politically motivated this narrative truly is. https://t.co/h2nJN6TIes",globaltimesnews,en,China
20221215,1603370212564213760,"Foreign investment in China’s securities market showed a net increase in November, while net inflow of #FDI accelerated compared with previous month, a #SAFE official said on Thursday.
https://t.co/FccPRHfOYE",globaltimesnews,en,China
20221215,1603365033148194816,"Optimization of COVID-19 response in China is a ""game changer,"" paving way for ""more optimistic"" outlook in 2023: Clas Neumann, chairman of German Chamber of Commerce in China https://t.co/dDLjboOMjC",globaltimesnews,en,China
20221215,1603354950716690432,"China's Foreign Ministry on Thu urged the US to stop politicizing and weaponizing economic and trade issues, after reports of the US' plan to remove some Chinese firms from a red flag trade list. https://t.co/IrMQfuV5xf",globaltimesnews,en,China
20221215,1603324304497987584,"Some 126 enterprise from Hangzhou, East China’s Zhejiang Province, on Thur headed for Dubai to attend a trade exhibition, aiming to boost #exports. In 2023, over 3,000 Hangzhou enterprises will attend more than 100 overseas expos in 150 batches: Hangzhou Fabu https://t.co/osmTMlXRPd",globaltimesnews,en,China
20221215,1603324104366755841,"China, the EU and Russia criticized US’ decoupling moves at a WTO meeting on Wed, showing that those with a sense of justice all oppose to US hegemony, the Chinese FM said on Thurs, urging the US to correct its mistakes, abide by WTO rules.
https://t.co/Gnv3hJbaLl",globaltimesnews,en,China
20221215,1603318832864538624,"""#BRI debt trap"" hype aims to paint China as an unreliable partner, lays bare empty US commitments to Africa: African scholar https://t.co/Ul8mxEFkCL",globaltimesnews,en,China
20221215,1603314969751478272,"#China urges #US to stop taking discriminatory and unfair practices against specific Chinese enterprises, and stop politicizing and weaponizing economic and trade issues, #FM spokesperson comments on US planning to remove some Chinese firms from a red flag trade list. https://t.co/ibciVfzcMS",globaltimesnews,en,China
20221215,1603314751240802304,"There is no essential difference between the main virus variants BF.7 in Beijing and BA.5.2 in Guangzhou, S. China’s Guangdong Province: Zhong Nanshan",globaltimesnews,en,China
20221215,1603314628347691010,"Risk of reinfection with #COVID19 within a year decreases significantly after being infected with Omicron once, antibodies produced by which are equivalent to an inoculation of vaccine: China’s top respiratory disease expert Zhong Nanshan https://t.co/0LNZLb63wK",globaltimesnews,en,China
20221215,1603287642757795841,"China’s new-energy products saw high growth in November despite COVID-19, with the output of NEV up 60.5% y-o-y, demonstrating the resilience of the country’s industrial economy: NBS on Thu
https://t.co/4Tz5sBb0G7",globaltimesnews,en,China
20221215,1603270258953158661,"36 deputies were elected on Thursday to the 14th National People’s Congress, China’s top legislature, after 1,273 members of the Election Council cast their votes, according to a presidium meeting of the Conference for Electing Deputies of the HKSAR https://t.co/E7zJksqHZh",globaltimesnews,en,China
20221215,1603269523427463168,"China has urged UK to stop sheltering anti-China rioters who took part in a violent disruption against Chinese Consulate General in Manchester, and fulfill its obligations to protect Chinese consulate premises and personnel. https://t.co/s1Wh5PMCFc",globaltimesnews,en,China
20221215,1603269265909780481,"China will move toward downgrading #COVID19 management to Class B control measures as the virus cannot be removed, with a focus on reducing severity of symptoms, which is an important mission: academician Gao Fu https://t.co/iCDEG5MfQu",globaltimesnews,en,China
20221215,1603240642821632000,"#China’s national economy has withstood multiple pressures from domestic and international factors beyond expectation of onlookers, sustaining recovery momentum and performing within the reasonable range in November. https://t.co/L4uKzWGcfm",globaltimesnews,en,China
