Datetime,Tweet Id,Text,User Name,Language,GPE
20221201,1598372207725772800,"Chinese experts criticized Japan on Thu after it expressed ""severe concerns"" over China-Russia joint air patrol, and urged Japan to listen to its domestic rational voices on China rather than ending up in a worse situation. https://t.co/QJBs29t9jK https://t.co/OiSXlvpwJo",globaltimesnews,en,Russia
20221202,1598618006925758465,"More Chinese yuan is expected to be used in cross-border settlement between China and Russia, further promoting yuan's internationalization process, says Chinese expert 
https://t.co/LpfWD2nYW4",globaltimesnews,en,Russia
20221203,1598905379710472192,"The Yangtze River crossing tunnel project of China-Russia Eastern Gas Pipeline, a key project for the pipeline, has successfully crossed the Yangtze River after 28 months of construction, creating necessary condition for the early completion of the pipeline: PipeChina https://t.co/3cizpY90Yu",globaltimesnews,en,Russia
20221204,1599368030416273408,A key construction project of the China-Russia east-route natural gas pipeline was completed on Saturday. It will allow Russian gas to cross the Yangtze River to reach Shanghai. https://t.co/RRJ8hbllut,globaltimesnews,en,Russia
20221205,1599682715766652928,"Energy cooperation between China &amp; Russia is based on mutual respect, mutual benefit and win-win results; all parties should make constructive efforts in securing global energy supply, Chinese FM said in response to whether China would join the price cap on Russian oil. https://t.co/HfzJ7Q4bDQ",globaltimesnews,en,Russia
20221206,1600153949654302722,"As Russia has warned on Mon to respond to a Western price cap on its crude oil, an initiative led by the US and endorsed by the G7 and allies to curb Russia’s income, Chinese experts pointed out that the price cap would bring limited losses for Russia.
https://t.co/zuGPrB3uPk",globaltimesnews,en,Russia
20221207,1600530195467108352,"Newest phase of the China-Russia east-route natural gas pipeline between Tai’an city, Shandong Province, and Taixing city, Jiangsu Province, entered operation Wednesday, channeling natural gas from Siberia to the Yangtze River Delta. 
https://t.co/YAhqA1F1ku",globaltimesnews,en,Russia
20221212,1602333417789542400,"#Opinion: Merkel’s recent confession about the Minsk agreements proves that the West is only exhausting Russia through protraction efforts. It has never really genuinely regarded Russia as a dialogue partner. 
https://t.co/r2XYpUQnMq https://t.co/MRLZBudABD",globaltimesnews,en,Russia
20221214,1603097489736966146,"When US Defense Secretary Lloyd Austin warned African leaders that “China and Russia were destabilizing Africa,” he probably forgot about the pain &amp; chaos the US has brought to the continent, and how much infrastructure China has built for Africa: experts
https://t.co/EeycrNScuc",globaltimesnews,en,Russia
20221215,1603324104366755841,"China, the EU and Russia criticized US’ decoupling moves at a WTO meeting on Wed, showing that those with a sense of justice all oppose to US hegemony, the Chinese FM said on Thurs, urging the US to correct its mistakes, abide by WTO rules.
https://t.co/Gnv3hJbaLl",globaltimesnews,en,Russia
20221217,1604082893709774848,"US prolongs Russia-Ukraine conflict for three aims, aggravates nuclear war risk: experts at #2023GlobalTimesAnnualConference https://t.co/fT93otZN2B",globaltimesnews,en,Russia
20221217,1604022270686818304,"Threre are 3 major uncertainties in future Russia-Ukraine conflicts: extended direct military confrontation between Russia and NATO members, nuclear contamination crises in Ukraine, and Russia forced to use nuclear weapons: Zhu Feng, a professor at Nanjing University https://t.co/DsLTBlAreH",globaltimesnews,en,Russia
20221217,1604020061186199552,"The US &amp; EU have not made substantial efforts to ease Russia-Ukraine conflict, but even in the opposite direction by providing weapons and ammunition. The key to solving it lies in their hands: Zhou Li, former vice minister of the Intl Department of the CPC Central Committee https://t.co/0cIivfoWXF",globaltimesnews,en,Russia
20221217,1604011660024610818,"The US has 3 goals in the Russia-Ukraine conflict: to comprehensively weaken Russia, to stabilize the regime in Ukraine and to push Europe to follow US policies, said Wu Xinbo, an international studies expert at Fudan Univ, at the #2023GlobalTimesAnnualConference https://t.co/lNXLTCKXpY",globaltimesnews,en,Russia
20221217,1604005503587061760,"The conflict between Russia &amp; Ukraine is a typical proxy war. The prolonged conflict in Ukraine is inevitable, and its impact on the world will further increase, Zhu Feng, a professor of intl relations at Nanjing University, said at #2023GlobalTimesAnnualConference https://t.co/uuTxBucNnz",globaltimesnews,en,Russia
20221217,1603938843119718400,"Russia-Ukraine conflict is not only the biggest international political event this year, but the biggest since the end of the Cold War. It brings shock to the very foundation of the American system, Jin Canrong, a prominent Chinese expert, told  #2023GlobalTimesAnnualConference https://t.co/Pp6shenRFC",globaltimesnews,en,Russia
20221218,1604467352241770496,"In the 10th month of the Russia-Ukraine conflict when military operations are scaling down in freezing winter, observers see slim chance of negotiations for peace in near future as neither side is ready to compromise to figure out common ground to talk. https://t.co/9mOXlwRr1z",globaltimesnews,en,Russia
20221219,1604753720184827904,"China and Russia will hold joint naval exercise ""Naval Interaction-2022"" from Dec 21 to 27 in the East China Sea: Russian Defense Ministry https://t.co/wGw8s0LHyu",globaltimesnews,en,Russia
20221220,1605214417628499968,"#Opinion: The key to solving the Russia-Ukraine conflict lies in the hands of the US &amp; EU. Right now, we must be vigilant against a protracted and expanded conflict between Russia and Ukraine, experts said at #GlobalTimesAnnualConference. https://t.co/FS1hkNsfsf",globaltimesnews,en,Russia
20221220,1605194853813407744,"The China-Russia joint naval drill comes at a complicated time when the US keeps promoting its Indo-Pacific strategy and Japan has broken away from its defense-only principle, with tensions remaining high in the Taiwan Straits.
https://t.co/kT4aoJS3Mz",globaltimesnews,en,Russia
20221220,1605194777288671232,"China and Russia will hold a week-long joint naval drill in the East China Sea starting Wednesday in a move which analysts said displays the two countries’ capabilities in tackling maritime security threats and safeguard peace&amp;stability.
https://t.co/kT4aoJB0Kz",globaltimesnews,en,Russia
20221220,1605006872452694016,China and Russia will hold Naval Interaction-2022 military drills from Dec 21 to 27 in waters to the east of Zhoushan to Taizhou based on the annual military cooperation schedule: Chinese Defense Ministry https://t.co/Ron1dHePOw,globaltimesnews,en,Russia
20221221,1605684547177353216,"#环球时报Editorial: From China-Russia cooperation, what the US and the West read should not be ""threats,"" but the proper way to get along.
https://t.co/QZrSDwYlEa https://t.co/8knfiZRM11",globaltimesnews,en,Russia
20221221,1605597379670839296,"#环球时报Editorial: China and Russia have the right to hold joint military exercises, so they should do so aboveboard with confidence.
https://t.co/QZrSDxfWvI https://t.co/8jvGJF0m64",globaltimesnews,en,Russia
20221221,1605581979209957377,"Chinese President Xi Jinping on Wed met with United Russia party chairman Dmitry Medvedev, as the two highlighted high-level China-Russia ties and talked about the Ukraine crisis, with experts expecting the move could promote progress of peace talks.
https://t.co/5kWsgDhdWE",globaltimesnews,en,Russia
20221221,1605554967946878977,"Analysts believe that Zelensky's first known foreign visit since the Russia-Ukraine conflict aims to rally more military support from the US. As battlefields in certain areas become more intense, prospect of reaching a peaceful settlement becomes slimmer. https://t.co/DczTXSXnGO",globaltimesnews,en,Russia
20221221,1605537984601722882,"China and Russia on Wed launched the Joint Sea 2022 naval drill in the East China Sea, a move that experts said reflected mutual trust &amp; will further promote their capabilities in jointly dealing with maritime security threats. https://t.co/00jCAKDSPq",globaltimesnews,en,Russia
20221221,1605486117997813760,Xi asked Medvedev to convey his greetings and best wishes to President Putin and expressed that China is willing to work with Russia to develop bilateral relations and jointly promote the development of global governance in a more just and reasonable direction.,globaltimesnews,en,Russia
20221221,1605486055754440704,"Xi Jinping, general secretary of the CPC Central Committee and Chinese president on Wednesday met with Dmitry Medvedev, Chairman of the ruling United Russia Party, who visited China at the invitation of the CPC. https://t.co/whrQw5QETL",globaltimesnews,en,Russia
20221222,1605931590600691712,"… and since Russia is also preparing for long-term conflict and Ukraine has gained continuous support from the West, the crisis is still far from a peaceful solution, despite all parties saying that they are willing to negotiate.
https://t.co/5Pgp2SpzyG",globaltimesnews,en,Russia
20221222,1605931553808191488,"Zelensky’s visit to Washington shows that he was making great efforts to make “supporting Ukraine to fight Russia” an “unchallengeable political correctness” in the US, while the two parties have shown different opinions recently, said analysts… https://t.co/5Pgp2SpzyG https://t.co/5vBCLoJY7X",globaltimesnews,en,Russia
20221222,1605907549760286721,"#Opinion: The Russia-Ukraine conflict is bound to become more brutal, intense, and prolonged as the US increases its support for Ukraine. With the risk of spillover of the war, the world, already in crisis, is unlikely to see peace soon in the new year. https://t.co/KVOdSwxLk6",globaltimesnews,en,Russia
20221222,1605767586246930433,Video: China and Russia started Joint Sea 2022 naval drill on Wednesday https://t.co/00jCAKDSPq https://t.co/HRUDAPSddL,globaltimesnews,en,Russia
20221225,1607042830844985345,"#GTGraphic: A survey conducted by GT Research Center has found that the relations with Russia, EU and SE Asia are becoming the top 3 important bilateral ties, and the China-US relations have dropped to No. 4 compare to the 2021 data. Check out the graphic for more: https://t.co/KyUv6vLRAf",globaltimesnews,en,Russia
20221225,1607021255869489153,"The survey has found that the relations with Russia (58.4 %), Europe (45.9 %) and the SE Asia (39.7 %) are becoming the top important ties with other countries or regions; the China-US relations have dropped 5 percentage points compare to the 2021 data. https://t.co/7QqD5SWX0p",globaltimesnews,en,Russia
20221225,1607020819435380737,More than 66 percent of Chinese participants of a survey conducted by the GT are optimistic of the international environment that China will face in the future. Many also say China's ties with Russia are very important. https://t.co/58HNJbVLk2,globaltimesnews,en,Russia
20221225,1607000213042130944,"Overall successful diplomatic work helped #China navigate complex global and regional issues, advance some consensus and strike a balance in maintaining strategic stability in relations with other major countries such as the #US and #Russia: experts https://t.co/x4PEsF4FPi",globaltimesnews,en,Russia
20221225,1606846172597227525,"Wang said that China-Russia relations, which are based on non-alignment, non-confrontation and non-targeting of any third party, are as firm as a rock, are not subject to disturbances or provocations and are not afraid of changes in the world. https://t.co/EyqN7AUR9p",globaltimesnews,en,Russia
20221226,1607398329247219719,"Chinese yuan has surpassed euro in the foreign exchange settlement of Russian SMEs, a survey conducted by Russia's PSB reads. It’s a trend that experts said will be further expanded as the bilateral trade is expected to hit a record $200 billion this year. https://t.co/qwchJ36bow",globaltimesnews,en,Russia
20221226,1607374109733974016,"As Russia and Ukraine recently accused each other of having no sincerity for negotiations to end their conflict, analysts said the Russia-US confrontation and the military conflict in Ukraine could further escalate in 2023.
https://t.co/n7pfsNLwhl https://t.co/7KVhDRYqqD",globaltimesnews,en,Russia
20221227,1607751763779784704,"#China and #Russia completed all set goals of the exercise. #JointSea2022 has further deepened friendship of two countries, promising broader prospects for pragmatic cooperation between the two naval forces: Chinese executive director",globaltimesnews,en,Russia
20221227,1607751523802710016,#China and #Russia naval forces successfully concluded their week-long joint drills in the East China Sea on Tuesday. Actual combat performances and innovation were highlighted during #JointSea2022: Chinese commander https://t.co/fVWPxr4oCF,globaltimesnews,en,Russia
20221227,1607713686298451969,"In an epitome that highlights a busy year of missions and development, the PLA carried out intensive drills in Dec, including China-Russia naval drill, far sea training of Liaoning aircraft carrier group &amp; the record-breaking drill around Taiwan island. https://t.co/Z7z7gVaEUn",globaltimesnews,en,Russia
20221227,1607646848877006855,"The China and Russia Joint Sea 2022 naval drills wrapped up in the East China Sea on Tue. The two navies sailed in separate directions to mark the conclusion of the drills. Launched on December 21, the drills aimed to enhance joint safeguarding of maritime security. https://t.co/D1mQCZQLN3",globaltimesnews,en,Russia
20221228,1608145458958069763,"Will 2023 be more peaceful than 2022 or will the world embrace another year of conflicts and uncertainties? Chinese experts believe it's unlikely the #Russia-#Ukraine conflict will end, which could turn into direct US-Russia confrontation. https://t.co/NcFD8kuWgH https://t.co/TpbisK1iWA",globaltimesnews,en,Russia
20221228,1608133222998872067,"#Opinion: NATO's intent is to crack Belgrade down by backing Kosovo. As Serbia maintains close ties with both Russia and China, two of Washington's top rivals, the country has long been a thorn of the US.
https://t.co/3b0Soq7rWz",globaltimesnews,en,Russia
20221229,1608374265996509187,China-Russia Joint Sea 2022 naval drill displayed the two countries' resolve and capabilities in jointly safeguarding peace and stability in the region and around the world: Chinese Defense Ministry https://t.co/Un841HFxqt,globaltimesnews,en,Russia
20221230,1608871020785729537,#Opinion: The China-Russia strategic cooperation meets the needs of the two countries and the current international situation. It is expected that China-Russia ties will bring more prosperity and stability to the world in 2023. https://t.co/6IW9GxiLxU,globaltimesnews,en,Russia
20221230,1608845962126184453,"Chinese President Xi Jinping met on Friday with Russian President Vladimir Putin via video link. Experts said China-Russia ties have a broad, solid and profound foundation on a strategic level. https://t.co/Wnis1v7Pvd",globaltimesnews,en,Russia
20221230,1608793522949484544,"China and Russia should stay true to the original aspiration of cooperation, maintain strategic focus, strengthen strategic coordination, continue to be each other's development opportunity and global partners, bring both peoples benefit and inject stability into the world: Xi https://t.co/FvEHzspTE6",globaltimesnews,en,Russia
20221230,1608793184662097920,China is ready to work with Russia to actively promote BRICS membership expansion and safeguard the common interests of emerging markets and developing countries: Xi https://t.co/l82ZSCHeql,globaltimesnews,en,Russia
20221230,1608792535912284160,China and Russia should increase mutual support on issues concerning each other's core interests and work together to resist interference and sabotage by external forces: Xi,globaltimesnews,en,Russia
