Datetime,Tweet Id,Text,User Name,Language,GPE
20221201,1598421688097579026,"Opinion: It is understandable that some US politicians may soften their tone to appease the market at time when the US is facing serious economic headwinds, but China will follow its own rhythm in modernizing its strategic industries. https://t.co/xXlkAM08eu",globaltimesnews,en,China
20221201,1598406580935876608,"With the 2022 Qatar World Cup in full swing, E. China’s Qingdao city proposes actively bidding for major international competitions such as the Club World Cup and the #WorldCup, as well as Chinese Football Association series events on Wed. https://t.co/OQNfzfZXEk",globaltimesnews,en,China
20221201,1598391486415966209,"#GTVoice: When Western media outlets warned about the so-called impact of China's anti-COVID-19 measures, investors appeared optimistic, an ironic contrast that reveals the real level of market confidence in the Chinese economy amid Western badmouthing. https://t.co/WkBRJ24JAX",globaltimesnews,en,China
20221201,1598372207725772800,"Chinese experts criticized Japan on Thu after it expressed ""severe concerns"" over China-Russia joint air patrol, and urged Japan to listen to its domestic rational voices on China rather than ending up in a worse situation. https://t.co/QJBs29t9jK https://t.co/OiSXlvpwJo",globaltimesnews,en,China
20221201,1598366314598318080,"Experts said Michel's visit represents EU's desire to remain engaged with China and clarify misunderstandings face-to-face, and aims to consolidate the momentum of stabilizing China-EU relations.
https://t.co/xQ91htUStQ",globaltimesnews,en,China
20221201,1598360715534163968,"#环球时报Editorial: As ""two major forces for world peace, two major markets for common development, and two major civilizations for human progress,"" the importance of China-Europe relations is not only reflected in the economic and trade cooperation. 
https://t.co/oXmMJ1A5Af https://t.co/yRB3e3ZPIx",globaltimesnews,en,China
20221201,1598338702606237701,"#China's tea-making techniques and their associated social practices successfully became #UNESCO's latest world intangible cultural heritage, encouraging the world to keep falling in love with Chinese #tea. https://t.co/kLgJDkxqUR",globaltimesnews,en,China
20221201,1598338504693796864,"Several Chinese cities report year-on-year declines in new HIV/AIDS cases this year on Thursday, the 35th World AIDS Day, under the theme of fighting #AIDS and sharing health together in China. #WorldAIDSDay https://t.co/YygjPeo25N",globaltimesnews,en,China
20221201,1598336734785597441,"What I talk about when I talk about reading in China? In recent years, books on humanities and social sciences have gained wider popularity. Bookstores and publishers are feeling the diverse needs of the vibrant Chinese readership.
https://t.co/D11iW3OAwM",globaltimesnews,en,China
20221201,1598322736165789702,"#Opinion: Some US elites have a shameless double standard: They condemn and even sentence those who incite violence in the US to long prison terms; but when it comes to anti-China disruptors, they spare no effort to defend them.
https://t.co/BY3LD4FRpa",globaltimesnews,en,China
20221201,1598312648575180800,"China's #capital markets stage rally on Thu, as investors anticipate rebound in #consumption following optimizing of #COVID19 measures in multiple cities. https://t.co/VxIh3VePar",globaltimesnews,en,China
20221201,1598308433257717761,"#GTCartoon: US hypes ""China threat"" to justify its nuclear expansion. @_ValiantPanda_ https://t.co/wTR4ZvMYph",globaltimesnews,en,China
20221201,1598301825371107328,"The EU is willing to work with China to continue to push forward the Comprehensive Agreement on Investment and boost stability and mutual trust on supply chain issues, said President of the European Council Charles Michel.
https://t.co/5q71czDSlh",globaltimesnews,en,China
20221201,1598294440292278272,"China's factory activity picked up slightly in Nov but remained in contraction, while firms showed optimism for improves businesses: private survey https://t.co/T1pwRZ3oHw",globaltimesnews,en,China
20221201,1598290849569591297,China is willing to join hands with Pakistan to ensure that energy projects being built under the China-Pakistan Economic Corridor (CPEC) will be completed on schedule. https://t.co/SuO2Ry323o,globaltimesnews,en,China
20221201,1598284651822714880,"As inflation outpaces wage growth in the US, the traditional shopping season at the end of the year seems to have lost steam, with spending per consumer falling sharply. Meanwhile, Made-in-China clearly remains indispensable for US consumers. https://t.co/cunCqRmggc https://t.co/qq9ZOOhXJW",globaltimesnews,en,China
20221201,1598276624344297473,"FM slams US smearing of China's efforts in epidemic control, saying China is sharing a big market with the world, and providing cost-effective products with stable industrial &amp; supply chains, citing data such as China's foreign trade in goods rising 9.9% from Jan to Sep. https://t.co/Oeh4XnU9Jr",globaltimesnews,en,China
20221201,1598225570365845506,"The China-EU investment agreement is a balanced, high-level, mutually beneficial &amp; win-win pact, which bodes well for China, EU and the world. China and the EU should strive for deal signing and application, to benefit asap the businesses and people on both sides: MOFCOM https://t.co/g0Gl7dXG03",globaltimesnews,en,China
20221201,1598223712251432960,"Challenging US' Inflation Reduction Act (IRA) is an exercise of China’s rights as a WTO member, MOFCOM said, explaining Chinese delegation expressed concern over distorting trade subsidies contained in IRA &amp; measures that disrupt global semiconductor industry at #GATT. https://t.co/jj8yc0q6BT",globaltimesnews,en,China
20221201,1598221938945855494,"China has carried out regular communication with foreign business chambers and  timely responded to their reasonable requests in making business operation more convenient, Ministry of Commerce said in a reply to EUCCC’s advice on improving anti-COVID measures. https://t.co/UsjMHUzxH3",globaltimesnews,en,China
20221201,1598207360526610432,"EU sticks to strategic autonomy, upholds one-China policy, respects China’s sovereignty and will not interfere in China’s domestic affairs, said Michel, adding that EU is willing to strengthen communication with China on better coping with energy crisis and climate change.",globaltimesnews,en,China
20221201,1598205910194999297,"Michel’s visit reflects EU's good will to develop ties with China. It's in common interest of China, Europe &amp; intl community to keep China-Europe ties forward. The more turbulent world is, the more prominent global challenges are, the more significance China-Europe ties show: Xi",globaltimesnews,en,China
20221201,1598186603717234688,Hangzhou in East China's Zhejiang Province saw this winter's first snowfall on the last day of November that extended to the first morning of December today. Enjoy the spectacular snowfall at the West Lake. https://t.co/CyMB8O1fTY,globaltimesnews,en,China
20221201,1598161172779642880,"China’s CNOOC purchased a 5% stake of Búzios oil field, world’s largest deepwater oil field in Brazil operated by Petrobras, to become its largest corporate partner with daily crude oil output of 600,000 barrels, China News Agency reported on Thu. https://t.co/IfaG21CEn0",globaltimesnews,en,China
20221201,1598156880870014976,"China’s express delivery volume crossed 100 billion pieces on Thursday, reaching the same level of 2021 seven days earlier, demonstrating the strong resilience of the industry development，said State Post Bureau. https://t.co/CTnnnLf9W8",globaltimesnews,en,China
20221201,1598141932588642304,"China’s two #stock markets surge at opening on Thu as many places in China start to implement flexible #coronavirus response measures. The Shanghai market increased 1.16%, while Shenzhen market rose 1.57%. Liquor and tourism stocks surged more than 2%. https://t.co/HlOeB7dzPb",globaltimesnews,en,China
20221201,1598138951604502530,"Before the start of the second day of the meeting of NATO FMs in Bucharest, Hungarian Foreign Minister Peter Szijjarto warned NATO against turning into an anti-China bloc as the global security situation is already tense, Sputnik News reported.
https://t.co/YU3VTbr8oJ",globaltimesnews,en,China
20221201,1598137815216558082,"China's Caixin/Markit services #PMI hit 49.4 in Nov, up from 49.2 in the previous month, beating expectations. https://t.co/0XMbWoiA3Z",globaltimesnews,en,China
20221202,1598727444059389952,"Developing ties with China is actually the better way for EU to reduce its dependency on US and diversify its economy. However, the US has increased its attempts to force the EU to join its anti-China fleet: expert https://t.co/i1LAyGyU2R",globaltimesnews,en,China
20221202,1598720868708151296,"""China challenge"" will not help US, France, or EU resolve their tensions. The US wants to create rivalry, forcing all sources to flow to US and sacrificing the interests of its allies to suit the US strategic appeal: expert https://t.co/i1LAyGR3gZ",globaltimesnews,en,China
20221202,1598716119413555203,"China's #Shenzhou14 crew have completed all the assigned tasks for their 6-month stay in space and will return to Earth in the near future. They will return to the Dongfeng landing site, which completed the last full-system drill on Thu, GT learned on Fri. https://t.co/djWyQhdmQS",globaltimesnews,en,China
20221202,1598708726327713792,"From #robotics to chemical products, overseas industrial giants from different fields are expanding #production facilities in China.
https://t.co/zOksaOpeip https://t.co/MGppOYXPm1",globaltimesnews,en,China
20221202,1598708286739873794,"In its first year of service, the 1,035-kilometer-long China-Laos Railway has indirectly created more than 100,000 jobs, transported 11.2 million tons of cargo and seen 8.5 million passenger trips, defying critics.
https://t.co/hadWLnmgvH",globaltimesnews,en,China
20221202,1598702035985399810,"Unlike #US, which always imposes geopolitical conditions on cooperation with #Arab countries, China-Arab cooperation is reciprocal and benefits people from both sides: experts  https://t.co/bmL1emSPS7",globaltimesnews,en,China
20221202,1598698991427854336,China's central bank and forex regulator on Fri unveiled cash management rules to facilitate Panda bond sales by overseas institutions. The new regulation that comes into force on Jan 1 is the latest in a flurry of moves to continue financial opening in the bond market. https://t.co/Oc34cQPSPJ,globaltimesnews,en,China
20221202,1598686863627198464,China will brace for a slew of tone-setting meetings and economic symposiums in December and launch fifth national economic census in 2023. Meetings are expected to funnel much-needed optimism to stabilize market expectations and inject confidence. https://t.co/F8k1VIOXe2,globaltimesnews,en,China
20221202,1598670862881677312,"Given some warming signals in bilateral ties, analysts urged the Japanese government to listen to the rational voices in Japan and stop hyping the ""China threat"" theory or provoking China on its core interests. https://t.co/tNipULLuQV",globaltimesnews,en,China
20221202,1598657802041716736,"Chinese FM urges US to perceive China correctly and follow through on President Biden’s commitment of not seeking decoupling from China, halting China’s economic development or containing China. https://t.co/6awgyd3fKm",globaltimesnews,en,China
20221202,1598644318377418753,"#GTGraphic: Dec 3 marks the 1st anniversary of the operation of the China-Laos Railway. Through the railway:
- Over 8.5 mln passengers trips have been made;
- 11.2 million tons of cargo have been shipped;
- 25 provincial-level regions in China have operated intl freight trains https://t.co/J5KSBzMa2L",globaltimesnews,en,China
20221202,1598637232864505856,China's top securities watchdog gave greenlight to trading of industrial silicon futures and options in Guangzhou Futures Exchange on Friday to improve the price formation mechanism of vital new-energy feedstock. https://t.co/2vviduq0uN,globaltimesnews,en,China
20221202,1598637036457857027,"#Opinion: It is important for British politicians to remember that the ""golden era"" has delivered enormous benefits for China and the UK. It is not a favor granted by one side to the other, but a remarkable outcome of cooperation based on mutual respect.
https://t.co/rzKlJPcdiv https://t.co/5hAt8LTsnf",globaltimesnews,en,China
20221202,1598625067105034240,#China and #Arab nations encounter similar challenges &amp; opportunities. China has always seen Arab countries as strategic partners in adhering to a peaceful path of development and in jointly building a community with a shared destiny: Chinese FM. https://t.co/GTplYrJjuU https://t.co/t2WFaY1H3N,globaltimesnews,en,China
20221202,1598619517080391680,"#GTGraphic: Chinese diplomacy has featured a tight schedule in the past week. Leaders from Latin America, Europe and China’s neighboring countries paid visits. Check out this infographic for highlights of the visits: https://t.co/b0bvQW4B30",globaltimesnews,en,China
20221202,1598618006925758465,"More Chinese yuan is expected to be used in cross-border settlement between China and Russia, further promoting yuan's internationalization process, says Chinese expert 
https://t.co/LpfWD2nYW4",globaltimesnews,en,China
20221202,1598611606132645888,"China has recorded fewer marriages over recent years, with the number of Chinese people in their prime marriages falling below 12 million in 2021, a 37-year low, according to media reports. https://t.co/TTMfCsLxoO",globaltimesnews,en,China
20221202,1598592942218043393,"China doesn’t oppose the development of normal relations between the US and France, but their development of ties should not harm the interests of a third party: Zhao responds after US-France joint statement claimed “China challenge.” https://t.co/zZwlvU1xWh",globaltimesnews,en,China
20221202,1598556537534156800,The China-Laos Railway has transported a total of 8.5 million passengers and 11.2 million tons of cargos as of Friday on its first anniversary. https://t.co/BdIChOojz7 https://t.co/zucPxWyJlQ,globaltimesnews,en,China
20221202,1598546729422716928,"China's Harbin-Dalian High-speed Railway, the world's first high-speed rail line operating at low temperatures in winter, marks its 10th anniversary on Dec 1. So far it has handled 670 million passenger trips. https://t.co/xtqnxrwVQK",globaltimesnews,en,China
20221202,1598532114726547456,China has put an accommodative monetary policy in place to help with economic recovery and maximize employment: PBC Governor Yi Gang at a seminar. https://t.co/F8Z08fBOZ1,globaltimesnews,en,China
20221202,1598513457833611265,"There will be a risk of low temperature, snow and freezing weather from the north to south across China in December, and the country may face at least five cold waves, the Ministry of Emergency Management warned on Friday. https://t.co/Sj0ZrAsGAs",globaltimesnews,en,China
20221202,1598501159979081730,"China, Laos agreed that the situation in S.China Sea has remained stable. They call on all parties to continue to implement the DOC, deepen practical cooperation, reach consensus on a code of conduct at an early date &amp; build it into a sea of peace, friendship and cooperation.",globaltimesnews,en,China
20221202,1598499915944329218,"In a joint statement on deepening the building of a community with a shared future between China &amp; Laos, the two sides agreed to strengthen defense and security cooperation, maintain high-level communication between their armies at all levels and jointly safeguard regional peace. https://t.co/aZyjcdI3WA",globaltimesnews,en,China
20221203,1599054763651649537,"#Opinion: With its shady case against Meng Wanzhou, the US also made a fool out of Canada's government, and Ottawa's response is that it will go all in in following the US' confrontational approach against China. That is truly regrettable. https://t.co/kvY6rjshEz https://t.co/OUSywWvGil",globaltimesnews,en,China
20221203,1599050630483804162,"#Exclusive: Clinical trials data related to the vaccination of the CNBG’s inactivated COVID-19 doses in high-risk groups in China showed that the vaccine offers strong immunogenicity &amp; safety to the elderly, can effectively prevent severe illness &amp; death. https://t.co/SAXT6nUTxV https://t.co/vaLeO94Ud0",globaltimesnews,en,China
20221203,1599020626068447232,"At least 10 major cities across China have announced the ending of requirements for checking COVID-19 test results in public transport, and some ended such requirement at public places like pharmacies, parks, and tourist attractions. https://t.co/q59gnY9cm8",globaltimesnews,en,China
20221203,1599018111784591362,"On the first anniversary of the China-Laos Railway, check out this infographic and see the journey of vegetables and coffee beans on the landmark BRI project: https://t.co/Y3xgg0KNc9 https://t.co/Muj22g3IK1",globaltimesnews,en,China
20221203,1599009998902030337,#Opinion: More people died of COVID-19 in the US in the last three weeks than in China since the beginning of the pandemic. Fewer people have died in the whole of China than in an average US town. Here is why. https://t.co/TVIvQkuLqf,globaltimesnews,en,China
20221203,1599008047929896967,"Easing requirements for nucleic acid testing has partially contributed to the demand for self-test kits, as some residents in South China's Guangzhou began to stockpile supplies. https://t.co/q59gnXS9k8",globaltimesnews,en,China
20221203,1599003420685631488,"China-Laos Railway marks the first anniversary of its opening on Sat. Over the past year, 110,000 jobs have been created, 11.2m tons of cargo delivered, 8.5m passengers carried, and transport costs cut by 32%. https://t.co/Y3xgg0Ll1H https://t.co/WAPqHqOKrO",globaltimesnews,en,China
20221203,1598947380959006721,"China's sowing of winter wheat &amp; rapeseed has exceeded 99% and is drawing to a close, said the Ministry of Agriculture and Rural Affairs on Sat, as multiple measures are in place to protect winter crops. https://t.co/r1bpNmIMdb",globaltimesnews,en,China
20221203,1598912682362810372,"Opinion: Facing “deglobalization” and “decoupling” headwinds orchestrated by the US, it is imperative for the EU and China to stand together and say no to Washington’s attempt to debilitate our world. 
https://t.co/weTAS4woNp https://t.co/8JhOvuy5mY",globaltimesnews,en,China
20221203,1598905379710472192,"The Yangtze River crossing tunnel project of China-Russia Eastern Gas Pipeline, a key project for the pipeline, has successfully crossed the Yangtze River after 28 months of construction, creating necessary condition for the early completion of the pipeline: PipeChina https://t.co/3cizpY90Yu",globaltimesnews,en,China
20221203,1598884028127797249,"Exactly one year after the landmark China-Laos Railway started operating on Dec 3, 2021, some 11.2 million tons of cargo and 8.5 million passenger trips have been handled, while creating 100,000 jobs along the line. https://t.co/hadWLnmgvH",globaltimesnews,en,China
20221203,1598873126217355265,"The two crews of China’s #Shenzhou-14 &amp; 15 have completed the first in-orbit handover at #ChinaSpaceStation. Having completed all assigned tasks, the Shenzhou-14 crew will return to Earth on Sunday. “See you in Beijing!”
https://t.co/djWyQhdUGq https://t.co/z7Kt6PPJ5c",globaltimesnews,en,China
20221204,1599523944154923011,"#环球时报Editorial：What kind of weapons the US develops is its own business. But if its purpose is to threaten and intimidate China, it is doomed to be a daydreaming. 
https://t.co/5TUPUHFSuj https://t.co/qwEn8apnWc",globaltimesnews,en,China
20221204,1599478644442685440,"Considering Albanese’s vague&amp;cop-out remarks that will encourage the arrogance of anti-China forces in Australia, there is a big question mark hanging over Australia’s sincerity on improving its relations with China: experts https://t.co/DhKDL2jSar https://t.co/PrmIoKaCoA",globaltimesnews,en,China
20221204,1599471094926233600,"More cities in E China’s Zhejiang end regular COVID-19 tests, no longer require negative testing results and green health codes for taking public transportation and entering public venues since Mon. https://t.co/ag8k2qJCar",globaltimesnews,en,China
20221204,1599443128674848768,"New adjustment in #COVID response in #China is not “lying flat” nor a complete opening-up, but to strike a new balance between epidemic control and economic activities, being well prepared by boosting vaccination &amp; medical resources: experts 
https://t.co/XiS9c2wTrD",globaltimesnews,en,China
20221204,1599418252030988290,"#GTVoice: Western media outlets are hyping up South Asia as a “battleground,” alleging India and China have been locked in a tussle for geo-economic influence, which only reflects the West’s narrow-minded zero-sum game mentality. https://t.co/FyPO6MncMe",globaltimesnews,en,China
20221204,1599414677536407552,Chinese expert said that #China has developed a set of intangible #culturalheritage systems that have won the appreciation in the world. The heritages in China have survived and even thrived because of the support of advanced technology. https://t.co/fhGuIouWDh,globaltimesnews,en,China
20221204,1599413212700557313,"“Among all the football players I’ve met, Messi played cuju the best.” China’s ancient sport cuju, the more than 2,000-year-old prototype of modern football, debuted in Qatar as part of the football extravaganza. #Qatar2022 #QatarWorldCup2022 https://t.co/KQT0CCpQFK",globaltimesnews,en,China
20221204,1599410781644550144,"On Sun, a train loaded with a great variety of value-added goods was dispatched from Chengdu, Southwest China's Sichuan, before heading to Vientiane, Laos. Blockchain technology was applied to the international intermodal chain for the first time. https://t.co/E1EtVpdWJt",globaltimesnews,en,China
20221204,1599406582655496192,"China has whatever it takes to build a similar bomber as the B-21, experts said. China has repeatedly hinted at the development of its own next-generation bomber reportedly called the H-20. https://t.co/NenWSO24Jk",globaltimesnews,en,China
20221204,1599406523780059137,"The US’ new B-21 bomber has inherited some select strengths &amp; drawn lessons from major shortcomings of the B-2, as it can be mass-produced and is more pragmatic in major power competitions, posing new challenges to the national defense of China: analysts
https://t.co/NenWSO24Jk https://t.co/NTqO3UZFzz",globaltimesnews,en,China
20221204,1599398606142078977,"China and Laos to establish an e-commerce cooperation mechanism to promote high-quality trade, and strengthen ties in logistics, mobile payment and other fields, per MoU on E-Commerce Cooperation signed between China's commerce ministry and its Laos counterpart, MOFCOM said Sun. https://t.co/bp4o5kACa0",globaltimesnews,en,China
20221204,1599396624270528513,"Over the past decade, #snowleopards living on Mount #Qomolangma in SW China’s #Xizang have been protected through a special project combining the efforts of the government and social organizations. #COP15 #wildlifeinchina
https://t.co/WCcGfH2zDb",globaltimesnews,en,China
20221204,1599384581383553026,"After concluding 6-month stay at the China Space Station and completing first-ever direct handover with #Shenzhou15 crew, three taikonauts of the #Shenzhou14 manned spaceflight mission have safely returned to the Dongfeng landing site in the Gobi Desert. https://t.co/3XfUj9BCOd https://t.co/6e6v9ORQFC",globaltimesnews,en,China
20221204,1599378960559009792,"#Opinion: The US is not only aimed at China. Its series of moves also sowed seeds of future confrontation and conflicts among regional powers, threatening peace and stability for the region. https://t.co/ujEFmYP7JE",globaltimesnews,en,China
20221204,1599377218219970562,#Just-In: #Shenzhou14 spacecraft's return capsule conducted successful touchdown in the Dongfeng landing site in N China's Inner Mongolia Autonomous Region. https://t.co/3XfUj9BCOd https://t.co/UKZnFsFc0G,globaltimesnews,en,China
20221204,1599369325647138821,"Leaders from international organizations and experts call for open and pragmatic cooperation among countries to tackle challenges and boost global economic recovery to normal track at the International Finance Forum in South #China’s Guangdong.
https://t.co/ubwJOTjsvJ",globaltimesnews,en,China
20221204,1599368030416273408,A key construction project of the China-Russia east-route natural gas pipeline was completed on Saturday. It will allow Russian gas to cross the Yangtze River to reach Shanghai. https://t.co/RRJ8hbllut,globaltimesnews,en,China
20221204,1599356628666814464,"Negative nucleic acid test results are not required to take public transportation in Shanghai since Monday. Many other cities, such as Shenzhen in S.China’s Guangdong Province and North China’s Tianjin, also adopted similar measures. https://t.co/zakNC7OzoS",globaltimesnews,en,China
20221204,1599342984826585088,"#GTGraphic: December 4, 2022 marks China's 9th National Constitution Day and the 40th anniversary of the promulgation and implementation of the Constitution. https://t.co/HvEOPwktBL",globaltimesnews,en,China
20221204,1599327650215997440,"Li Zhendong, an engineer from State Grid Corporation of China, shares the efforts in achieving Green Winter Olympics, the technological story of 100% green energy supply during the Winter Olympics.  https://t.co/5GfmRV8f9k",globaltimesnews,en,China
20221204,1599307505641091073,"China’s securities and futures market, Interbank bond market, currency market, foreign exchange market, bill market and gold market will be temporarily suspended for 3 mins during the memorial meeting for Comrade Jiang Zemin on Tue morning: authorities https://t.co/DWX4jP5CLH",globaltimesnews,en,China
