Datetime,Tweet Id,Text,User Name,Language,GPE
20221223,1606305830197944324,"Washington is habitually turning to groundless human rights claims to justify its interference in normal business operations, experts said, slamming the latest instance of denialism as a continuation of US hostility against China. https://t.co/Vh4o1O0Yzf",globaltimesnews,en,China
20221223,1606305023666884608,"#Editorial: Every time the US has harmed China's national interests, China has launched reciprocal countermeasures in a timely manner. https://t.co/PgE7VABvwx https://t.co/Sz3cb4F5Uo",globaltimesnews,en,China
20221223,1606303619539783680,"Orders for #oximeters soared in China amid #COVID19 flare-ups, with merchants working overtime to pack and deliver products to meet surging demand, the Global Times learned. https://t.co/EIU64Rsqra",globaltimesnews,en,China
20221223,1606298576207986688,"US grills 8 major automakers on supply chain links to alleged ""forced labor"" in Xinjiang, in fresh instance of denialism amid continued hostility toward China: experts
https://t.co/Vh4o1O0Yzf",globaltimesnews,en,China
20221223,1606298231264067584,"The sanctions on Yu Maochun and Todd Stein were released under the orders of the Foreign Ministry, a rare move designed to underscore China’s firm attitude to punish anti-China figures, analysts said. https://t.co/oaKNLLGbqb",globaltimesnews,en,China
20221223,1606296070304124929,"As the host of next year's COP28 summit, the #UAE will continue to prioritize the climate agenda. Meanwhile, the UAE will also work with #China, our strategic partner, for a better and cleaner future: UAE Ambassador to China https://t.co/b7QBWMOssD",globaltimesnews,en,China
20221223,1606282227926663168,"Analysts said that the US needs to strengthen the credibility of its China policy, control the negative factors and actively maintain the trend of positive cooperation brought by the latest meeting between the heads of state. https://t.co/QNmvsQj7rP https://t.co/pBcPV3rJlc",globaltimesnews,en,China
20221223,1606281241879265281,"China remains an attractive destination for foreign investors, with the actual use of foreign investment eyeing double-digit growth in the first 11 months, highlighting China's sustained magnetic appeal for overseas capital despite global turbulence. https://t.co/vhNWWM8WES",globaltimesnews,en,China
20221223,1606281167140945920,"Chinese State Councilor and Foreign Minister Wang Yi had a phone conversation with US Secretary of State Antony Blinken on Friday, during which Wang called on the US to stop its old tricks of unilateral bullying and containing China’s development. https://t.co/QNmvsQj7rP",globaltimesnews,en,China
20221223,1606276361823215617,"Pharmaceutical companies in China are working overtime to produce drugs and gradually ease the tense demand situation as some cities show a serious shortage of medicines, Sinopharm said. https://t.co/rB8mRcFnYG",globaltimesnews,en,China
20221223,1606272949513687045,"With rising signs of a fundamental revival in consumer sentiment after 3 yrs of dealing with COVID, industry insiders and economists are deepening their faith in China’s spending power. https://t.co/LNn0bxlsEr https://t.co/o19GnYgKbi",globaltimesnews,en,China
20221223,1606265298402902016,"The Board of Governors of #IAEA adopted a resolution on the Budget Update 2023 by consensus on Fri, fully adopting China’s four-point proposal and marking the end of the nearly three-month efforts in the budget revision debate: Wang Qun",globaltimesnews,en,China
20221223,1606265235844714496,"Only by abiding by the rules can #IAEA ensure that it is moving in the right direction, whether on the Budget Update for 2023 or on other issues including #AUKUS nuclear submarine cooperation: China's Permanent Representative to UN in Vienna Wang Qun on Fri https://t.co/TBmu1YgCN6",globaltimesnews,en,China
20221223,1606205040724697088,"China, Germany have reached consensus on administering German vaccines for German nationals in China and are discussing implementation issues: Chinese FM on potential of expanding intl cooperation on vaccine. https://t.co/Tvu03Dk3sh",globaltimesnews,en,China
20221223,1606200156277411840,"China on Fri unveiled an action plan for online info governance of unlawful securities activities. Information, accounts, websites involving stock market fraudsters &amp; illegal stock advice will be handled by Mar 2023; licensed stock businesses will be mandated by Jun 2023. https://t.co/Yv935ENsZt",globaltimesnews,en,China
20221223,1606195429879664641,"#Opinion: Inconsistency of policies and practices of previous Australian govts brought confusion for China to grasp Canberra's intent. We have reason to be wary of inconsistency, which should be avoided to sustain smooth exchanges between China &amp;Australia. https://t.co/ayvyUvr99S",globaltimesnews,en,China
20221223,1606195062848774144,"Affairs in the Xizang region are #China's internal affairs and the US has no right and is not qualified to interfere; any intervention will face China's firm countermeasures, FM spokesperson said after China sanctioned two US individuals. https://t.co/8xHoFXh2Hk",globaltimesnews,en,China
20221223,1606189454598750208,"China's FDI hit $178.08 billion in the first 11 months of this year, an increase of 12.2% than the same period last year, data from MOFCOM showed; South Korea and Germany's actual investment in China increased by 122.1% and 52.6% year-on-year, respectively. https://t.co/Mrciu9QtJx",globaltimesnews,en,China
20221223,1606180238442070016,China and Switzerland have recognized the equivalence of bilateral auditing standards and supervision: Chinese finance ministry https://t.co/fz3LgeHY7y,globaltimesnews,en,China
20221223,1606169830775836672,"The US can't talk cooperation while stabbing China – this is not reasonable competition but only intensifies conflict. Such an old trick of unilateral bullying had not and will never work on China, said Wang.",globaltimesnews,en,China
20221223,1606169574868766721,"Chinese State Councilor and FM Wang Yi had a phone talk with US Secretary of State Antony Blinken on Friday, during which Wang said the top leaders' meeting last month sent positive signals but the US is calling for dialogue while at the same time trying to contain China. https://t.co/RTTEyYmenF",globaltimesnews,en,China
20221223,1606156987695124480,"China's new CR200J Fuxing bullet train made its debut on Friday, setting off from Chengdu South Railway Station at 8:40 am to Panzhihua South Railway Station. The train has a new coating and wider seats and corridors, with a capacity for 676 people. https://t.co/8Vq0V0Kmj5",globaltimesnews,en,China
20221223,1606136347034615808,"After having hibernated for seven months over winter on the Red Planet, China's Mars rover #Zhurong is about to wake up! Different from other rovers, Zhurong has the ability to automatically switch to hibernation or wake-up mode, which is vital to extending vehicle's lifespan. https://t.co/KuhTq70gIA",globaltimesnews,en,China
20221223,1606127247735156738,"China Southern Airlines starts its round-trip between Urumqi and Taxkorgan on Friday. It marks the super-high plateau airport in Taxkorgan Tajik Autonomous County, Northwest China's Xinjiang Uygur Autonomous Region, starts services. https://t.co/6VHkgfLiWQ",globaltimesnews,en,China
20221223,1606107598817837057,"Yu and Stein and their immediate family are forbidden from entering China, their assets and property will be frozen, and they will be banned from engaging in activities in China.",globaltimesnews,en,China
20221223,1606107536134115328,"Chinese FM announced sanctions on Yu Maochun, known as Miles Yu in the US, and Todd Stein as countermeasures to US’ illegal sanction on two Chinese officials citing so-called human rights issues in China’s Xizang https://t.co/3QvYl26uUU",globaltimesnews,en,China
20221224,1606673552899379201,"Xi tells the annual Central Rural Work Conference that China must go our own way instead of simply copying foreign models of modern agricultural power, and must rely on our own strength to secure people's rice bowls. https://t.co/EgH30Z3oFM",globaltimesnews,en,China
20221224,1606660598741467136,Chinese President Xi Jinping has called for enhanced efforts to build up China's strength in agriculture and do a good job in work on agriculture and rural areas at the annual Central Rural Work Conference held from Friday to Saturday in Beijing. https://t.co/EgH30ZlxTU,globaltimesnews,en,China
20221224,1606654302533332994,"Authorities in NW China’s Xinjiang region responded to a rescue call after a gold mine in the city of Yining, Ili prefecture collapsed on Sat afternoon, trapping 18 people. https://t.co/MtyYC3oPkU",globaltimesnews,en,China
20221224,1606581866383151104,"#China’s economy has passed its most challenging period, and it is expected to show overall improvement in 2023 despite an uncertain environment: senior official https://t.co/liXht6XiWD",globaltimesnews,en,China
20221224,1606560226815377408,"The resolution of the Taiwan question is the Chinese people's own business, and should be decided by the Chinese people, Taiwan Affairs Office of the State Council said in response to the US' 2023 National Defense Authorization Act that contains negative content concerning China. https://t.co/NlrMvkS0rZ",globaltimesnews,en,China
20221224,1606524028034093056,"Searches for train tickets for the first day of #China’s Spring Festival travel rush (Jan 7-Feb 15) jumped 220% hours after they came on sale, as people plan trips for family reunions and travels following the optimized anti-COVID-19 measures.
https://t.co/BM5UoAwDyB",globaltimesnews,en,China
20221224,1606515827314151424,"China deplores and firmly opposes the US' approval and signing into law the National Defense Authorization Act for Fiscal Year 2023, which contains negative content concerning China, and China has made serious démarches to the US, Chinese Foreign Ministry said Sat. https://t.co/VUMK15Q5lE",globaltimesnews,en,China
20221224,1606490578879131648,"Examinees wait in long queues at the entrance to the Yuquanlu campus of the University of Chinese Academy of Sciences in Beijing to take part in China’s national postgraduate admission examinations held from December 24 to 26.
https://t.co/Tmcdf8ZSaw https://t.co/ZEtantP6h7",globaltimesnews,en,China
20221224,1606486208485687297,"Overall medical supplies in China are sufficient and epidemic situation is controllable, FM spokesperson said on Friday, adding China continues to share related information with WHO and the international community in a responsible manner.
https://t.co/CPDWyCfOtL",globaltimesnews,en,China
20221225,1607053559119462407,"Opinion: Because China still has droves of inexpensive labor force, the optimization of epidemic response measures will release the country’s potential as the world’s quality and inexpensive production hub, which means it won’t export inflation at all.  https://t.co/7rJCAntnDV",globaltimesnews,en,China
20221225,1607051166365392897,Railway transportation in Northwest China’s Xinjiang region has completed its annual work load target at 201.3 million tons set for the year eight days ahead of schedule on Friday: report https://t.co/7hDQpHDEAd,globaltimesnews,en,China
20221225,1607048527472885766,"#GTVoice: Many have overlooked the fact that leading Chinese companies have recorded continuous progress in innovation, which is where China’s confidence lies in when it comes to recovering from the Omicron outbreak. https://t.co/SU60ICUvyg",globaltimesnews,en,China
20221225,1607033698645606402,"China's genuine openness in sharing the use of #ChinaSpaceStation greatly contrasts with and offsets the current turbulence around the world, result of US political games of forcing countries to take a side in bloc confrontation, even in space: analysts",globaltimesnews,en,China
20221225,1607032107460874241,Foreign media reported that a new and more powerful variant of China's J-20 fighter jet has appeared. Chinese analysts said that constant upgrades are expected for the stealth aircraft. https://t.co/X4x9ocVn6z,globaltimesnews,en,China
20221225,1607030500274900993,"Sixteen sports officials in S.China’s Guangdong Province, including director of the provincial sports bureau, have been punished after investigation confirmed an August football game had been manipulated. https://t.co/lg6s394aHT https://t.co/7cQOxALEFA",globaltimesnews,en,China
20221225,1607029133070196736,"As this marked the 1st time the US government will finance weapons for the island, China expressed an intense response &amp; strong opposition, and experts said that this could trigger China's firm countermeasures. https://t.co/uZHx8fEHd2",globaltimesnews,en,China
20221225,1607028120401608704,"Is the 2nd booster shot still necessary for people who have been infected with COVID-19, China's State Council joint epidemic prevention team said yes, saying the public should choose a different vaccine from the previous doses as their 2d booster shot. https://t.co/PhNCrPPMLo https://t.co/34QuDhdb2l",globaltimesnews,en,China
20221225,1607024632829468672,Agriculture expert projects #China's grain output may reach 700 billion kilograms with launch of new round of action to increase grain output by 100b jin (50b kg). https://t.co/EgH30ZlxTU,globaltimesnews,en,China
20221225,1607022523451052034,"In #creativeindustries like #art and #design, '#China chic' is trending by taking inspiration from the country's #culturalheritage while looking toward modernity, such as turning the #aircraftcarrier Shandong into a fashion icon. https://t.co/3aPqJVnNMN",globaltimesnews,en,China
20221225,1607021487663493122,"The survey also found that 66.4 % of the participants are optimistic of the intl environment that China will face in the future, with 25.3 % saying the environment will get better. 41.1 % said the environment will improve in general.",globaltimesnews,en,China
20221225,1607020968106491907,"A 120,000-kilowatt photovoltaic plant, the largest photovoltaic supply project in Southwest China’s Xizang Autonomous Region connected with the grid and began power generation on Sunday, the company said via its official Wechat account. https://t.co/dAQlkEu6RF",globaltimesnews,en,China
20221225,1607020819435380737,More than 66 percent of Chinese participants of a survey conducted by the GT are optimistic of the international environment that China will face in the future. Many also say China's ties with Russia are very important. https://t.co/58HNJbVLk2,globaltimesnews,en,China
20221225,1607018450597154816,"With #China further optimizing #COVID measures and opening up in 2023, diplomatic events led by head-of-state diplomacy will embrace a new climax with many highlights to be expected such as the Belt and Road forum and more foreign leaders' visits to China.
https://t.co/x4PEsF47ZK",globaltimesnews,en,China
20221225,1607015627180609543,"China's CDC has mapped out new monitoring mechanisms to replenish the country's epidemic reporting system, including sending out online surveys, sample surveys among certain populations, certain regions after NHC stops publishing COVID-19 daily case data. https://t.co/x1u3T1ctcK",globaltimesnews,en,China
20221225,1607001666993410050,"With daily new infections surpassing 1 mln, the #COVID19 epidemic in E. China's Zhejiang is expected to peak around the New Year's Day and enter a high-level stage with the highest daily tallies reaching 2 mln: local health authority https://t.co/cueI49t8x9",globaltimesnews,en,China
20221225,1607000213042130944,"Overall successful diplomatic work helped #China navigate complex global and regional issues, advance some consensus and strike a balance in maintaining strategic stability in relations with other major countries such as the #US and #Russia: experts https://t.co/x4PEsF4FPi",globaltimesnews,en,China
20221225,1606967095413338112,"NHC stops publishing data of daily COVID-19 case. Turning over epidemic data calculation to China's CDC, a technical organization that specializes in health data evaluation using multiple methods, is a reasonable move: Chinese CDC experts  https://t.co/x1u3T1ctcK",globaltimesnews,en,China
20221225,1606961488564228096,"Shanghai, Guangdong and Zhejiang provinces in China's coastal regions have actively rolled out measures to retain workers for ensuring business operation during the upcoming Spring Festival. https://t.co/W1SRlxuDSo https://t.co/9Qu0eaJSDi",globaltimesnews,en,China
20221225,1606920646977781760,"China has zero tolerance when it comes to the Taiwan question and anything that violates the one-China principle will be resolutely countered, said Fu Cong, head of the Chinese Mission to the EU, when addressing EU lawmakers’ visit to the island. https://t.co/oGuzAY7Qr1 https://t.co/6v8wXSLN3b",globaltimesnews,en,China
20221225,1606901939907985409,"China Sunday extended availability of domestic COVID-19 vaccine (CHO Cell) produced by Anhui Zhifei Longcom Biopharmaceutical to people aged three of above, approving the vaccine as booster shot for adults who have completed two shots of the same vaccine in six months. https://t.co/qnneGTfXtX",globaltimesnews,en,China
20221225,1606881440125562880,"China strongly urges the US to refrain from implementing the negative China-related provisions in the National Defense Authorization Act, which plays up ""China threat"" in disregard of the facts, poisons relations between the two countries and militaries. https://t.co/yx2cbQANOW",globaltimesnews,en,China
20221225,1606846272312594433,"Wang also said that China is ready to work with the EU to properly handle differences on the basis of mutual respect and equal standing, strengthen practical cooperation, and jointly form a new anchor of stability, development and prosperity across the Eurasian continent.",globaltimesnews,en,China
20221225,1606846172597227525,"Wang said that China-Russia relations, which are based on non-alignment, non-confrontation and non-targeting of any third party, are as firm as a rock, are not subject to disturbances or provocations and are not afraid of changes in the world. https://t.co/EyqN7AUR9p",globaltimesnews,en,China
20221225,1606845079129583617,Wang stressed that facts have shown that China and the US cannot decouple from each other. Playing up competition leads to nothing good and seeking cooperation is a necessity rather than a choice.,globaltimesnews,en,China
20221225,1606844963450650625,"We firmly resist the wrong US policy toward China and will work to find a correct way for China and the US to get along as two major countries, Chinese State Councilor and FM Wang Yi said on Sunday during a symposium on international relations and China's diplomacy https://t.co/lNhSEqfNrh",globaltimesnews,en,China
20221225,1606831840517840896,China’s National Health Commission (NHC) will stop publishing daily COVID-19 daily case data from Sunday. Instead the CDC will released COVID-related info for study and reference: NHC https://t.co/x1u3T1ctcK https://t.co/3JKjfE5YOH,globaltimesnews,en,China
20221225,1606831439471075328,"China lodged solemn representations over the US passage of National Defense Authorization Act, which plays up ""China threat"" theory in disregard of facts. It undermines China's sovereignty, security, and poisons bilateral &amp; military ties: Ministry of National Defense https://t.co/IrdoMgGUZl",globaltimesnews,en,China
20221226,1607458852319936515,"#China will cancel inbound quarantine for international arrivals, and vows to orderly resume Chinese citizens' outbound #travel as part of an overall plan to downgrade the country's #COVID19 management from January 8 of 2023. https://t.co/WjFuAvR9eA",globaltimesnews,en,China
20221226,1607451309761826817,"A total of 5.98 million tons of #cotton were produced nationwide in China in 2022, up 4.3% over the previous year, among which over 90% was produced in Northwest China's #Xinjiang Uygur Autonomous Region, official data showed on Mon. https://t.co/lRU0yIfyrP",globaltimesnews,en,China
20221226,1607436078570414080,"China's downgrading management of COVID-19 set in Jan doesn't mean complete relaxation of controls, it only means that managing COVID-19 will return to the medical system's jurisdiction, said health experts. 
https://t.co/ENUaVutGPV https://t.co/ikJzgQjmr6",globaltimesnews,en,China
20221226,1607431170265956355,"A new antiviral drug used for the treatment of #COVID19 was approved for clinical application in China recently. According to the developer, the drug has a wide antiviral coverage including #Delta and #Omicron strains. https://t.co/QXLvKoPHJT",globaltimesnews,en,China
20221226,1607422091992920064,"China will downgrade management of COVID-19 from Jan, scrap quarantine for intl travelers and COVID-19 cases at home. But officials said they will still keep monitoring virus and take measures to curb peak infection numbers. https://t.co/ENUaVuueFt https://t.co/YZDm88WhES",globaltimesnews,en,China
20221226,1607406073576837120,"China's top market regulator fines online academic database CNKI $12.6m, wrapping up antitrust probe that began in May. The decision is hailed as a long-awaited move to redirect CNKI away from years of abusing market dominance. https://t.co/eFg5mPI0Go",globaltimesnews,en,China
20221226,1607405897327706112,"#GTVoice: At a time when China and the US have already won hard-earned results in bilateral auditing cooperation, it is unwise for the US to signal that more political pressure may be coming for US-listed Chinese companies.  https://t.co/T4emakMydZ",globaltimesnews,en,China
20221226,1607405663877226496,"#Opinion: Some US &amp; Western media use the epidemic as an anti-China tool. Anything China does in this regard will be criticized. China's society is very resilient and it is not easy to mess up China. Their ulterior motives will turn to be wishful thinking.
https://t.co/4iF1beaB4n",globaltimesnews,en,China
20221226,1607404550545379328,China will gradually resume entry and exit of passenger transport through water &amp; land ports as well as outbound tourism in an orderly manner in light of the global epidemic situation and support capacity of all sectors. https://t.co/RnmPdBUPCu,globaltimesnews,en,China
20221226,1607404170403012608,"Data from https://t.co/Cqjso0XyEC showed that search volume for intl air tickets increased by 7 times after China scraps COVID-19 flight ban and vows to orderly resume outbound travel. The popular destinations are Thailand, Japan and South Korea. https://t.co/1YqWdpNANI",globaltimesnews,en,China
20221226,1607401227129884672,"China will not impose quarantine on personnel and commodities entering the country, and will no longer require quarantine for COVID-19 patients nor classify high-risk areas according to infection after downgrading management, said NHC.",globaltimesnews,en,China
20221226,1607396074528075778,"China is set to downgrade Class A management of COVID-19 to Class B from January 8, 2023, National Health Commission announced. https://t.co/N1G28DtCW3 https://t.co/RUHaQZhQMl",globaltimesnews,en,China
20221226,1607391033742036993,"The eight-point regulation on CPC members' work conduct spearheaded by China's top leadership yields remarkable outcome in weeding out corruption and hedonism over the past decade, advances Party's self-reform, and wins public support. #UnderstandingCPC https://t.co/BnJAHO7LRA",globaltimesnews,en,China
20221226,1607372569052868608,"Draft law on ecological conservation on the Qinghai-Tibet Plateau, draft revision to the Wildlife Protection Law &amp; Counter-Espionage Law are scheduled to be deliberated at meeting of China's national legislature on Tue https://t.co/btrKUe0JUV",globaltimesnews,en,China
20221226,1607364740552200192,"China's vast rural areas are facing challenges as people return for Spring Festival holiday amid COVID surge. To deal with possible impact on rural areas, Chinese authorities ramped up efforts to add medicine stockpiles, aiding clinics.  https://t.co/XaT1oqgqjb",globaltimesnews,en,China
20221226,1607358429127139330,"5-years-old female giant panda Xiang Xiang, one of the star attractions at Ueno Zoo in Japan, will reportedly be sent back to China on Feb 21 in order to find a partner to breed with. https://t.co/9yC9zSjJ92",globaltimesnews,en,China
20221226,1607356712557875203,"CNPC, China's leading oil and gas producer, said its oil and gas output hit new records in 2022, as the company contributed to a national energy security drive by tapping domestic resources in a year marked by geopolitical upheavals.  https://t.co/nhzfvmtUOC https://t.co/ELm92yck9P",globaltimesnews,en,China
20221226,1607350664769986560,China's publicly traded high-end manufacturing companies withstood the US trade war and tech coercion to achieve a compound revenue growth rate of 12 percent from 2017 to 2021. https://t.co/6g1Ie0xXSj https://t.co/Dn3kBYXtzx,globaltimesnews,en,China
20221226,1607300135670910976,"As a traditional friendly neighbor, #China attaches great importance to China-#Nepal relations, and is willing to work with the new government of Nepal to expand and deepen bilateral friendly exchanges &amp; cooperation in various fields: FM https://t.co/4VTdrqcM3N",globaltimesnews,en,China
20221226,1607297021261795328,"China and Fiji have a comprehensive strategic partnership based on mutual respect and common development, which has benefited both sides. China is ready to work with the Fijian govt to push forward bilateral ties for the benefit of the two countries and two peoples: FM",globaltimesnews,en,China
20221226,1607296991050203138,China congratulates Sitiveni Rabuka on his election as Fiji's new prime minister and believes that under Rabuka's leadership the Fijian government and people will make greater achievements in national development and construction: Chinese FM on Mon https://t.co/7sMzbLn967,globaltimesnews,en,China
