Datetime,Tweet Id,Text,User Name,Language,GPE
20221220,1605319646277763074,President Volodymyr Zelensky of Ukraine traveled on Tuesday to the ravaged city of Bakhmut to hand out medals to soldiers — perhaps his most dangerous trip to the front lines since the war began in February. https://t.co/YCT6dYgCcw,nytimes,en,Ukraine
20221220,1605304544409403394,"Lawmakers on Tuesday announced a deal to provide close to $50 billion in emergency aid to Ukraine in its battle against a Russian invasion, racing to commit another tranche of assistance before the start of a new Congress in January. https://t.co/q4XmKvqMQs",nytimes,en,Ukraine
20221220,1605302046810411008,"Russia’s invasion of Ukraine has taken thousands of lives and created a humanitarian crisis. It has also dealt a grievous blow to Ukrainian culture. Over 300 sites have been damaged or destroyed since the war began, a New York Times investigation shows. https://t.co/3vdYhY38vB",nytimes,en,Ukraine
20221220,1605117811583590400,"The U.S.'s Cyber National Mission Force has been supporting Ukraine with daily consultations, a move that has unearthed thousands of warning indicators of potentially compromised Ukrainian computer networks, a top U.S. cybercommander said. https://t.co/cvHnXPwwvB",nytimes,en,Ukraine
20221220,1605104339621642240,Breaking News: Lawmakers unveiled a sprawling spending bill that would keep the U.S. government open through next fall and include billions in aid for Ukraine. https://t.co/jKu9VXvCRb,nytimes,en,Ukraine
20221220,1605095675674386432,"President Vladimir Putin of Russia made a rare visit to Belarus on Monday to strengthen his bond with his closest regional ally, Aleksandr Lukashenko. The Belarusian leader has been under pressure from Moscow to provide more support for the Ukraine war. https://t.co/6xjjt0yZRJ",nytimes,en,Ukraine
20221221,1605702181008670720,"Standing with President Volodymyr Zelensky, President Biden vowed support for Ukraine for “as long as it takes.” https://t.co/JQN85scn7L",nytimes,en,Ukraine
20221221,1605679534161944587,President Volodymyr Zelensky met with President Biden at the White House on Wednesday — his first trip outside of Ukraine since Russia’s invasion began in February. https://t.co/CBp4yCA6TF https://t.co/W5OfUUXGqy,nytimes,en,Ukraine
20221221,1605651844247834624,"President Volodymyr Zelensky of Ukraine arrived at the White House on Wednesday to meet with President Biden for what would be two hours of closed-door meetings, officials said. https://t.co/bcTOmyOAS9",nytimes,en,Ukraine
20221221,1605631743515557903,"President Volodymyr Zelensky of Ukraine's entanglement in American politics started with Donald Trump. In 2019, Zelensky became a household name in the U.S. when a phone conversation he had with Trump helped trigger his first impeachment. https://t.co/QFq3DvWe7a",nytimes,en,Ukraine
20221221,1605616634210799617,When President Volodymyr Zelensky of Ukraine addresses Congress on Wednesday he will be facing an audience that includes many Republican lawmakers hostile to authorizing more money for military and humanitarian aid for his country — if they show up. https://t.co/RNRJPLI4RS,nytimes,en,Ukraine
20221221,1605597745095614465,"President Vladimir Putin directed Russia’s military to overcome its equipment problems and assented to an increase in the size of the country’s armed forces, his latest effort to show that he has no intention of giving up in the war in Ukraine. https://t.co/ceC8AyTW65",nytimes,en,Ukraine
20221221,1605590184950697984,"""This will be a day to remember in the history of the United States Congress,"" Senator Chuck Schumer, the majority leader, said in remarks on the Senate floor about President Volodymyr Zelensky of Ukraine's visit to Washington.

Follow live updates: https://t.co/sdcWJPpEPo https://t.co/MoKAoOV6ZQ",nytimes,en,Ukraine
20221221,1605566594305884161,"President Volodymyr Zelensky is visiting Washington in his first trip abroad since Russia’s invasion. He is expected to speak about the U.S. role in strengthening the “resilience and defense” of Ukraine, officials said.

Follow updates.
https://t.co/QuOSMxXp1h",nytimes,en,Ukraine
20221221,1605529796448067584,"Ukraine’s prime minister said Russia wants to plunge Ukraine into total darkness during the holiday season, and warned members of the government to “prepare for new attacks.” Russian attacks have left the energy grid in a precarious state, he said. https://t.co/dfu7YpuVbf",nytimes,en,Ukraine
20221221,1605458078165598215,"President Biden will announce an aid package for Ukraine that includes the most advanced U.S. ground-based air defense system, administration officials said, as part of President Volodymyr Zelensky’s expected trip to Washington. https://t.co/nFGgPTjWQe",nytimes,en,Ukraine
20221221,1605447994077319168,"President Volodymyr Zelensky of Ukraine will meet with President Biden at the White House on Wednesday and deliver an address to a joint session of Congress, officials say. The visit will be the first time he has left Ukraine since Russia invaded. https://t.co/hKt97wVbG0",nytimes,en,Ukraine
20221222,1606048659103109121,"Using exclusive phone records, documents, interviews and thousands of hours of video, our visual investigation reveals the main Russian military unit responsible for killing dozens of civilians on a single street in Bucha, Ukraine. https://t.co/U5o1oRGFK1",nytimes,en,Ukraine
20221222,1606009294943621126,Breaking News: The Senate passed a $1.7 trillion spending package to avert a government shutdown and send another round of assistance to Ukraine. https://t.co/nwIr6dca5w,nytimes,en,Ukraine
20221222,1605963160334245888,"The videos are impossible to forget: Dozens of bodies strewn along a street in Bucha, on the outskirts of Ukraine's capital.

An eight-month visual investigation shows how a Russian military unit killed dozens of civilians on a single street in the town. https://t.co/RDZW4G5aMX https://t.co/scmWYpxWj5",nytimes,en,Ukraine
20221222,1605926159224832002,"Ukraine’s fierce defense of the city of Bakhmut has become a symbol of pride and solidarity for the nation. Despite all the shelling, and with no electricity, one snack shop is still serving the soldiers and citizens who have stayed. https://t.co/Ri9TOtDKrj",nytimes,en,Ukraine
20221222,1605923406834081792,"When Russia's war in Ukraine began, residents of Bucha decided to flee with their families, protect their loved ones and search for food. Russian soldiers killed them for it.

We retraced the victims' final moments. https://t.co/kdMyIHhTfY",nytimes,en,Ukraine
20221222,1605828021683879936,"President Volodymyr Zelensky of Ukraine finished his first trip abroad since Russia invaded, heading home after asking U.S. lawmakers for more military aid. 

He will return to a frigid winter and the prospect that the war will hit a costly stalemate. https://t.co/MIH27jrLvt",nytimes,en,Ukraine
20221222,1605812931899396099,"Hours after President Volodymyr Zelensky of Ukraine pressed U.S. lawmakers for more aid, the legislation carrying nearly $50 billion in such assistance ground to a halt in the Senate because of an impasse over immigration policy. https://t.co/emhTcIKt70",nytimes,en,Ukraine
20221222,1605785242035490817,"President Volodymyr Zelensky urged Congress to continue to support Ukraine. “Your money is not charity,” he said. “It’s an investment.” https://t.co/im7GeoOBoB",nytimes,en,Ukraine
20221222,1605767623156850691,"President Volodymyr Zelensky of Ukraine spoke before a joint meeting of Congress on Wednesday night. The following is a full transcript of his remarks, as recorded by The New York Times.
https://t.co/f3wRXAMm9K",nytimes,en,Ukraine
20221222,1605738660107886592,"President Volodymyr Zelensky urged Congress to continue to support Ukraine. “Your money is not charity,” he said. “It’s an investment.” https://t.co/tVlpaFn0SA",nytimes,en,Ukraine
20221222,1605722805139546113,Watch live: President Volodymyr Zelensky is addressing a joint session of Congress to rally support for Ukraine. Follow our analysis here. https://t.co/p6ihGh1eir,nytimes,en,Ukraine
20221223,1606384166303633414,The Senate approved a spending bill which included more than $44 billion in emergency aid for Ukraine two days after President Volodymyr Zelensky of Ukraine addressed a joint session of Congress. Here is a closer look at what is in the latest legislation. https://t.co/nkZYPz6rBY,nytimes,en,Ukraine
20221223,1606311771568054275,"President Volodymyr Zelensky’s visit to Washington this week ended with promises of billions of dollars more in U.S. support for Ukraine. But he did not get what he wanted most: American battle tanks, fighter jets and long-range precision missiles. https://t.co/jMqxIWfJcn",nytimes,en,Ukraine
20221223,1606235721295183872,"President Volodymyr Zelensky of Ukraine returned to Kyiv after receiving a hero’s welcome in the U.S. and briefly visiting Poland.

“I thank President Biden for his help, his international leadership and his determination to win,” he said. https://t.co/pVdwGAE3Lw",nytimes,en,Ukraine
20221223,1606197933870915584,"France’s oldest and largest Christmas market is an extravaganza, offering everything from roasted chestnuts to jewelry. But amid soaring gas prices and the war in Ukraine, the market has faced a tough question: ""How do you balance magic and responsibility?""https://t.co/hXUOO5farK",nytimes,en,Ukraine
20221223,1606182847663964160,"President Volodymyr Zelensky’s trip to Washington buoyed morale back home in Ukraine, where millions have been left in darkness and cold from Russian missile strikes that have knocked out power.

“I am so proud to be Ukrainian,” a writer said on Twitter. https://t.co/BJl36bRQAb",nytimes,en,Ukraine
20221224,1606771266475663367,Vladimir Putin has unleashed a new disorder on the world with his war in Ukraine. Its ultimate expression may be in the Central African Republic. https://t.co/E6ksaYbJHz,nytimes,en,Ukraine
20221224,1606706280734892034,Vladimir Putin has unleashed a new disorder on the world with his war in Ukraine. Its ultimate expression may be in the Central African Republic. https://t.co/rQMfpg7Egy,nytimes,en,Ukraine
20221225,1607066191901736964,Vladimir Putin has unleashed a new disorder on the world with his war in Ukraine. Its ultimate expression may be in the Central African Republic. https://t.co/KH2f1B37MK,nytimes,en,Ukraine
20221225,1607042249853997057,"Attacks on Ukraine's energy infrastructure have left millions without power, so some cities were inventive with their Christmas decorations. 

In Kyiv, authorities put up what they called the Christmas Tree of Invincibility — powered by a diesel generator. https://t.co/BqK2CNWEwU https://t.co/ggIK5ZOlBK",nytimes,en,Ukraine
20221225,1607027150196015106,"It was like something out of a spy movie: A grass-roots resistance movement in Kherson, Ukraine, spied on, undermined and even hunted down Russian soldiers. Now that Vladimir Putin’s forces are gone, people feel free to talk — and to brag a little. https://t.co/7Wedvmx2Wl",nytimes,en,Ukraine
20221225,1607012066224734209,"As air-raid sirens sounded in cities throughout Ukraine on Christmas morning, Vladimir Putin insisted that he was willing to negotiate over Russia's invasion, an oft repeated line that U.S. and Ukrainian officials have dismissed as lip service. https://t.co/vBQBX5grU1",nytimes,en,Ukraine
20221226,1607519159654424577,"Russia said falling wreckage from a Ukrainian drone had killed three servicemen at a base, some 300 miles from Ukraine, which would be the third such long-range attack this month.
https://t.co/61PkKRPHDt",nytimes,en,Ukraine
20221226,1607276290792464384,Vladimir Putin has unleashed a new disorder on the world with his war in Ukraine. Its ultimate expression may be in the Central African Republic. https://t.co/rdLNEXthTs,nytimes,en,Ukraine
20221226,1607261179579088896,"It was like something out of a spy movie: A grass-roots resistance movement in Kherson, Ukraine, spied on, undermined and even hunted down Russian soldiers. Now that Vladimir Putin’s forces are gone, people feel free to talk — and to brag a little. https://t.co/XnK6ame94a",nytimes,en,Ukraine
20221227,1607717958889111553,"A Russian town mourns soldiers who died in Ukraine, but interviews with residents indicate that a surge of resentment against the war hasn’t materialized. https://t.co/5JvB2CZj8P",nytimes,en,Ukraine
20221228,1608081600696180736,"The U.S. has launched an effort to stop Iran from producing and delivering drones to Russia for use in the war in Ukraine, an endeavor that has echoes of its yearslong program to cut off Tehran’s access to nuclear technology.
https://t.co/gP0q7m5G9v",nytimes,en,Ukraine
20221228,1608074048382042112,"Russia launched a missile attack and nearly three dozen rockets at the southern Ukrainian city of Kherson over the past day, Ukraine's military said. Officials called on residents to evacuate the city as Moscow steps up artillery strikes. https://t.co/cx0zvAb1d2",nytimes,en,Ukraine
20221229,1608512096207077377,"Russia began a major attack on cities and towns across Ukraine, taking out the electricity out in several regions, in what appeared to be one of its biggest strikes to date on the country’s energy grid. https://t.co/LXwUcMDprb https://t.co/VafpeYjVWp",nytimes,en,Ukraine
20221229,1608440213826576386,"Of all the places transformed by the war in Ukraine, one of the unlikeliest might be Antalya, a resort city in southern Turkey, which has seen an influx of Russians and Ukrainians.
https://t.co/E3Oe6slcoI",nytimes,en,Ukraine
20221229,1608380252249624583,"Several explosions rocked Kyiv, the Ukrainian capital, on Thursday after the authorities had warned for days that Russia was planning more missile strikes on Ukraine's electrical grid. https://t.co/281gdYUbmz",nytimes,en,Ukraine
20221230,1608887713293570048,"To understand the geography of the war in Ukraine, The Times made more than one hundred maps, showed how Kyiv withstood Russia’s attacks, investigated how a Russian military unit killed dozens in Bucha — and more. https://t.co/rRgW6P7zrk https://t.co/h01MC0Tzlw",nytimes,en,Ukraine
20221230,1608887276720869376,"The invasion of Ukraine. Abortion restrictions. Fear at the Winter Games. Illegal airfields in the Amazon. The midterm elections.

This is the year in visual stories, as told by The New York Times. https://t.co/ptiyVecEH8 https://t.co/dvof4qkvOx",nytimes,en,Ukraine
20221230,1608810157382803457,"Kirill, a 24-year-old from the Moscow region, fled Russia to avoid being drafted to fight in the war in Ukraine. Today's episode of The Daily checks in with him. https://t.co/6eO69Vio25",nytimes,en,Ukraine
20221230,1608802612136009728,"As Xi Jinping and President Vladimir Putin of Russia spoke on Friday, they found themselves in positions of weakness. Isolated by its war in Ukraine, Russia needs China more than ever, but China, facing a Covid crisis, is in no position to risk sanctions. https://t.co/ctNlRedqtU",nytimes,en,Ukraine
20221230,1608783717887102976,"President Volodymyr Zelensky of Ukraine signed off on legislation that would significantly expand the government’s regulatory power over the news media, a measure that journalists have warned will erode press freedom. https://t.co/OeND4MZcmz",nytimes,en,Ukraine
20221230,1608764865182679040,"Xi Jinping, China's leader, and President Vladimir Putin of Russia spoke on Friday, a show of the countries' strong ties in the midst of international reproach over the war in Ukraine. https://t.co/aBd0wW9RMC",nytimes,en,Ukraine
20221230,1608734668764942346,"Drones and missiles rocked towns and cities across Ukraine on Thursday, the biggest assault in weeks and the latest in a wave of more sophisticated aerial duels pitting Russia’s evolving tactics against Ukraine’s growing arsenal of air defense weapons. https://t.co/uUHlnbKPdp",nytimes,en,Ukraine
