Text,Media,GPE
China condemns British lawmakers' Taiwan visit,BBCWorld,China
The young people powering protests in China,BBCWorld,China
China signals ease in Covid policy after mass protests,BBCWorld,China
China President Xi's face-saving exit from his signature Covid policy,BBCWorld,China
China President Xi's face-saving exit from his signature Covid policy,BBCWorld,China
"China tower block fire was government's fault, says victim's daughter",BBCWorld,China
Why is China struggling to vaccinate the elderly?,BBCWorld,China
Jiang Zemin: China says goodbye to former leader,BBCWorld,China
Hope and worry in Beijing as China relaxes zero-Covid policy,BBCWorld,China
Hope and worry in Beijing as key China zero-Covid policies scrapped,BBCWorld,China
Woman whose family died in tower block fire in China blames government for their death Beijing denies their zero-Covid policy is to blame,BBCWorld,China
Woman whose family died in tower block fire in China blames government for their death Beijing denies their zero-Covid policy is to blame,BBCWorld,China
What pitfalls lie ahead as China charts exit from zero Covid?,BBCWorld,China
The brothers running the entire length of the Great Wall of China,BBCWorld,China
The brothers running the Great Wall of China,BBCWorld,China
China to de-activate Covid tracking app,BBCWorld,China
US lawmakers unveil TikTok ban bill over China security fears,BBCWorld,China
India and China troops clash on Arunachal Pradesh mountain border,BBCWorld,China
China diplomats leave UK over Manchester protester attack,BBCWorld,China
'Panic-buying' and shortages as Covid restrictions in China are eased,BBCWorld,China
Shadow of 60-year-old war at India-China border flashpoint,BBCWorld,China
US charges China student with stalking peer who put up pro-democracy fliers,BBCWorld,China
"Japan to double military spending, citing threats posed by China and North Korea",BBCWorld,China
Shanghai schools to go online as Covid spreads in China,BBCWorld,China
China health expert predicts three winter Covid waves,BBCWorld,China
"The trip that transformed Australia and China ties, five decades on",BBCWorld,China
Five deaths in China from Covid under country's new counting method,BBCWorld,China
India beefs up military at tense China border,BBCWorld,China
India steps up Covid surveillance after China surge,BBCWorld,China
India steps up Covid surveillance after China surge,BBCWorld,China
Ros Atkins China’s Covid surge,BBCWorld,China
'Everyone I know is getting a fever' - Covid hits China,BBCWorld,China
Covid-19: Indians told to mask up amid China coronavirus surge,BBCWorld,China
'Everyone I know is getting a fever' - Covid hits China,BBCWorld,China
Covid-19: PM Modi cautions India amid China coronavirus surge,BBCWorld,China
China to end Covid quarantine for foreign arrivals,BBCWorld,China
China to end Covid quarantine for foreign arrivals,BBCWorld,China
"China stages big military incursion, Taiwan says",BBCWorld,China
China ends quarantine to begin reopening in January,BBCWorld,China
Covid in China: Countries tighten rules as tourism set to resume,BBCWorld,China
Fatal car crash involving over 200 vehicles in China,BBCWorld,China
Experts say Indians don't need to panic over China coronavirus surge,BBCWorld,China
EU calls screening of travellers from China 'unjustified',BBCWorld,China
