Text,Media,GPE
"Chinese courts have pledged to put greater effort into solving cases concerning monopolies and unfair competition to maintain the healthy development of capital, according to China's top court.",ChinaDaily,China
"The global biodiversity crisis is worsening and about one-fourth of species face the threat of extinction. Huang Runqiu, president and China's minister of ecology and environment, called for the international community to join hands to advance biodiversity protection.",ChinaDaily,China
Many regions across China have adjusted their control measures to reduce the impact on people's normal lives and economic activities. Here's an overview of some changes region by region.,ChinaDaily,China
China-Laos Railway opens up business opportunities,ChinaDaily,China
UK expert: China’s leveling-up a remarkable thing,ChinaDaily,China
Almost all the mother plants of European and American lilies originated from Lilium regale in China. How have plant hunters changed the distribution of plants in the world for thousands of years?,ChinaDaily,China
"Centralized quarantine for COVID-19 patients has been made voluntary and the rule requiring a negative nucleic acid test result for entry to public venues has been scrapped, as China takes ""small, yet continuous steps"" to adjust to the disease.",ChinaDaily,China
"The value of China's foreign trade grew 8.6 percent on a yearly basis to 38.34 trillion yuan ($5.78 trillion) during January-November period this year, data from the General Administration of Customs show.",ChinaDaily,China
"While countries in Asia have made it crystal-clear that they are not willing to make a choice between China and the United States, Ottawa is keen to throw its gloves into the ring in support of Washington.",ChinaDaily,China
Q&A: China further optimised its COVID-19 control policies in a 10-point notice released on Wednesday. Below are some of the key adjustments.,ChinaDaily,China
"While countries in Asia have made it crystal-clear that they are not willing make a choice between China and the US, Ottawa is keen to throw its gloves into the ring in support of Washington.",ChinaDaily,China
"Chinese President Xi Jinping arrived in Riyadh Wednesday afternoon to attend the first China-Arab States Summit and the China-Gulf Cooperation Council summit, and pay a state visit to Saudi Arabia.",ChinaDaily,China
's COVID-19 measures further optimized Here are optimized measures released by the State Council’s Joint Prevention and Control Mechanism on Wednesday.,ChinaDaily,China
China is independent enough to defy the norms of politics in the West and anchor instead on the issues that affect human lives and livelihoods the most.,ChinaDaily,China
"The number of volunteers in China has increased from 2.92 million in 2012 to 217 million in 2021, according to a blue book on China's service development.",ChinaDaily,China
"Foreign financial institutions expect further reform and opening-up of China's qualified foreign institutional investor program in the next few years, said Li Zhan, head of securities services at Deutsche Bank China.",ChinaDaily,China
"People are generally no longer required to present their nucleic acid test results or health codes when entering public places, according to China's latest guidelines on epidemic control measures published on Wednesday.",ChinaDaily,China
"China will continue to play its role of presidency of to the UN Convention on Biological Diversity to promote a successful second part of COP 15, which starts in Montreal on Wednesday, Foreign Ministry spokeswoman Mao Ning said.",ChinaDaily,China
"China strongly opposes a report on Chinese military development released by the US, which distorts China's national defense policy and military strategy, a spokesman for the Ministry of National Defense said in a statement on Tuesday.",ChinaDaily,China
"China's domestically developed boosts safe, intelligent, comfortable, convenient and green transportation development in the country.",ChinaDaily,China
"China is making what is arguably the world's biggest push to reduce the digital divide between rural and urban residents, according to experts.",ChinaDaily,China
China's PV industry on steady growth path,ChinaDaily,China
The Central Committee of the Communist Party of China (CPC) has held a symposium with non-CPC personages to solicit opinions and suggestions on this year's economic situation and economic work for the next year.,ChinaDaily,China
The Kuaizhou 11 carrier rocket model carried out its first successful flight on Wednesday morning at the Jiuquan Satellite Launch Center in northwestern China's Gobi Desert.,ChinaDaily,China
"The second phase of will be held in Montreal, from Dec 7 to 19. There were other COPs held this year too: COP 14 in Wuhan, , and COP 27 in Sharm El-Sheikh, . Is the list of COPs this year making your head spin? What does the number mean? Check it out!",ChinaDaily,China
"The Political Bureau of the Communist Party of China Central Committee convened a meeting on Tuesday to analyze and study the economic work in 2023, and make arrangements for improving Party conduct and moral integrity and combating corruption.",ChinaDaily,China
"China's foreign went up 8.6 percent year-on-year in the first 11 months of the year to 38.34 trillion yuan, customs data showed on Wednesday.",ChinaDaily,China
The Joint Prevention and Control Mechanism of China's State Council has issued a guideline on home quarantine and medical observation. The following are some highlights of the guideline. (4/4),ChinaDaily,China
The Joint Prevention and Control Mechanism of China's State Council has issued a guideline on home quarantine and medical observation. The following are some highlights of the guideline. (3/4),ChinaDaily,China
The Joint Prevention and Control Mechanism of China's State Council has issued a guideline on home quarantine and medical observation. The following are some highlights of the guideline. (2/4),ChinaDaily,China
The Joint Prevention and Control Mechanism of China's State Council has issued a guideline on home quarantine and medical observation. The following are some highlights of the guideline. （1/4）,ChinaDaily,China
Smart manufacturing promotes high-quality development in China as artificial intelligent technology starts playing a bigger role in diversified industries.,ChinaDaily,China
China's cooperation with the Arab countries still has a lot of potential to tap.,ChinaDaily,China
"Chinese experts have recently stated that the Omicron variant of has a lower chance of causing severe illness and death compared with the flu, hence China should continue to optimize its epidemic control policies.",ChinaDaily,China
"China strongly opposed a US report on Chinese military development on Tuesday. ""China is committed to the path of peaceful development and a national defense policy that is defensive in nature,"" a spokesman for the Ministry of National Defense said.",ChinaDaily,China
President Xi Jinping will attend the first China-Arab States Summit and the China-GCC Summit in Riyadh and pay a state visit to Saudi Arabia from December 7 to 10.,ChinaDaily,China
"A super-sized snowman is being built on the bank of the Songhua River in China's Harbin. It's expected to become a new landmark in the ""ice city.""",ChinaDaily,China
"As China continues to optimize its COVID-19 policies, more places are expected to ramp up foreign trade and economic development.",ChinaDaily,China
"A photo exhibition showcasing friendly exchanges and cooperation between China and Arab countries opened on Wednesday in Riyadh, Saudi Arabia.",ChinaDaily,China
"Retail sales of China's new energy passenger cars came in at about 598,000 units in November, up 58.2 percent year-on-year.",ChinaDaily,China
"China will constantly raise the competitiveness of domestic brands and promote them into world-famous brands, as more Chinese brands are going global, government officials and industry leaders said during the 2022 China Brand Forum in Beijing on Thursday.",ChinaDaily,China
"China on Thursday rolled out a scheme to guide those in need on how to properly take a COVID-19 antigen self-test, including people who want to take a test, those who work in crowded places and the elderly.",ChinaDaily,China
"Firas Fadel Hassan, the editor of United Arab Emirates News Agency who lived and studied in Beijing for 6 years, said he hopes that Chinese President Xi Jinping’s visit to Saudi Arabia will enable Arab countries, China and other countries to join hands to get through challenges.",ChinaDaily,China
"Miraz Ahmed Badrais, a Saudi Arabian girl, shared her thoughts and feelings about the relations between China and Arab countries. Watch the video to find out what local food and beautiful scenery she would like to recommend.",ChinaDaily,China
"Combating the winter chill has led to high demand for China-made electrical appliances, including blankets, heaters and heat pumps, with one report suggesting inquiries from European buyers have increased fivefold for some items.",ChinaDaily,China
President Xi Jinping is in Riyadh to attend the first China-Arab States Summit and the China-GCC Summit and pays a state visit to Saudi Arabia from Dec 7 to 10. Why are China and Arab countries holding the first summit? What can we expect from it ? Watch this video.,ChinaDaily,China
"China on Thursday voiced firm objection to the United State's two new arms sales to the region, urging Washington to stop military contacts with the island and not create new tense elements to the situation across the Taiwan Straits.",ChinaDaily,China
China's pet health market is becoming just another treasure trove of opportunities for animal medicine producers and medical care providers.,ChinaDaily,China
"Major adjustments have been made to China's control policies, according to a 10-point notice released by the National Health Commission on Wednesday. Below are some of the key changes, to help you keep up to date. (3/3)",ChinaDaily,China
"Major adjustments have been made to China's control policies, according to a 10-point notice released by the National Health Commission on Wednesday. Below are some of the key changes, to help you keep up to date. (2/3)",ChinaDaily,China
"Major adjustments have been made to China's control policies, according to a 10-point notice released by the National Health Commission on Wednesday. Below are some of the key changes, to help you keep up to date. (1/3)",ChinaDaily,China
Ice and snow are becoming a new engine for local rural revitalization and a new way for farmers to get rich in winter in Northeast China's Jilin province.,ChinaDaily,China
"Huang Runqiu, president of the 15th meeting of the Conference of the Parties to the Convention on Biological Diversity and China's minister of ecology and , talks about China's future plans on better conserving biodiversity.",ChinaDaily,China
"Public places in China should no longer require proof of negative nucleic acid testing results or check the digital health codes except for elderly care and social welfare centers, medical facilities, nursery care centers and primary and middle schools.",ChinaDaily,China
"China urged the US to stop military contacts with the region and refrain from creating tension to the situation across the Taiwan Straits, FM spokeswoman Mao Ning said after the State Department approved two new arms sales to Taiwan.",ChinaDaily,China
"China will work with Arab states to carry forward their traditional friendship; jointly build a China-Arab community with a shared future in the new era and keep expanding cooperation, President Xi Jinping said.",ChinaDaily,China
A large number of freshwater sponges have been found recently in the Xishui national nature reserve of Southwest China's Guizhou province.,ChinaDaily,China
Computing powers up in China,ChinaDaily,China
"Northwest China's Gansu province will cooperate with Saudi Arabia on afforestation missions and help it combat desertification, according to the provincial foreign affairs office.",ChinaDaily,China
China further optimized its control policies in a 10-point notice released on Wednesday. Here are some of the key adjustments.,ChinaDaily,China
"Internet has already become an important platform for minors to study, get entertained and have social contact. Let's look at the facts and figures on minors' use of internet in China.",ChinaDaily,China
"Energy, information technology, infrastructure and space are some of the key fields of cooperation between China and Saudi Arabia that will yield huge socioeconomic benefits as both countries seek to achieve sustainable development, experts said.",ChinaDaily,China
Species that are enjoying greater protection in China's northeastern region,ChinaDaily,China
"The districts of Guangzhou, South China's Guangdong province, have opened green channels for the elderly to get vaccinated.",ChinaDaily,China
"In partnership with Saudi Arabia, China can help restore security and peace in the Middle East, which as well as benefitting people in the region, will also benefit the Chinese economy.",ChinaDaily,China
"Kuaizhou 11, the newest carrier rocket model developed by China Aerospace Science and Industry Corp, completed its first successful flight on Wednesday morning, lifting an experimental satellite into , according to the company.",ChinaDaily,China
"Straddling the provinces of Jilin and Heilongjiang, the Northeast China Tiger and Leopard National Park provides a dedicated home for native .",ChinaDaily,China
Scientists from Saudi Arabia will soon have the opportunity to carry out an experiment aboard China's Tiangong space station that is expected to help with the design and production of high-efficiency solar cells.,ChinaDaily,China
"The C919, China's first domestically developed narrow-body passenger jet, netted 300 new orders in November, with the first such aircraft due to be delivered this month.",ChinaDaily,China
"Unity and collaboration between China and Arab nations is set for a significant boost after President Xi Jinping arrived in Saudi Arabia's capital, Riyadh, on Wednesday for a state visit.",ChinaDaily,China
"What do you know about Saudi Arabia? Peng's vlog is in Riyadh, capital of the Gulf Arab country, to cover the first China-Arab States Summit. Travel with her to a local amusement park and get a closer look at the city.",ChinaDaily,China
"Duan Lianru from the Hunchun bureau of the Northeast China Tiger and Leopard National Park is responsible for identifying the Siberian tigers according to patterns on their fur and giving them exclusive serial numbers, which aids scientific conservation.",ChinaDaily,China
More and more black-necked cranes have arrived at wetlands in Southwest China's autonomous region to spend winter this year.,ChinaDaily,China
"China has put three AG600M aircraft, a firefighting amphibious aircraft, into flight test missions, and the third prototype completed its flight test mission on Friday in Zhuhai, Guangdong province, said the Aviation Industry Corporation of China.",ChinaDaily,China
"Workers working at the final stage of the construction site of the Harbin Ice-Snow World, a renowned seasonal theme park, in Harbin, northeast China's Heilongjiang province.",ChinaDaily,China
"An exhibition, Foreigners But Not Outsiders, featured portraits of foreigners volunteering in efforts of anti-COVID-19 fight opened on Saturday in Shanghai, where the largest expat community in China live and work.",ChinaDaily,China
"Two trains loaded with a total of 1,300 tons of fresh fruits arrived in Chengdu, Sichuan province, and Chongqing municipality via China-Laos Railway this week. They were the first deliveries of imported fruits from Laos via the railway to the two cities.",ChinaDaily,China
"China's moves to optimize its COVID-19 policies will drive up demand, enhance the operations of global supply and industrial chains in the next stage, said senior executives from multinational's China branches, including Fujifilm, Henkel AG and FedEx.",ChinaDaily,China
"China will issue 750 billion yuan ($108 billion) worth of special treasury bonds next week, the Ministry of Finance said in a statement on Friday. The special treasury bonds will be used to raise fiscal funding to support economic and social development.",ChinaDaily,China
"China's consumer price index rose by 1.6 percent year-on-year in November, an eight-month low due to COVID-19 impact, seasonal factors and a high comparison base, the National Bureau of Statistics said on Friday.",ChinaDaily,China
"China's leading epidemiologist Zhong Nanshan Friday urged to beef up the vaccination drive against COVID-19, particularly among the elderly and other vulnerable groups.",ChinaDaily,China
"In the past decade, China-Arab relations entered a new era and registered a series of landmark and groundbreaking achievements in various areas.",ChinaDaily,China
"President Xi Jinping delivered a speech at the first China-Arab States Summit in Riyadh, Saudi Arabia on Friday. Xi hails the summit as milestone in relations in the speech.",ChinaDaily,China
"The Smart Dragon 3, a new solid-propellant carrier rocket, made its maiden flight on Friday afternoon, according to China Aerospace Science and Technology Corp, the country's leading space contractor.",ChinaDaily,China
"Amid the recent drop in temperatures, crystal-like ""flowers"" have grown out of the surface of a salt lake known as ""China's Dead Sea"" in North China's Shanxi province.",ChinaDaily,China
"Tea is the most commonly consumed drink in China. Due to the diversity of geographical environment and climate, China has given birth to many different tea varieties each with its own characteristics. Watch this video to see the tea culture in different regions.",ChinaDaily,China
"The first , China’s first self-developed narrow-body passenger jet, was delivered to China Eastern Airlines in Shanghai on Friday. The plane, which conducted its maiden flight in 2017, will begin commercial operations in the spring of 2023.",ChinaDaily,China
Chinese President Xi Jinping's quotes on China-Arab relationship (5/5),ChinaDaily,China
How the Aramco-China relationship is shaping a brighter future? For more:,ChinaDaily,China
"China is willing to work with the to promote green and low-carbon development, as part of the country's larger drive to make continuous contributions to global sustainable development, officials said on Thursday.",ChinaDaily,China
Chinese President Xi Jinping's quotes on China-Arab relationship (4/5),ChinaDaily,China
"China’s dynamic zero-COVID strategy was necessary, because it allowed us to buy precious time. Time for a less lethal variant so as to avoid deaths that could have reached millions. Time to ready a health infrastructure that will bear the brunt of the incoming wave.",ChinaDaily,China
Chinese President Xi Jinping's quotes on China-Arab relationship (3/5),ChinaDaily,China
China develops new energy vehicles to promote high-quality development,ChinaDaily,China
"China confirmed the Chinese government’s special representative on Korean Peninsula affairs, Liu Xiaoming, held video talks with the US Special Representative on North Korea, Sung Kim, a spokeswoman said, hoping all parties address each other’s concerns in a balanced way.",ChinaDaily,China
"China urged the US to delete negative China-related content in the and stop military contacts with Taiwan to avoid further damage to Sino-US ties, a spokeswoman said after the US House approved the NDAA including up to $12 billion in military aid to Taiwan.",ChinaDaily,China
"China and Canada should reject politicizing the economic and trade issues, and not make national security a catch-all phrase in economic contexts, FM spokeswoman Mao Ning said after Ottawa suspended a contract with a company that was reported to have ties with Beijing.",ChinaDaily,China
"The first C919, China's first domestically-developed narrow-body passenger jet, was delivered to China Eastern Airlines in Shanghai on Friday morning, and it is expected to be put into commercial operation in early 2023.",ChinaDaily,China
What are the science and technology topics that fascinate you? China Daily is collecting your questions. Science Talk host Zhang Zhihao will offer his answers to the most-asked questions. Please comment with your questions.,ChinaDaily,China
Chinese President Xi Jinping's quotes on China-Arab relationship (2/5),ChinaDaily,China
"In the spirit of camaraderie between China and the Middle East, popular are now being broadcast in the United Arab Emirates, Saudi Arabia and elsewhere.",ChinaDaily,China
President Xi Jinping has called on researchers of the history of New China to work to further encourage people to firm up their historical confidence and foster a strong intellectual power to strive in unity for national rejuvenation.,ChinaDaily,China
Chinese President Xi Jinping's quotes on China-Arab relationship (1/5),ChinaDaily,China
"“The updated COVID-19 measures are based on the experience and confidence of epidemic prevention and control efforts made across the country in the past three year,” said He Qinghua, an official from China's National Administration of Disease Control and Prevention.",ChinaDaily,China
The British Chamber of Commerce in China has welcomed the Chinese government's recent optimization of policies.,ChinaDaily,China
"China's economic growth will steadily pick up with the implementation of the 10 newly adopted measures on further optimizing the response, Premier Li Keqiang said on Thursday.",ChinaDaily,China
"Foreign journalists participating in the 2022 “Hi Jiangsu” media trip visited Wuxi, Jiangsu province on Nov 16. They had a close look at the China-Europe freight trains (Jiangsu) and gained a deeper understanding of the city’s prosperous modern industries.",ChinaDaily,China
President Xi Jinping attends a welcoming ceremony held by Saudi Crown Prince and Prime Minister and meets with Saudi King in Riyadh on Thursday. Keep in touch with China Daily's interactive reports on President Xi Jinping's Saudi visit!,ChinaDaily,China
"China-Saudi Arabia economic and trade ties are expected to experience high-speed growth in the years ahead, market watchers and business leaders said.",ChinaDaily,China
The huge disparity in COVID deaths between China and the worst-hit countries tells a story. A story of sound policy based on science and facts. A story of putting human life above all else. A story that helped us weather the storm and transition to the next phase.,ChinaDaily,China
"China, Saudi Arabia sign investment agreement on gaming sector",ChinaDaily,China
China's first self-developed aircraft delivered to China Eastern Airlines on Friday.,ChinaDaily,China
"China launched a Long March 2D carrier rocket early on Friday morning to transport an Earth-observation satellite into space, according to the China National Administration.",ChinaDaily,China
"China's consumer price index, the main gauge of inflation, rose 1.6 percent in November year-on-year, data from the National Bureau of Statistics showed on Friday.",ChinaDaily,China
The portrayal of China in Western media,ChinaDaily,China
"China will work with Arab states to carry forward their traditional friendship and keep expanding cooperation in areas such as food, energy, investment, financing and medical services, President Xi Jinping said.",ChinaDaily,China
"Enjoy the spectacular winter scenery of rime and frozen waterfall at the Jingpo Lake scenic area in Mudanjiang, China.",ChinaDaily,China
President Xi Jinping delivered a keynote speech at the China-Gulf Cooperation Council (GCC) Summit. Here are the highlights. (1/5),ChinaDaily,China
Qinhuai River in Nanjing was one of the most prosperous entertainment districts in ancient China. You can still feel that bustling night vibe today.,ChinaDaily,China
"The United States ""wants very much"" to stabilize relations with China and believes Beijing also seeks to do so, White House Indo-Pacific Coordinator Kurt Campbell said.",ChinaDaily,China
"China has put three AG600M aircraft, a full-configuration firefighting model belonging to the AG600 large amphibious aircraft family, into flight test missions, announced the developer.",ChinaDaily,China
President Xi Jinping delivers a keynote speech at the first China-Arab States Summit. Here are the highlights. (4/4),ChinaDaily,China
"""President Xi brought the rain with him on his visit, which for Arabians, means that he has brought a big surprise to the country."" The first China-Arab States Summit has concluded. Watch to see what people in countries think about the summit.",ChinaDaily,China
President Xi Jinping delivers a keynote speech at the first China-Arab States Summit. Here are the highlights. (3/4),ChinaDaily,China
China's FAST telescope reveals unprecedented details of Milky Way,ChinaDaily,China
President Xi Jinping delivers a keynote speech at the first China-Arab States Summit. Here are the highlights. (2/4),ChinaDaily,China
"At the first China-Arab States Summit in Riyadh, Saudi Arabia, President Xi Jinping said China stands ready to work with the Arab states to jointly move forward with eight joint actions. Officials and experts shared their thoughts on Xi's visit and remarks.",ChinaDaily,China
President Xi Jinping delivers a keynote speech at the first China-Arab States Summit. Here are the highlights. (1/4),ChinaDaily,China
"The Smart Dragon 3, a new solid-propellant carrier rocket, made its maiden flight on Friday afternoon, according to China Aerospace Science and Technology Corp (CASC).",ChinaDaily,China
"China and states are expected to deepen their economic and relations in energy and beyond, to add more growth momentum to both sides and inject more positive energy into the world economic recovery.",ChinaDaily,China
