Text,Media,GPE
The 17th round of China-India corps commander-level meeting was held on Tuesday on the Chinese side of the Moldo - Chushul border meeting point. The two sides agreed to maintain the security and stability on the ground in the western sector.,ChinaDaily,China
"In the Gusu district of city in East China's Jiangsu province, obsolete nucleic acid testing booths have been repurposed into temporary fever clinics to cope with a recent surge in patients battling COVID-19 infections.",ChinaDaily,China
"The United States Ambassador to the NATO, Julianne Smith, has accused Russia and China of employing a set of strategies to weaken the alliance. She should be reminded of the role NATO has played in the past couple of decades.",ChinaDaily,China
"As new cases surged in many parts of China, some said that China has wasted 3 years, and argued that if we will get infected sooner or later, what's the point of sticking to the strict epidemic control policy over the past 3 years? Is that true? Watch this video.",ChinaDaily,China
"and China, which have enjoyed a longstanding business relationship, have the potential to expand areas of cooperation, David Olsson, national president of the Australia China Business Council, has said.",ChinaDaily,China
NATO is pointing a finger at China simply because of its own ambitions to expand to the Asia-Pacific.,ChinaDaily,China
"For too long, ideology, and not professionalism, has guided the US' China policy. Unless that changes, won't make much of a difference. (Opinion writer Zhang Zhouxiang)",ChinaDaily,China
"China urged the US to respect the WTO panel's arbitration and correct its wrongdoings to safeguard normal international trade order, FM spokeswoman Mao Ning said after WTO concluded that US broke trade rules in forcing Hong Kong goods to be labeled 'Made in China'.",ChinaDaily,China
"In recent years, Jinping county in Qiandongnan Miao and Dong autonomous prefecture, Southwest China's Guizhou province has promoted the goose industry, relying on the excellent natural environment and breeding tradition.",ChinaDaily,China
"In the long term, strong and diversified supply and demand chains will ensure China's sustainable development and help integrate industrialization and urbanization.",ChinaDaily,China
"A pair of giant pandas will return to China after two decades at the Memphis Zoo in Memphis, the US state of Tennessee, as the zoo's current giant loan agreement with the Chinese Association of Zoological Gardens is coming to an end. (file photos)",ChinaDaily,China
"China will focus on ensuring stability in growth, employment and prices, according to decisions made on Tuesday at a State Council executive meeting chaired by Premier Li Keqiang.",ChinaDaily,China
"The first RCEP Youth Dialogue, co-hosted by China Daily, China Institute for Reform and Development and China Oceanic Development Foundation will open online at 9:30 am on Dec 23. Please stay tuned.",ChinaDaily,China
China released a directory of invasive species in order for departments to prioritize their control.,ChinaDaily,China
"China will focus on ensuring stability in growth, employment and prices, in order to keep major economic indicators within a proper range, further stabilize and sustain economic development, and secure a good beginning for economic performance next year.",ChinaDaily,China
"The Chinese and Russian navies started a weeklong joint exercise on Wednesday in the East China Sea, according to a spokesman for the People's Liberation Army Navy.",ChinaDaily,China
"Zhang Fuqing, a former combat hero who made meritorious achievements during the War of Liberation (1946-49) and received China's highest State honor, died on Tuesday night, Xinhua News Agency reported.",ChinaDaily,China
"Over 1,800 migratory black-necked cranes, a species under first-class national protection, were spotted on Thursday at the Yunnan Dashanbao National Nature Reserve in southwest China's Yunnan province as they arrived to overwinter.",ChinaDaily,China
"An exhibition now on at China Art Museum pays tribute to the history of steel making in , how the industry has shaped the city and how the industrial relics will be given a different life with the introduction of art.",ChinaDaily,China
"A giant eats bamboo at Xining Panda House in Xining, capital city of Northwest China's Qinghai province.",ChinaDaily,China
"Migratory birds rest at Nanchang Five Stars Siberian Cranes Sanctuary by the Poyang Lake in Nanchang, East China's Jiangxi province. Poyang Lake, the country's largest freshwater lake, is an important wintering spot for migratory birds.",ChinaDaily,China
China's apex court has introduced guidelines on strengthening the judicial protection for intellectual property in Traditional Chinese Medicine () in all respects.,ChinaDaily,China
"Arxan city in China's Inner Mongolia is covered with snow for seven months every year, truly a frozen wonderland.",ChinaDaily,China
"China's autonomous region will strive to build three cities, including the regional capital Lhasa, into waste-free cities by 2025, according to regional authorities.",ChinaDaily,China
"Leopards, which are under first-class national protection in China, were spotted multiple times on Taihang Mountain, Henan province this year. Check out these rare moments captured by infrared cameras.",ChinaDaily,China
"A passenger aircraft on Friday morning arrived in Taxkorgan Tajik autonomous county, Northwest China's Xinjiang Uygur autonomous region, marking the inauguration of the region's first high plateau airport.",ChinaDaily,China
"As China redoubles efforts in raising the vaccination rate for the elderly, and the booster shot becomes available to vulnerable groups, misinformation about COVID vaccines is also spreading. In this video, we debunk some of the rumors.",ChinaDaily,China
"The vitality, creativity, and impetus of young people are needed to further tap into the dividends of cooperation, said Chi Fulin, president of China Institute for Reform and Development, at the first RCEP Youth Dialogue.",ChinaDaily,China
"A 5-year-old girl goes snowboarding on a slope made by her parents in China's ""ice city"" Harbin.",ChinaDaily,China
"China Oceanic Development Foundation will continue to provide platforms and services for young people and hopes that they will take full opportunity of cooperation, said Lyu Bin, president of the foundation, at the first RCEP Youth Dialogue.",ChinaDaily,China
"Black stork is a migratory bird species under first-class national protection in China. There are fewer than 1,000 remaining in East Asia.",ChinaDaily,China
"Located in the hinterland of the Qinghai-Tibet Plateau, Sanjiangyuan, known as ""the Water Tower of China"", boasts abundant natural landscapes. At the end of the last century, Sanjiangyuan experienced an ecological crisis. Today, its ecosystem is recovering.",ChinaDaily,China
"Gone are the days when the West would impose unilateral sanctions for lame excuses while China sits idle. For those challenging China's interests, there is a price to pay now. (Opinion writer Zhang Zhouxiang)",ChinaDaily,China
Employees are busy at work to finish orders as the end of the year draws nearer in different parts of China.,ChinaDaily,China
"Harbin, dubbed China's ""ice city,"" attracts tourists by making the best use of ice elements during the winter time.",ChinaDaily,China
Chinese State Councilor and Foreign Minister Wang Yi called on the US to stop trying to suppress China's development and constantly challenging China's red lines in a phone conversation with US Secretary of State Antony Blinken.,ChinaDaily,China
"If China continues to help maintain global peace and contribute to global development, it will be able to win the hearts and minds of the international community.",ChinaDaily,China
"China has sanctioned two US individuals in response to US sanctions against Chinese officials under so-called human rights issues in Tibet, FM spokeswoman Mao Ning said, urging Washington to stop gross interference in China’s domestic affairs.",ChinaDaily,China
"China’s COVID-19 epidemic prevention and control situation is generally predictable and controllable, FM spokeswoman Mao Ning said after US Secretary of State Antony Blinken said Beijing has not asked for help from the US.",ChinaDaily,China
"Air China launched a new direct flight between China's largest city Shanghai and Greece's Capital Athens on Thursday at Athens International Airport (AIA), the first direct flight between the two cities.",ChinaDaily,China
"Harvey Dzodin, a senior fellow at the Center for China and Globalization, said that for almost three years China's strict pandemic prevention and control model “worked remarkably well"". It paves way for reopening now, he said. Watch this video.",ChinaDaily,China
"Over ten inhalable vaccine sites have been set up recently in Haidian district of Beijing. As the epidemic continues to rage, China has steadily promoted booster inoculation for the public.",ChinaDaily,China
State Councilor and Foreign Minister Wang Yi said on Thursday that the United States should waive its groundless containment and suppression on China and cooperate with China to tackle challenges as the international community expects.,ChinaDaily,China
"China's massive investment in industrial robotics has put the country higher in global rankings in terms of robot density, surpassing the US for the first time, an industry report said.",ChinaDaily,China
"China's top health authority on Thursday stressed ramping up treatment for vulnerable patients, as well as reinforcing preparedness of elderly care facilities and emergency care resources.",ChinaDaily,China
Medical teams have been working under immense pressure around China this month following the introduction of the optimized control policy. Five doctors share their fight against the virus.,ChinaDaily,China
"China, India hold 'constructive' talks at border",ChinaDaily,China
China's parcel delivery industry handled more packages between January and November this year compared with the same period in 2021.,ChinaDaily,China
Here is the breathtaking scenery at Sayram Lake in Northwest China's Uygur autonomous region.,ChinaDaily,China
"Construction of the Shenzhen-Zhongshan across the Pearl River is currently in full swing. Due to open in 2024, the bridge is expected to cut commuting time between the two cities in South China's Guangdong province from two hours to about 30 minutes.",ChinaDaily,China
"More than 680 fragments of Buddha statues and pagoda sculptures have been unearthed in the ruins of an ancient market in Xi'an, Northwest China's Shaanxi province.",ChinaDaily,China
"China's westernmost civil aviation opened to traffic on Friday in the Xinjiang Uygur autonomous region, establishing a new air hub to central and southern Asia and better connecting the region.",ChinaDaily,China
President Xi Jinping has called for enhanced efforts to build up China's strength in agriculture and do a good job in work on agriculture and rural areas.,ChinaDaily,China
"A study showed that tensions in US-China relations impacted scientists' productivity, especially those with previous ties to China. These impacts were significant in fields that have US-China collaboration.",ChinaDaily,China
"Local governments across China have issued a new round of consumption vouchers to boost the recovery of catering, tourism, retail and other industries weighed down by the epidemic.",ChinaDaily,China
"China has moved to prioritize the provision of medical services in elderly care facilities and social welfare institutions amid the epidemic, according to a video conference held by the Ministry of Civil Affairs.",ChinaDaily,China
"China deplores and firmly opposes the US passing and signing into law the National Defense Authorization Act for Fiscal Year 2023, which contains negative content concerning China, a foreign ministry spokesperson said Saturday in a press release.",ChinaDaily,China
"It's hoped that China, South Korea, and Japan, will play a role in ""developing by further developing existing economic relations"" and ""establishing future-oriented cooperative relations"", said Kim Junbum, president of the Korean Peninsula Technology Company.",ChinaDaily,China
"China will continue to widen opening-up and guide foreign companies to invest in key areas such as advanced manufacturing, modern services and energy conservation in its market in 2023, the Ministry of Commerce said.",ChinaDaily,China
Here is the breathtaking scenery at Sayram Lake in Northwest China's Uygur autonomous region.,ChinaDaily,China
"More than 100,000 migratory birds stop over in South China's tech hub of Shenzhen every winter. To better protect the habitat for migratory birds, the city will build an international mangrove center.",ChinaDaily,China
Over 500 types of moss thrive in the Dawei Mountain National Nature Reserve. Click to witness the beauty of these small in SW China's Yunnan province.,ChinaDaily,China
"State Councilor and Foreign Minister Wang Yi said that over the year 2022, China has conducted major-country diplomacy with Chinese characteristics in an all-round way, making new contribution to upholding world peace and promoting common development.",ChinaDaily,China
"State Councilor and Foreign Minister Wang Yi said that China will fully implement the policies set by the 20th National Congress of the Communist Party of China, and break new ground in major-country diplomacy with Chinese characteristics in 2023.",ChinaDaily,China
"China strongly opposes the United States' sensationalization of the ""China threat"" in its new defense act, said Senior Colonel Tan Kefei, a spokesman for China's Defense Ministry.",ChinaDaily,China
"China has created new momentum in opening-up and external cooperation, which affords great opportunities for world economic recovery, State Councilor and Foreign Minister Wang Yi said at the Symposium on the International Situation and China’s Foreign Relations.",ChinaDaily,China
"China and Russia have stood in solidarity with other countries to steadfastly push for multipolarity and greater democracy in international relations, State Councilor and Foreign Minister Wang Yi said at a Symposium on Sunday.",ChinaDaily,China
"The door-to-door services have been offered to help the elderly get vaccinations in the city of Wenchang, S China's Hainan province.",ChinaDaily,China
"China has continued to reject bloc confrontation and zero-sum competition in relations with other major countries, State Councilor and Foreign Minister Wang Yi said at the Symposium on the International Situation and China’s Foreign Relations.",ChinaDaily,China
China prioritizes people's health in fight,ChinaDaily,China
"China's lithium-ion battery industry sustained rapid expansion in the first 10 months of 2022, official data showed.",ChinaDaily,China
"Rocks covered in snow look like mushroom caps on lakes of Kanas scenic area, Northwest China's .",ChinaDaily,China
A glimpse of Jiayu Pass in China's Gansu after a snowfall! The Jiayu Pass is regarded as the western start of the Ming Dynasty (1368-1644).,ChinaDaily,China
"China's guard Li Meng was voted women's Player of the Year in Asia by fans, the International Basketball Federation (FIBA) announced on Sunday.",ChinaDaily,China
"A railway linking Chengdu and Kunming, two major cities in southwest China, is now fully operational with the opening of its last section on Monday.",ChinaDaily,China
A group of argalis was spotted running on steep cliffs in the mountains of China's .,ChinaDaily,China
"The total expenditure of China's urban residents is expected to average 836,400 yuan ($119,887).",ChinaDaily,China
A red fox and a group of large-billed crows are spotted vying for food at the Helan Mountain in China's Ningxia.,ChinaDaily,China
China's design industry grows 16.5% in 2022 despite US bans,ChinaDaily,China
"China National Petroleum Corp said on Monday that its oil and gas production equivalent has hit a record high in 2022, a result of its consistent efforts in oil and gas exploration and development in recent years.",ChinaDaily,China
"China's National Health Commission decided to rename novel coronavirus pneumonia as novel coronavirus infection, according to a statement on Monday.",ChinaDaily,China
"2022 was undoubtedly a challenging year for China's economy, but the country withstood the test and confidence is high that the prospects are immeasurably brighter for 2023.",ChinaDaily,China
"Xi Jinping, general secretary of the Communist Party of China Central Committee, demanded more targeted efforts to carry out patriotic health campaigns and concrete actions to protect people's safety and health.",ChinaDaily,China
"The number of cities in China with the capability to offer gigabit and optical fiber services reached 110 by the end of October, according to the Ministry of Industry and Information Technology.",ChinaDaily,China
"From Alpha to Omicron, China helped all places where these variants mutated. Now with China's anti-pandemic measures optimized, some in West are “worried” about possible mutations. Sincerity vs beggar-thy-neighbor policy. (Opinion writer Zhang Zhouxiang)",ChinaDaily,China
"China Daily photographers have often been on the front line of the battle against over the years, and their photos bear witness to the efforts that have gone into epidemic prevention and control.",ChinaDaily,China
"China’s largest academic research database CNKI was fined 87.6 million yuan (12.6 million US dollars) for abusing its monopoly over access to published academic papers for years, according to the State Administration for Market Regulation on Monday.",ChinaDaily,China
"China expresses condolences over the death of Solomon Islands' first Ambassador to China, John Moffat Fugui, who passed away in Beijing from cardiac arrest, and is actively assisting the Solomon Islands to deal with related follow-up matters, FM spokeswoman Mao Ning said.",ChinaDaily,China
"China and the European Union should work more closely together on climate change and green technology in tackling climate change, experts say.",ChinaDaily,China
"The US 2023 includes, once again, funds for China's to stoke a possible war. US politicians are emptying US taxpayers' pockets for US arms dealers' profits. Next they might want US young lads' blood too. (Opinion writer Zhang Zhouxiang)",ChinaDaily,China
"China and the United States should restore mutual trust by reopening consulates that have been closed and work together on global challenges, says Stephen Roach, former chairman of Morgan Stanley Asia.",ChinaDaily,China
"China Daily photographers have often been on the front line of the battle against over the years, and their photos bear witness to the efforts that have gone into epidemic prevention and control.",ChinaDaily,China
President Xi Jinping has encouraged Chinese artists to uphold their people-centric approach in creation and production of works of art and help build China into a culturally advanced socialist nation.,ChinaDaily,China
"China Daily photographers have often been on the front line of the battle against over the years, and their photos bear witness to the efforts that have gone into epidemic prevention and control.",ChinaDaily,China
"""The young people of all countries are the new force and backbone of RCEP cooperation. They play a very important supporting role, and are playing a leading role in some areas,"" said Qu Yingpu, publisher and editor-in-chief of China Daily, at the RCEP Youth Dialogue.",ChinaDaily,China
"The more Miles Maochun Yu hates the country where he was born, the more frustrated he will be upon seeing the progress China is making.",ChinaDaily,China
"A joint working group consisting of industrial associations, plastics producers and recyclers has initiated a program to beef up the recycling of flexible plastics in China, a move experts believe will reduce waste and help with national climate targets.",ChinaDaily,China
The digital has become an important driver of China's high-quality development.,ChinaDaily,China
President Xi Jinping has called for accelerated steps to build up China's agricultural sector and vigorously promote rural vitalization.,ChinaDaily,China
"A new line in China's southwestern region opens on Monday, slashing travel time between the region's two major cities Chengdu and Kunming.",ChinaDaily,China
"China Daily photographers have often been on the front line of the battle against over the years, and their photos bear witness to the efforts that have gone into epidemic prevention and control.",ChinaDaily,China
"China's financial institutions saw expanded balance sheets by the end of the third quarter (Q3) of 2022, official data showed.",ChinaDaily,China
"Numerous creative start-ups have emerged within the region, said Kuang Xianming, the vice president of China Institute for Reform and Development.",ChinaDaily,China
"Take a glimpse of the amazing winter scenery of Hemu village in China's , a popular tourist destination for winter sports.",ChinaDaily,China
"Even during winter time, Longju Wetland in Heshuo county, Northwest China's Uygur autonomous region is still full of life.",ChinaDaily,China
"At the Qinling Giant Panda Research Center in Northwest China's Shaanxi province, six giant panda cubs that were born in 2022 are playing together.",ChinaDaily,China
China has met the right conditions for downgrading the management of and putting an end to measures such as large-scale lockdowns and movement restrictions. It is time to move forward.,ChinaDaily,China
"Omicron variants dominate China's outbreak. The more virulent Delta strain of is not currently circulating in China according to epidemiological data, experts said.",ChinaDaily,China
"China's downgrading of the novel coronavirus infection to a less serious category B disease does not mean the nation is abandoning all of its disease control measures, a senior health expert said on Tuesday.",ChinaDaily,China
China has met the right conditions for downgrading the management of and putting an end to measures such as large-scale lockdowns and movement restrictions.,ChinaDaily,China
"China's move to downgrade the management of from category A to category B — a major adjustment to China's epidemic control policy — was well-timed, a senior health official said.",ChinaDaily,China
China Eastern Airlines recently received the world's first C919 passenger aircraft and has started 100 hours of test flights to verify and confirm the quality of the aircraft.,ChinaDaily,China
The search volume of international flight tickets is surging in China after the country announced to downgrade the management of from Jan 8.,ChinaDaily,China
"When China lifts strict control measures with the virus weakened, Western critics call it ""a surrender to virus"". When they reopened, it was portrayed as a calculated decision to acquire herd immunity.",ChinaDaily,China
China's socialist system has played a key role in the nation's recent successes.,ChinaDaily,China
Winds of change bolster China-Africa ties,ChinaDaily,China
"Chongqing heads the pack in western China in the creation of a dual-gigabit city, as three of its districts recently became gigabit cities.",ChinaDaily,China
"China will adjust its visa policy to facilitate foreigners’ visiting China for different purposes, FM spokesman Wang Wenbin said after China announced to lift COVID restrictions to international arrivals from Jan 8.",ChinaDaily,China
"China expressed concerns over Japan's record-high 6.8 trillion yen defense budget for the next five years, FM spokesman Wang Wenbin said, urging the Japanese side to act prudently to avoid further losing the trust of its Asian neighbors and the international community.",ChinaDaily,China
China has made remarkable achievements in promoting the green and low-carbon energy transition and will continue to pursue green and high-quality development to achieve its carbon peak and carbon neutrality goals.,ChinaDaily,China
"International travelers will no longer need to quarantine upon arrival in China starting Jan 8, according to the country's latest policy on epidemic control.",ChinaDaily,China
"A set of 37 legislative proposals has been planned for review and discussion next year, an official from the Standing Committee of the National People's Congress, China's top legislature, said on Monday.",ChinaDaily,China
"After 3 years of effective virus control, the time is ripe for China to downgrade management from category A to B. Now we need to adjust to new priorities and ensure our previous efforts don't go in vain. (Opinion writer Zhang Zhouxiang)",ChinaDaily,China
"China's vaccination campaign has picked up speed in the past week, allowing the country to take the initiative in upgrading its virus-control policies, according to official data and authorities.",ChinaDaily,China
"China's GDP increased by 8.4 percent to 114.92 trillion yuan ($16.52 trillion) in 2021, according to the updated data released by the National Bureau of Statistics on Tuesday.",ChinaDaily,China
"With China relaxing control measures and the New Year approaching, consumers have shown a growing demand for dine-in services.",ChinaDaily,China
China's tourism market may reach a turning point during the New Year's Day holiday as people seem more keen to travel across provinces and regions amid the recently optimized response measures.,ChinaDaily,China
"China's gross domestic product (GDP) in 2021 was revised to 114.9237 trillion yuan (about $16.54 trillion), official data showed on Tuesday.",ChinaDaily,China
"China will scrap the quarantine requirement for international arrivals starting January 8, 2023, the country's National Health Commission said in a statement on Monday.",ChinaDaily,China
"Nearly a meter of snow has fallen in China's recently. For house safety, villagers need to clear snow on rooftops. People could have fun with it.",ChinaDaily,China
