Text,Media,GPE
Chinese State Councilor and Foreign Minister Wang Yi called on the US to stop trying to suppress China's development and constantly challenging China's red lines in a phone conversation with US Secretary of State Antony Blinken.,ChinaDaily,USA
"China has sanctioned two US individuals in response to US sanctions against Chinese officials under so-called human rights issues in Tibet, FM spokeswoman Mao Ning said, urging Washington to stop gross interference in China’s domestic affairs.",ChinaDaily,USA
"China’s COVID-19 epidemic prevention and control situation is generally predictable and controllable, FM spokeswoman Mao Ning said after US Secretary of State Antony Blinken said Beijing has not asked for help from the US.",ChinaDaily,USA
State Councilor and Foreign Minister Wang Yi said on Thursday that the United States should waive its groundless containment and suppression on China and cooperate with China to tackle challenges as the international community expects.,ChinaDaily,USA
Chinese State Councilor and Foreign Minister Wang Yi called US Secretary of State Antony Blinken on Friday at the latter's request.,ChinaDaily,USA
"China's massive investment in industrial robotics has put the country higher in global rankings in terms of robot density, surpassing the US for the first time, an industry report said.",ChinaDaily,USA
"China deplores and firmly opposes the US passing and signing into law the National Defense Authorization Act for Fiscal Year 2023, which contains negative content concerning China, a foreign ministry spokesperson said Saturday in a press release.",ChinaDaily,USA
Major winter storm takes at least 23 lives across,ChinaDaily,USA
"China strongly opposes the United States' sensationalization of the ""China threat"" in its new defense act, said Senior Colonel Tan Kefei, a spokesman for China's Defense Ministry.",ChinaDaily,USA
"The Russian Defense Ministry disclosed information of US high-ranking participants in the military biological studies in , many of whom are associated with intelligence services or pharmaceutical companies.",ChinaDaily,USA
US economist says Chinese economy expected to deliver solid rebound in 2023,ChinaDaily,USA
China's design industry grows 16.5% in 2022 despite US bans,ChinaDaily,USA
"The Russia-Ukraine conflict is a typical proxy war, in which the situation can change in a short time, especially because the US or NATO is not expected to become a party to the conflict and yet they want the war to drag on.",ChinaDaily,USA
"The is dangerous in that it lends a legislative boost to US arms sales to Taiwan. It is a move Beijing vehemently opposes, as it is gross interference in Chinese domestic affairs.",ChinaDaily,USA
"Panama seized a record for drugs in 2022, according to its Public Security ministry, as the country struggles with through its territory to the US and Europe. So far this year, the Central American country has seized 126.5 tons of drug, mostly cocaine.",ChinaDaily,USA
"China’s largest academic research database CNKI was fined 87.6 million yuan (12.6 million US dollars) for abusing its monopoly over access to published academic papers for years, according to the State Administration for Market Regulation on Monday.",ChinaDaily,USA
"127 WTO members moved 61 times against the US for curbing the appointment of appealing agency judges. ""American exceptionalism"" cannot be more ironic at this moment. (Opinion writer Zhang Zhouxiang)",ChinaDaily,USA
"The US 2023 includes, once again, funds for China's to stoke a possible war. US politicians are emptying US taxpayers' pockets for US arms dealers' profits. Next they might want US young lads' blood too. (Opinion writer Zhang Zhouxiang)",ChinaDaily,USA
"China and the United States should restore mutual trust by reopening consulates that have been closed and work together on global challenges, says Stephen Roach, former chairman of Morgan Stanley Asia.",ChinaDaily,USA
"An arctic blast that gripped much of the United States on Saturday left more than 700,000 without power.",ChinaDaily,USA
Facebook directly helped organize an insurrection and no US politician has tried to ban it for national security reasons. The reason these politicians want to ban TikTok is that it broke the US monopoly of social media and the US government can't easily control it.,ChinaDaily,USA
"The Chinese design sector's sales revenue this year is expected to reach 534.57 billion yuan ($78.74 billion), up 16.5 percent year-on-year, showcasing sectoral resilience amid US export restrictions.",ChinaDaily,USA
"The US Congress will be officially divided with a Republican-controlled House and a Democratic-run Senate next month. The division means that the parties will have little common ground on which to agree on, especially on gun rights and abortion.",ChinaDaily,USA
"US President Joe Biden authorized federal support for New York state on Monday after a severe winter storm left at least 27 people dead in the Buffalo area and tens of thousands of residents without power, the White House said in a statement.",ChinaDaily,USA
The illusion of protection,ChinaDaily,USA
"Overseas Chinese cheered on Tuesday after China made a major shift of its epidemic response policies and removed most COVID restrictions on international arrivals, starting Jan 8. Chinese business communities in the US are also ""eager to go back"".",ChinaDaily,USA
"Starting in January, all gun owners in San Jose, California, must have insurance that covers firearm harm or accidental firings, the first law of its kind in the US.",ChinaDaily,USA
"Given 's success and the inability of some in the US to tolerate any foreign company being successful, let alone a Chinese one, things are unlikely to get easier for the company any time soon.",ChinaDaily,USA
"""As residents of the same world, we should and can listen to each other and explore a way to get along based on mutual respect, peaceful coexistence, and win-win cooperation,"" Chinese Ambassador to the US Qin Gang wrote in a recent column.",ChinaDaily,USA
The US is the world's only superpower; has the largest army; and has its intelligence network cast around the world. Yet it fears that its national security is challenged by an app that entertains people. The empire is afraid of its own people.,ChinaDaily,USA
"Starting in January, all gun owners in San Jose, California, must have insurance that covers firearm harm or accidental firings, the first law of its kind in the US.",ChinaDaily,USA
"US capitalism and its hegemony are waning, and ""a struggle to shape the emerging 'new world order' is under way"", wrote Richard D. Wolff, professor of economics emeritus at the University of Massachusetts in a recent column.",ChinaDaily,USA
"The United States ""must show sincerity and take actions"" to respect China's core interests and major concerns if it really wants to have positive and constructive dialogues with China, said the Ministry of National Defense on Thursday.",ChinaDaily,USA
US health officials on Wednesday announced new testing requirements for travelers from China that raised doubts from some medical experts.,ChinaDaily,USA
"A Chinese mainland spokeswoman, on Friday, voiced firm opposition after the United States has approved a potential $180 million arms sale to , urging Washington to carefully handle the Taiwan question.",ChinaDaily,USA
"A Chinese mainland spokeswoman, on Friday, voiced firm opposition after the has approved a potential $180 million arms sale to Taiwan, urging Washington to carefully handle the question.",ChinaDaily,USA
"Qin Gang, the Chinese ambassador to the , was appointed as the new foreign minister on Friday.",ChinaDaily,USA
": Young people from Bulgaria, China, Egypt, Ethiopia, Ireland, Israel, Russia, South Africa, the US and other countries have been invited to wrap up the year and envisage the coming year by way of a keyword.",ChinaDaily,USA
"At $16.7 billion, the 2022 midterm elections are the most expensive in US history. The American-style democracy is a game for the rich, not the people. Their boasted political pluralism of ""one person, one vote"" is merely a facade.",ChinaDaily,USA
"The US' provocative and dangerous acts have been the root cause for maritime security issues, FM spokesman Wang Wenbin said after the US military said a Chinese military plane came within 10 feet of a US air force aircraft in the South China Sea last week.",ChinaDaily,USA
"It's the end of December and it's time for us to share our insights on the world of 2022, based on numerology. Here are 8 of the most important figures that may tell what shaped our world.",ChinaDaily,USA
