Text,Media,GPE
"China's achievements on biodiversity conservation are being shared at the 15th Conference of the Parties, or , through the launch of the China Pavilion in Montreal.",ChinaDaily,China
"Black-faced spoonbills flock to the coast of Fujian, China.",ChinaDaily,China
Take a glimpse of the construction of China's homegrown aircraft in 90 seconds.,ChinaDaily,China
Hongjiang ancient town in Central China's Hunan province launches a variety of nighttime activities to boost night economy.,ChinaDaily,China
"Check out the sea of clouds in Lincang city, Southwest China's Yunnan province.",ChinaDaily,China
The US bid to curtail China's tech progress will only make China strive harder to increase its self-reliance.,ChinaDaily,China
Dragooning TSMC to relocate its manufacturing to the US is another move to politicize and weaponize technology to contain China.,ChinaDaily,China
"Khalid al-Falih, the Saudi Arabian minister of investment, said he expects to see Saudi and Chinese entities partnering together more and more around the world, adding the two-way investment between Saudi Arabia and China will grow. Watch this video to find out more.",ChinaDaily,China
"China's FAST telescope reveals unprecedented details of the Milky Way. The vast space between billions of stars in the Milky Way is not empty, but filled with thin interstellar medium.",ChinaDaily,China
"11 protected areas in China, including Qianjiangyuan National Park in the eastern province of Zhejiang and the famous Huangguoshu Scenic Area in southwestern province of Guizhou, are added to the IUCN Green List.",ChinaDaily,China
"Two singers from the Philippines met in China's Foshan five years ago and formed a music band. Life was sometimes harsh, but they were both healed by the beautiful city.",ChinaDaily,China
"The eastern route of the China-Russia natural gas pipeline has completed construction, which will allow natural gas from Russia to cross nine provinces, municipalities and autonomous regions to reach Shanghai, ensuring supplies for eastern China.",ChinaDaily,China
"With a significantly lower pathogenicity of the current Omicron variant of the novel coronavirus, the focus of China's control have shifted to the intervention of potential severe cases.",ChinaDaily,China
"China's recent policy adjustments will significantly boost foreign trade cooperation and domestic consumption, and Fujifilm will continue to expand its market share in China, said Kenichi Tanaka, president of Fujifilm (China) Investment Co Ltd.",ChinaDaily,China
President Xi Jinping delivered a keynote speech at the China-Gulf Cooperation Council (GCC) Summit. Here are the highlights. (5/5),ChinaDaily,China
A Beijing drug store will be fined ¥200K for hiking prices of antigen tests. It shows China's determination to control the medicine prices. A necessary move to gain public confidence in the new COVID control measures. (Zhang Zhouxiang),ChinaDaily,China
President Xi Jinping delivered a keynote speech at the China-Gulf Cooperation Council (GCC) Summit. Here are the highlights. (4/5),ChinaDaily,China
"The bilateral ties between China and Saudi Arabia are at its best, said Abdullah Alswaha, Saudi Arabia's minister of communications and information technology.",ChinaDaily,China
"Some people see China as ""the most serious competitor"" and ""the most consequential long-term geopolitical challenge"", which is out of grave strategic misperception and misjudgment, China's ambassador to the US Qin Gang said.",ChinaDaily,China
"China, a leading growth engine for world economy amid control",ChinaDaily,China
President Xi Jinping delivered a keynote speech at the China-Gulf Cooperation Council (GCC) Summit. Here are the highlights. (3/5),ChinaDaily,China
"President Xi's landmark Mideast trip ushered in a new era of all-round and in-depth development of relations between China and Arab states, between China and the GCC, and between China and Saudi Arabia, said State Councilor and FM Wang Yi.",ChinaDaily,China
President Xi Jinping delivered a keynote speech at the China-Gulf Cooperation Council (GCC) Summit. Here are the highlights. (2/5),ChinaDaily,China
"China Daily's digital employee Yuanxi invites you to join her journey 3,000-plus years back in time and trace the origin of Chinese characters. By examining oracle bone inscriptions, Yuanxi offers us a glimpse into the long and rich history of Chinese civilization.",ChinaDaily,China
Four otters were spotted frolicking in an icy river in Northeast China. The species is a nationally protected animal in China.,ChinaDaily,China
"The 2nd snow and ice tourism carnival in Kazak autonomous county of Mori, Northwest China's Xinjiang Uygur autonomous region, kicked off on Monday.",ChinaDaily,China
"Enterprises from East China's economic powerhouse Shandong province will seek business opportunities in overseas trips planned from mid-December to mid-January next year, according to local authorities.",ChinaDaily,China
"Photos taken on Sunday show the scenery of Quxu section of the Yarlung Zangbo River in Quxu county, Southwest China's Tibet autonomous region.",ChinaDaily,China
"The China express delivery development index for November came in at 338.7, up 1.2 percent year-on-year, the State Post Bureau said.",ChinaDaily,China
It is encouraging to see that high-level channels of communication between China and the United States have been reactivated despite the frictional differences that exist between them.,ChinaDaily,China
"By participating in the US' efforts to prevent China acquiring the latest-generation semiconductors, Japan and the Netherlands will only harm themselves.",ChinaDaily,China
"By roping its allies into a war of chips against China, the US is letting the world, its allies included, pay a heavy price of development opportunities. Its allies need to stay smart enough to avoid that. (Opinion writer Zhang Zhouxiang)",ChinaDaily,China
"on Monday launched a Long March-4C rocket, placing a pair of in space. The rocket blasted off at 4:22 pm (Beijing Time) from the Jiuquan Satellite Launch Center in northwest China and sent the satellites Shiyan-20A and Shiyan-20B into preset orbit.",ChinaDaily,China
"China has adjusted its policy based on the latest situation. However, such change is used by some reports as an excuse to attack China’s previous measures. Did the measures work or not? Data speaks for itself.",ChinaDaily,China
"China's implementation of biodiversity conservation goals in the past decade was better than the global average, Huang Runqiu, president of the 15th meeting of the Conference of the Parties () to the UN Convention on Biological Diversity said.",ChinaDaily,China
"Hopefully, the visits to China by senior US officials will turn a new page in China-US interactions, as both countries will be better served by dialogue and win-win cooperation.",ChinaDaily,China
"China's fast-moving consumer goods (FMCG) sector showed a resilient performance despite the impact of , an industrial report said.",ChinaDaily,China
"With anti-pandemic measures optimized, it is still a big challenge to protect people from . Fortunately the most deadly variants seem to have passed and China facing the mild Omicron won't repeat the US' mistakes. (Opinion writer Zhang Zhouxiang)",ChinaDaily,China
The high-tech zones have become an important engine to support China's economy on sound development.,ChinaDaily,China
"Omicron is not scary, as about 99 percent of those infected with Omicron can fully recover within 7 to 10 days, Zhong Nanshan, China's top respiratory disease expert, said at a national academic video conference of respiratory diseases.",ChinaDaily,China
The 4-day Global Digital Trade Expo kicked off in Hangzhou on Sunday. Around 800 leading digital trade companies from China and abroad will showcase their new products and technologies during the expo.,ChinaDaily,China
Plenty of room for policy adjustment is going forward. We expect a 0.5 to 1 percentage point China's reserve requirement ratio cut in 2023.,ChinaDaily,China
"New energy vehicles are reshaping the auto industry, bringing about changes from online purchases and loans to the supply chain, a recent report on China's automotive market said.",ChinaDaily,China
China to end use of digital travel code starting Tuesday,ChinaDaily,China
"A competent artificial intelligence system to support the judicial sector is expected to be set up by 2025 to help improve legal services, China's top court said.",ChinaDaily,China
How will China's updated COVID strategy pan out?,ChinaDaily,China
"China's grain output in 2022 hits a record high of about 1.37 trillion jin (685 billion kg), up 0.5% year-on-year, the National Bureau of Statistics said Monday.",ChinaDaily,China
"The easing of containment measures reflects China's strong commitment to balance protection for people's livelihoods and pursuit of steady long-term economic growth, said Rajat Agarwal, president for China of Henkel AG & Co.",ChinaDaily,China
"President Xi Jinping's landmark visit to the Middle East has cemented China's strategic partnership with Arab states, said officials and experts.",ChinaDaily,China
China showcases its biodiversity at UN conference in Canada,ChinaDaily,China
China to take down digital itinerary card service starting Tuesday.,ChinaDaily,China
"During the 2022 “Hi Jiangsu” media trip which concluded on Nov 20, foreign journalists visited four cities of Nanjing, Wuxi, Suzhou and Nantong in East China’s Jiangsu province, learning about how Jiangsu achieved high-quality development during the past decade.",ChinaDaily,China
"The latest data from the Ministry of Industry and Information Technology showed that China ranked second in the world in terms of scale in computing power last year, with the nation accounting for 27 percent of global computing power.",ChinaDaily,China
"Central China's Hunan province's total import and export value from January to November reached 641.76 billion yuan ($92 billion), marking a year-on-year increase of 22.8 percent, data from Changsha Customs showed.",ChinaDaily,China
"Elizabeth Mrema, the executive secretary of the UN Convention on Biological Diversity, told China Daily that she wished the COP15 a smooth adoption of the Global Biodiversity Framework, which will go into the history of biodiversity, and China should be proud of the results.",ChinaDaily,China
"Archaeologists have found a cluster of grain barns dating back more than 6,000 years in Central China's Henan province.",ChinaDaily,China
"Photos taken on Sunday show the scenery of the Yamdrok Lake in Nagarze county of Shannan city, Southwest China's Tibet autonomous region.",ChinaDaily,China
"China on Tuesday called on countries to stand up against the United States' unilateralism and protectionism, saying the move bears on the international justice and the stability of the international trade system.",ChinaDaily,China
"Throwing mud at China over human rights issues helps to propel the narrative that it is trying to push that China is ""evil"". This is a tired old ploy from the Cold War that people are now wise to.",ChinaDaily,China
"Although China's parcel delivery sector has consistently shown signs of recovery since the beginning of this month, delays remain as the peak season coincides with courier shortages due to the epidemic.",ChinaDaily,China
China on Tuesday urged to strictly control and manage its frontline troops and together with China to maintain peace along the border areas.(1/4),ChinaDaily,China
"""The paradigm shift (of China) is the growth story of the 21st century,"" Professor Lord Nicholas Stern, Chairman of the Grantham Research Institute at LSE, said during a high-level workshop of Pathways to Carbon Neutrality in China. ""What we try to do is set out the story.""",ChinaDaily,China
"China's leading epidemiologist Zhong Nanshan has urged a scale-up in vaccination efforts to inoculate more people with vaccine booster shots, especially with the Spring Festival travel rush coming soon.",ChinaDaily,China
"The people of Nanjing observed a minute of silence, and sirens were heard across the city, as China proceeded with its ninth national memorial ceremony Tuesday to mourn the 300,000 victims of the Nanjing Massacre.",ChinaDaily,China
"""Carbon neutrality is not only a technology issue or an energy issue. Carbon neutrality is really a paradigm shift,"" Zhu Min, former Deputy Managing Director of IMF, said during a high-level workshop of Pathways to Carbon Neutrality in China.",ChinaDaily,China
"Critics of China's policy need to refresh their memories. Of all major economies, only China maintained positive growth while keeping a minimum death toll during the pandemic. Achieving such balance is a consistent effort and recent changes reflect that.",ChinaDaily,China
"China has launched a suit at the World Trade Organization against the United States over the latter's chip export control measures, China's Ministry of Commerce said.",ChinaDaily,China
"China called on countries to oppose the protectionism and unilateralism of the US, which bears on the international justice and stability of the international trade system, a spokesman said after China filed a lawsuit with WTO against the US over chip export controls.",ChinaDaily,China
"China strongly condemned the terrorist attack and urged Afghan interim government to take forceful measures to ensure the security of Chinese citizens, institutions and projects, a spokesman said in response to a hotel attack in Kabul that injured five Chinese citizens.",ChinaDaily,China
"The China-India border situation enjoys overall stability and it is hoped that India can meet China halfway and jointly uphold the peace and tranquility of the China-India border region, a spokesman said in response to border clashes between the two countries' troops.",ChinaDaily,China
"The key presumption for the 2023 Outlook is that China will continue to relax its policy. Once the pressure on health care systems starts to ease steadily, a more rapid return to normalcy and a rebound in mobility can be expected.",ChinaDaily,China
"Beijing's top envoy in Washington has rejected charges that China has used a ""debt trap"" to secure influence in Africa.",ChinaDaily,China
Dec 13 marks China's ninth state commemoration for the victims of the Nanjing Massacre. The day should also be synonymous with Japan denying its imperial forces committed a massacre and atrocities. To forget is to betray. (Zhang Zhouxiang),ChinaDaily,China
"China's iron and steel industry needs to step up efforts on technological innovation and low-carbon development to cope with challenges and realize high-quality growth, according to industry experts.",ChinaDaily,China
"A China independently developed robot has successfully carried out a knee replacement surgery, the first commercial use of a China-made robot for human surgery.",ChinaDaily,China
"China is shoring up intensive care facilities in rural areas and strengthening the training of grassroots medical staff to improve capacity before possible surges in cases of , the top health authority said.",ChinaDaily,China
"The people of Nanjing observed a minute of silence, and sirens were heard across the city, as China proceeded with its ninth national memorial ceremony Tuesday to mourn the 300,000 victims of the Nanjing Massacre.",ChinaDaily,China
"Life is returning to normal and production is being steadily restored in Northwest China's Uygur autonomous region, with further optimized response measures in place.",ChinaDaily,China
"December 13 is China's National Memorial Day for the victims of the Nanjing Massacre, however, the massacre is not the only war crime committed by Japanese militarists. Japan's abandoned chemical weapons (ACWs) have long threatened people’s lives and ecological security in China.",ChinaDaily,China
"The Wuyi Mountain National Park, which straddles the provinces of Fujian and Jiangxi, is the only mixed facility among China's first five national parks as it features cultural and scenic aspects, and is also listed as a UNESCO World Heritage Site.",ChinaDaily,China
"China has been strengthening its monitoring and early warning system against infectious diseases and boosting medical networks to safeguard people's health, according to officials and experts.",ChinaDaily,China
Premier Li Keqiang called on Monday for an early conclusion of the second-phase of negotiations on the free trade agreement between China and the Republic of Korea.,ChinaDaily,China
"China's strict policies, which have been routinely modified over the past three years to tackle the ceaseless mutations of the novel coronavirus, have saved millions of lives in the country, many netizens said.",ChinaDaily,China
"Officials from China and the have agreed to maintain communication after their latest discussions on bilateral relations in Langfang, Hebei province.",ChinaDaily,China
President Xi Jinping has called for concrete steps to protect China's intangible cultural heritage in a systematic way and promote Chinese culture around the world.,ChinaDaily,China
"A fire was quenched by a 7-year-old boy at home in around 20 seconds in Zhuzhou, China",ChinaDaily,China
"Photos show the scenery of the Yamdrok Lake in Nagarze county, Southwest China's Tibet autonomous region.",ChinaDaily,China
"China Southern Airlines, one of China's major air carriers, plans to inaugurate flights between Shenzhen, Guangdong province, and Amsterdam, the Netherlands, on Jan 2.",ChinaDaily,China
"Since China announced a new set of measures to optimize its COVID-19 response, Anhui's commerce department has sent 58 people from 18 enterprises to attend activities, including exhibitions and business negotiations in 19 countries.",ChinaDaily,China
"China has detained more than half of the suspects on its wanted list of leaders and key members of fraud gangs, six months after it launched a campaign against emerging criminal activities in telecom network and cyberspace.",ChinaDaily,China
"Despite a rise in the number of automobiles, China has experienced a slight decrease in the amounts of four major air pollutants emitted by vehicles last year, according to an annual report from the Ministry of Ecology and Environment.",ChinaDaily,China
"Japan is using China as the justification for this military build-up. Over the years, as it has pressed against the restraints of the Constitution, Japan has ramped up the tone of alarm in relation to its neighbor.",ChinaDaily,China
"The National Health Commission has asked all grassroots health clinics, medium-sized and large hospitals to open fever clinics to cope with the surge of patients since China adjusted its COVID-19 control measures, an official said on Wednesday.",ChinaDaily,China
"With its China-bashing theories bankrupt in Africa and with its promised meager funding untenable, the ambition of the Biden administration to outcompete China on the continent is just wishful thinking.",ChinaDaily,China
"The aggravating of the border tensions is obviously not in the interest of either China or , as such clashes threaten to negatively affect the development of bilateral relations on a broader front.",ChinaDaily,China
"Japan may play games with the wording of the documents, but it is clear that the rightwingers in Japan are inclined to portray China as a ""threat"" so they can realize the country's full militarization.",ChinaDaily,China
is making efforts to secure medical supplies and services for the public after it optimized COVID-19 prevention and control measures last week.,ChinaDaily,China
"More than 20,000 pieces of artifacts and documents are on exhibit for the first time in a museum in northeast China's Heilongjiang Province, testifying crimes against humanity by the notorious Japanese germ warfare army known as Unit 731 during the .",ChinaDaily,China
India must restrain its troops from trespassing across the line of control and work with China to calm the situation.,ChinaDaily,China
"Firefighters fighting a truck fire had their clothes frozen stiff after working at the site for an hour in Datong, China.",ChinaDaily,China
"With its China-bashing theories bankrupt in Africa and with its promised meager funding untenable, the ambition of the Biden administration to outcompete China on the continent is just wishful thinking.",ChinaDaily,China
"Despite a rise in the number of automobiles, China has experienced a slight decrease in the amounts of four major air pollutants emitted by vehicles last year, according to an annual report from the Ministry of Ecology and Environment.",ChinaDaily,China
"China's ambitious target of achieving socialist modernization for its 1.4 billion people against the odds of an aging population, when accomplished, will shift the world's prosperity eastward, according to experts and various publications.",ChinaDaily,China
"The sculptors are working at full steam to create snow sculptures for the 35th Sun Island snow expo in Harbin, Northeast China's Heilongjiang province.",ChinaDaily,China
"The same Google bows to EU court's verdict but rejects HK govt's plea on China's national anthem. The hypocrisy shows that Google has lost its sense of responsibility the time it dropped the ""Don’t be evil"" motto. (Opinion writer Zhang Zhouxiang)",ChinaDaily,China
"China is expected to establish a long-term mechanism to completely root out disguised academic tutoring by June 2024, a new guideline said on Tuesday.",ChinaDaily,China
China makes record of 1 trillion yuan investment in water conservancy,ChinaDaily,China
"Photos show the scenery of Quxu section of the Yarlung Zangbo River in Quxu county, Southwest China's Tibet autonomous region.",ChinaDaily,China
The role that China's regional governments and local authorities play in boosting biodiversity was highlighted at the United Nations' on Tuesday.,ChinaDaily,China
"China's postal delivery has been accelerating its recovery since the beginning of December and is experiencing a new business peak, the State Post Bureau said.",ChinaDaily,China
"""China's investment and financing assistance to Africa is not a trap, it's a benefit,"" said Chinese ambassador to the United States at a recent news event.",ChinaDaily,China
"Canned yellow peaches are selling like hotcakes across China, their popularity helping relieve anxiety over .",ChinaDaily,China
"China must further strengthen the implementation of a proactive fiscal policy next year to underpin economic recovery despite many ongoing challenges, experts said.",ChinaDaily,China
"China will no longer release the figure of asymptomatic cases, according to the National Health Commission on Wednesday.",ChinaDaily,China
China demanded on Tuesday that strictly manage and restrain its front-line troops to jointly safeguard peace and tranquility in the border region following the latest clashes between the two countries' troops.,ChinaDaily,China
"Sirens echoed across Nanjing, Jiangsu province, and the city came to a halt at 10:01 am on Tuesday as China held its ninth national memorial ceremony to mourn the 300,000 victims of the Nanjing Massacre.",ChinaDaily,China
"China will accelerate legislation on compensation for ecological damage, as the mechanism continues to prove its role in helping restore damaged environments across the country, according to the Ministry of Ecology and Environment.",ChinaDaily,China
China's chip lawsuit against the United States at the World Trade Organization demonstrates the country's upholding of multilateralism.,ChinaDaily,China
A senior official of the Communist Party of China has called for unswervingly advancing the cause of national reunification.,ChinaDaily,China
"Foreign trade volume of Northwest China's Xinjiang Uygur autonomous region soared 59.8 percent year-on-year to 219.4 billion yuan (about $31.6 billion) from January to November this year, according to data from Urumqi Customs.",ChinaDaily,China
"Northeast China, once the nation's heavy-industry heartland, is upbeat about the future thanks to its revitalization drive based on innovation and opening-up.",ChinaDaily,China
"Photos taken on Wednesday show the view of the Snow Town scenic spot in Hailin city in Northeast China's Heilongjiang province. The Snow Town scenic spot officially opened recently. Enjoying a seven-month snow season, it has become an attraction for tourists for years.",ChinaDaily,China
"As of the end of November, Fuling, China's largest shale gas field, has produced over 53 billion cubic meters of shale gas over the past decade since it was discovered in 2012.",ChinaDaily,China
"China's banks reported a significant drop in their combined foreign exchange (forex) settlement deficit in November. The deficit last month declined 47 percent from October to $6.3 billion, according to the State Administration of Foreign Exchange.",ChinaDaily,China
"Photos taken on Tuesday show little swans at Donggu Lake wetland of the Quyuan administration area, Central China's Hunan province. Wintering migrant birds have recently arrived at Dongting Lake wetland.",ChinaDaily,China
Does China's COVID policy work? Data Speaks for Itself. Here is China's economy growth over the past 3 years.,ChinaDaily,China
"As of June 2022, China has provided 2.2 billion doses of to more than 120 countries and international organizations, extending a helping hand when they were in need. China will further devote itself to promoting global public health.",ChinaDaily,China
Stilt houses are traditional wood buildings for people of several ethnic minority groups in southern China. The wood components are connected with mortise-and-tenon joints instead of nails and screws.,ChinaDaily,China
People across China show off the stunning traditional attire of their ethnic groups.,ChinaDaily,China
"To prepare for the 35th Sun Island snow expo to be held in Harbin, Northeast China's Heilongjiang, artists are busy carving and shaping all kinds of snow art installations.",ChinaDaily,China
