Text,Media,GPE
"China's auto export industry registered steady growth amid headwinds such as chip shortage, rise of raw material prices, and the pandemic, with export totaling 2.46 million units in the first 10 months, up 54.1 percent on a yearly basis.",ChinaDaily,China
"With increasingly stronger institutions for biodiversity conservation, China has made significant progress in protecting biodiversity resources, said Minister of Ecology and Environment Huang Runqiu.",ChinaDaily,China
"The China Banking and Insurance Regulatory Commission (CBIRC) on Thursday announced that it will run commercial pension trials in 10 cities and regions nationwide for one year from Jan 1, 2023.",ChinaDaily,China
"By unilaterally breaking contracts it has signed with China, the UK government is not only politicizing economic affairs but also sabotaging its own reputation.",ChinaDaily,China
"China will conduct its fifth national economic census in 2023 to take stock of the country's economic and social development, the State Council said in a notice.",ChinaDaily,China
"China's services trade value grew 17.2 percent year-on-year in the first 10 months of 2022, data from the Ministry of Commerce showed on Thursday.",ChinaDaily,China
"According to the statistics of authorities of Suichuan county in East China's Jiangxi province, in 2022, nearly 100,000 people are engaged in -related industries, and each household secured an average income increase of more than 4,000 yuan ($566).",ChinaDaily,China
"China and the European Union should work together to promote the signing and entry into force of the China-EU Comprehensive Agreement on Investment to benefit their businesses and people at an early date, the Ministry of Commerce said.",ChinaDaily,China
An ancient coin hoard containing 1.5 tonnes of coins dating back to the Tang (618-907) and Song (960-1279) dynasties has been discovered in East China's Jiangsu province.,ChinaDaily,China
China's Yunnan passes regulation on protecting centuries-old tea trees,ChinaDaily,China
"China urged the United States to stop politicizing and weaponizing economic and issues, and treat companies from all countries, including China, fairly, the Ministry of Commerce said on Thursday.",ChinaDaily,China
Read the remarks by President Xi Jinping that shed light on his vision for China's space dream.,ChinaDaily,China
"A new record-high number of black-necked cranes, a species under first-class state protection in China, have been spotted in a national nature reserve in Southwest China's Yunnan province during the wintering period.",ChinaDaily,China
Temperatures plummeted in most parts of China and people keep themselves warm under piles of heavy clothing.,ChinaDaily,China
China will conduct its fifth national economic census in 2023 to take stock of the country's economic and social development.,ChinaDaily,China
"With the announcement of 20 new measures, will China forgo its dynamic Zero-COVID policy? China’s policy and its future, explained.",ChinaDaily,China
"China announced the implementation of its private pension plan to supplement the country's old-age insurance mechanism. The plan is open to qualified citizens in 36 cities and regions, including Beijing, Shanghai, Guangzhou, Xi'an and Chengdu.",ChinaDaily,China
"A regulation on helping implement the Patent Law is being amended in an effort to improve the legal system and promote high-quality development in this regard, an official from China's top intellectual property regulator said.",ChinaDaily,China
"The Fengyun 3E and 4B weather satellites and their ground application systems officially entered operation to support global forecasting and emergency disaster reduction on Thursday, according to the China Meteorological Administration.",ChinaDaily,China
"Construction has begun on two major high-speed railways in southwestern China, which are expected to be completed in 2027 and 2028, improving the region's high-speed railway network and boosting socioeconomic development.",ChinaDaily,China
Canada-China business has obstacles to address,ChinaDaily,China
"China has handled more than 100 billion parcels this year as of Thursday, evidence of the sector's strong resilience amid the epidemic as carriers strive to maintain the flow of goods to meet people's demands, the State Post Bureau of China said.",ChinaDaily,China
"Known as the “insect kingdom of North China”, Baxianshan National Nature Reserve in Tianjin has a forest coverage rate of 95% and a growing number of wild animals after years of afforestation efforts.",ChinaDaily,China
"US Commerce Secretary acknowledged that the US reaps huge benefits from trade with China and pledged not to decouple from it, with the exception of critical technology and other areas that Washington deems could ""undermine"" its national security.",ChinaDaily,China
Washington is only showing its true colors by trying to whip up discord in the South China Sea where there is already a consensus that peace and stability are in the best interests of the region.,ChinaDaily,China
A guideline on further regulating celebrity endorsements was released to improve governance of China's entertainment industry and provide new institutional support.,ChinaDaily,China
"and agreed to push forward building the China-Laos community with a shared future to bring more benefits to their peoples and promote regional peace, stability and development.",ChinaDaily,China
"China's prevention and control work is facing new situations and new tasks, with the weakening pathogenicity of Omicron, increasing uptake of vaccination and growing disease response experiences, Vice-Premier Sun Chunlan said on Wednesday.",ChinaDaily,China
"Although a small number of parcel delivery stations have been closed due to the latest outbreaks, China's parcel delivery network has been operating smoothly in general, the State Post Bureau of China said on Tuesday.",ChinaDaily,China
"The value of international freight handled on the China-Laos Railway has surpassed 10 billion yuan ($1.4 billion) nearly one year after the railway was put into operation, according to Yunnan International Railways Service Trade.",ChinaDaily,China
"Despite challenges posed by the COVID-19 pandemic, foreign catering companies are continuing to invest and expand in China, from constructing supply centers to developing online sales and deliveries.",ChinaDaily,China
"A subcontracted cargo vessel for Aluminum Corporation of China's bauxite project in Boffa, the Republic of Guinea, rescued six local fishermen in the open water close to the Western African country on Nov 29, according to China's Ministry of Commerce.",ChinaDaily,China
"The ninth China Shanghai International Children's Book Fair (CCBF) is taking place at West Bund Art Centre in Shanghai from Dec 2-4. More than 30,000 new children's books from 17 countries are showcased in the new exhibition hall by the Huangpu River.",ChinaDaily,China
"Over 100 relics and 24 houses, tombs, and pit remains, including earthenware, stoneware and boneware, have been unearthed in a site dating back to the Bronze Age in a newly-excavated area of 547.5 square meters at the site in northeast China's Jilin province",ChinaDaily,China
"A China Southern Airlines plane with 272 passengers aboard took off from Guangzhou Baiyun International Airport for New York on Thursday, as the airline officially resumed flights to New York. The round-trip between Guangzhou and New York City will operate twice a week.",ChinaDaily,China
"The US side should stop smearing and attacking China, work with China in the same direction, and establish the right way for two major countries to get along, a Chinese Foreign Ministry spokesperson said Friday.",ChinaDaily,China
Archaeologists have unearthed 53 sites of ancient cultural remains and 278 relics during an evacuation project in southwest China's Municipality from April to October.,ChinaDaily,China
"The People's Bank of China, the country's central bank, and the State Administration of Foreign Exchange, jointly issued a set of four measures on Friday to better facilitate overseas financial institutions' bond issuance in the Chinese onshore market.",ChinaDaily,China
Read the remarks by President Xi Jinping that shed light on his vision for China's space dream.,ChinaDaily,China
"ABB Group, the Swiss technology company, opened its mega factory in Shanghai on Friday, a move to further enhance its market presence in both China and the Asia-Pacific region.",ChinaDaily,China
Images of a snow leopard has been captured by two infrared cameras in the Wenchuan area of the Giant Panda National Park in Southwest China's Sichuan province.,ChinaDaily,China
"By curtailing innocent 's freedom for 1,028 days, the US ruined ties with China, wasted taxpayers' money, and exposed their folly before the world. Now the farce has come to an end and better never return. (Opinion writer Zhang Zhouxiang)",ChinaDaily,China
"A study showed that China could see 1.55 million deaths, should its current dynamic zero-COVID strategy be lifted. That is a part of the reason why China's optimizing the response is neither a ""full reopening"", nor ""lying flat"".",ChinaDaily,China
"China's factory activity contracted in November as renewed outbreaks disrupted output and subdued demand, a business survey showed.",ChinaDaily,China
"""We have elevated conservation to a national strategy in China,"" Minister of Ecology and Environment Huang Runqiu emphasized. He also highlighted the country's system of protected areas with a focus on national parks.",ChinaDaily,China
"More than 100 billion parcels have been handled in China this year as of Thursday, as carriers strive to maintain the flow of goods to meet people's demands, the State Post Bureau of China said.",ChinaDaily,China
"China's development — especially over the past 10 years — has set a good example for other developing countries to follow their own paths to modernization, scholars and experts said.",ChinaDaily,China
"China's prevention and control work is facing a new situation and new tasks, with the weakening pathogenicity of Omicron, increasing uptake of vaccinations and growing disease response experiences, Vice-Premier Sun Chunlan said recently.",ChinaDaily,China
"The int'l community should work together to promote global cooperation in biodiversity protection and uphold multilateralism and the principle of equal consultation, said Huang Runqiu, president and China's minister of ecology and environment.",ChinaDaily,China
"China urged the United States to stop politicizing and weaponizing economic and trade issues, and treat companies from all countries operating in the US fairly, the Ministry of Commerce said on Thursday.",ChinaDaily,China
"The remains of Comrade Jiang Zemin, an outstanding leader whose high prestige is acknowledged by all members of the Communist Party of China, the entire military and the Chinese people, were transferred to Beijing aboard a special flight on Thursday.",ChinaDaily,China
China's Yangtze River Economic Belt embraces a new vision as the country rolls out its plan to improve the business environment in the area.,ChinaDaily,China
"Wintering birds return to China's largest recovering freshwater lake — Poyang Lake, in East China's Jiangxi province.",ChinaDaily,China
"Experts called on the and China to further enhance crisis management and prevent differences from evolving to conflicts, especially in terms of question.",ChinaDaily,China
"Over 100 relics and 24 houses, tombs, and pit remains have been unearthed in a site dating back to the Bronze Age in NE China's Jilin province.",ChinaDaily,China
Snow leopard images have been captured by two infrared cameras in the Wenchuan area of the Giant Panda National Park in SW China's Sichuan province. Snow leopards are under China's highest national-level protection.,ChinaDaily,China
"Archaeologists have excavated the ruins of house foundations dating back more than 5,000 years in the Yangshao village site in Central China's Henan province.",ChinaDaily,China
"US prosecutors on Thursday asked a judge to dismiss bank fraud and other charges against Meng Wanzhou, the chief financial officer of China's Huawei Technologies whose 2018 arrest strained relations between the US and China.",ChinaDaily,China
"Home to numerous floating islands, Xiapu county in Ningde, East China's Fujian province, has benefited from its natural resources and marine tourism over the years.",ChinaDaily,China
"Universal vaccination and boosters, coupled with timely and effective treatment of critically ill patients, will be the focus and challenge of the next stage of work for prevention and control in China, said an expert team.",ChinaDaily,China
"Safeguarding the authority of the Constitution is not only a vital guarantee for advancing law-based governance on all fronts, but also a top priority for implementing the modernization of China's rule of law, legal professionals said.",ChinaDaily,China
"ABB Group opened its mega robotics factory in Shanghai on Friday, which is expected to further enhance the Swiss tech major's market presence in both China and the Asia-Pacific region, its senior executives said.",ChinaDaily,China
"China-Laos key link, benefits both nations",ChinaDaily,China
"The mission crew is scheduled to return to Earth on Sunday after a six-month stay inside the Tiangong space station, according to the China Manned Space Agency.",ChinaDaily,China
"As an important participant, contributor and leader in the construction of a global ecological civilization, China has long been advancing global biodiversity governance with concrete actions.",ChinaDaily,China
"In the first year of operation, the China-Laos transported 8.5 million passengers and 11.2 million metric tons of goods with a value of over $1.7 billion.",ChinaDaily,China
"As China marks its national Constitution Day on Dec 4, let's review some of President Xi Jinping's remarks on upholding the authority of the Constitution. (4/4)",ChinaDaily,China
Vegetable growers have been busy harvesting vegetables to supply the market amid recent cold waves in East China's Anhui province.,ChinaDaily,China
"Electric carmaker Tesla will recall 435,132 vehicles in China as a software glitch may cause tail lights to fail to illuminate, China's top quality watchdog said.",ChinaDaily,China
"Boasting a long history of cultivation, Ya'an in SW China's Sichuan province is the birthplace of dark tea and green tea making techniques. Inherited by generations of tea makers, both techniques are now listed as national-level intangible cultural heritage.",ChinaDaily,China
"As China marks its national Constitution Day on Dec 4, let's review some of President Xi Jinping's remarks on upholding the authority of the Constitution. (3/4)",ChinaDaily,China
"China will continue to facilitate dialogue and cooperation among children and young people from the Lancang-Mekong regions in a joint effort to build a green, sustainable future for all, officials said.",ChinaDaily,China
"Shenzhou XIV crew returned to Earth! A reentry capsule carrying the crew - Senior Colonel Chen Dong, Liu Yang and Cai Xuzhe - touched down on Earth at Dongfeng Landing Site in northwestern China at 8:09 pm after flying nine hours in a re-entry trajectory.",ChinaDaily,China
What plants can survive after being submerged in water for half a year? The ones on Guangyang Isle in Southwest China's Chongqing Municipality displayed their tenacity for survival in the water and helped restore the ecosystem of the isle.,ChinaDaily,China
": What should you expect? What's China's role in the presidency? Erik Nilsson, a reporter of China Daily, talked with Huang Runqiu, COP15 president and China's minister of ecology and environment, about the conference and more.",ChinaDaily,China
"Over recent days, people from across China have continued to mourn Jiang Zemin, who passed away on Wednesday in Shanghai at the age of 96.",ChinaDaily,China
"As China marks its national Constitution Day on Dec 4, let's review some of President Xi Jinping's remarks on upholding the authority of the Constitution. (2/4)",ChinaDaily,China
"As of Friday, the China-Laos Railway has handled over 8.5 million passenger trips and transported 11.2 million tonnes of cargo since its launch a year ago, the Chinese railway operator said.",ChinaDaily,China
"View highlights of the first vocational skills competition of Jiangxi in East China. The main contests of the competition, containing 85 programs, kicked off in Nanchang on Friday.",ChinaDaily,China
"Eastern black crested gibbon is among the 25 most endangered primates in the world. The small karst forest on the border between China and Vietnam is their last haven. Through the two countries’ joint efforts, the species has been rescued and protected.",ChinaDaily,China
"China's Shenzhou XIV manned spaceship separated from the space station combination on Sunday, and the astronauts onboard, Chen Dong, Liu Yang and Cai Xuzhe, will soon start their journey home, according to the China Manned Space Agency.",ChinaDaily,China
"As China marks its national Constitution Day on Dec 4, let's review some of President Xi Jinping's remarks on upholding the authority of the Constitution. (1/4)",ChinaDaily,China
"Wang Mengping, a train conductor on the China-Laos , has shown great devotion in her work and formed a close friendship with the Lao people. Click the video to find out more about her.",ChinaDaily,China
"The Agricultural Development Bank of China, the country's rural policy bank, has strengthened its financial support for the construction of roads in the country's rural areas.",ChinaDaily,China
"Universal vaccination and boosters, coupled with timely and effective treatment of critically ill patients, will be the focus and challenge of the next stage of work for prevention and control in China, said the expert team in Shanghai.",ChinaDaily,China
"China's outlook on human rights has been continuously enriched and improved in practice, with its own perspectives and ideological connotations, based on the actual conditions of the country, said a report on China's human rights development on Monday.",ChinaDaily,China
"China's deep space exploration laboratory, which started operation in June this year, is recruiting top talents from around the world, according to the China National Space Administration (CNSA) on Monday.",ChinaDaily,China
"China's courier sector has seen an accelerated recovery, with average daily business volume steadily rising since late November, the State Post Bureau said Monday.",ChinaDaily,China
"From Tuesday, China's gasoline and diesel prices will reduce by 440 yuan ($62.51) per ton and 425 yuan per ton, respectively, said the National Development and Reform Commission.",ChinaDaily,China
"Thanks to a series of ecological preservation and soil improvement programs in recent years, a substantial part of the once damaged vegetation has been restored in Maqu county, Gannan Tibetan autonomous prefecture of Northwest China's Gansu province.",ChinaDaily,China
"Despite the COVID-19 pandemic and decreasing external demand, China's foreign trade has registered steady growth. Private enterprises have made a marked contribution to the country's overall performance in foreign trade.",ChinaDaily,China
"A freight train from Laos to China loaded with 25 standard shipping containers filled with fruit arrived at Mohan Railway Station in Yunnan province on Saturday, marking the opening of the designated supervision site for imported fruit from Laos.",ChinaDaily,China
Recent measures will boost the confidence of private foreign trade companies and enable them to contribute more to China's economic recovery in the post-pandemic era.,ChinaDaily,China
"The post-2020 Global Biodiversity Framework is expected to be formulated and adopted during COP15. ""Currently, the structure and core content of the post-2020 GBF has been basically agreed upon,"" said Huang Runqiu, COP15 president and China's minister of ecology and environment.",ChinaDaily,China
"Japan’s attempt to stigmatize China’s image by politicizing and instrumentalizing human rights issues is doomed to fail, FM spokeswoman Mao Ning said after Japan’s upper house adopted a resolution expressing concern over human rights in China.",ChinaDaily,China
"For more than two decades, Honghe National Nature Reserve in NE China’s Heilongjiang province has invested in improved artificial nests to attract the endangered oriental white storks to breed and thrive there.",ChinaDaily,China
China's auto manufacturers focus on wider Asian market,ChinaDaily,China
"Cooperation between the US and the EU should not target a third party or stoke antagonism by making an issue out of China, FM spokeswoman Mao Ning said in response to groundless accusations made by the latest US-EU Dialogue on China.",ChinaDaily,China
"A train loaded with 25 containers of fruits from Thailand and Laos on Saturday arrived at Mohan railway station of the China-Laos Railway, Southwest China's Yunnan province.",ChinaDaily,China
"Launched to nurture China's technologically advanced small and medium-sized enterprises, the Beijing Stock Exchange has made steady yet impressive progress in its turbulent first year of operations.",ChinaDaily,China
The People's Bank of China and the Monetary Authority of Macao have renewed their bilateral currency swap agreement for another three years.,ChinaDaily,China
"In the British Museum, stone came from Egypt; the Dunhuang wall paint came from China; and the Elgin Marbles came from Greece. The relics are testimony to both history as well as the pillage of the colonialists. (Opinion writer Zhang Zhouxiang)",ChinaDaily,China
"An abundance of data has shown that China's vaccines are safe and effective for the elderly and other vulnerable groups, drugmakers have said.",ChinaDaily,China
Several cities and provinces have recently optimized COVID-19 control measures concerning mass nucleic acid testing and medical services to minimize the impact on people and economic activity. (China Daily),ChinaDaily,China
"China's novel ideas, measures and practices in terms of how to respect and protect human rights can offer inspiration for the rest of the world, especially for developing countries, said a new think tank report on Monday.",ChinaDaily,China
"Have you ever seen a forest in the river? Many people believe that the glamorous view of the Qingshan Lake Scenic Area in Hangzhou, China is reminiscent of The Wizard of Oz.",ChinaDaily,China
"Chinese Foreign Ministry has issued a report on China-Arab cooperation in the new era, laying out prospects and the way forward for building a community with a shared future of China and Arab states.",ChinaDaily,China
Industrial data showed that 13.3 million used cars were traded in China in the first ten months of 2022.,ChinaDaily,China
"China's central bank Tuesday conducted 2 billion yuan (about $287 million) of reverse repos to maintain liquidity in the banking system. The interest rate for the seven-day reverse repos was set at 2 percent, according to the People's Bank of China.",ChinaDaily,China
"Over 100 relics and 24 houses, tombs, and pit remains have been unearthed in a site dating back to the Bronze Age in Northeast China's Jilin province.",ChinaDaily,China
"By 2025, a TCM information system that works in coordination with China's medical and healthcare mechanism will be established, aiming to bring more benefits to the public, according to the National Administration of Traditional Chinese Medicine.",ChinaDaily,China
"China and Saudi Arabia signed onto seven cooperative projects in Riyadh on Monday, further expanding production cooperation between the two nations.",ChinaDaily,China
"The relaxing of China's pandemic prevention and control policy is in line with the weakening of the virus' lethality, the high vaccination rate in the nation and people's psychological readiness.",ChinaDaily,China
"China has a clear vision for protecting its own rich biodiversity, much of it endemic, which is encapsulated in the goal of realizing an ecological civilization that has been written into the country's Constitution.",ChinaDaily,China
"China strongly opposed to a report on Chinese development released by the United States, which distorted China's national defense policy and military strategy, a spokesman for the Ministry of National Defense said in a statement on Tuesday.",ChinaDaily,China
"Kiki Davenport, a theater artist from the United States, who now lives in China, is really surprised by how innovative China actually is and how leading China is in the world from the 5G area to other high-tech modes of technology.",ChinaDaily,China
China has announced improved fund management rules for panda bond issuance as part of the efforts to promote further opening-up in its bond market.,ChinaDaily,China
"With the US' tried-and-true unilateralism and war profiteering hurting other countries around the world, it's only natural that Europe and China find common ground based on upholding the purposes of the UN Charter and supporting multilateralism.",ChinaDaily,China
China's most southerly province is one of the front-runners in the nation's new nature parks system.,ChinaDaily,China
"Workers of Chinese companies are busy with overseas orders in Qingdao, East China's Shandong province.",ChinaDaily,China
"China’s development is integrated with the development of the world for mutual betterment, FM spokeswoman Mao Ning said after German Chancellor Olaf Scholz said China's rise does not warrant isolating Beijing or curbing cooperation.",ChinaDaily,China
"China urged Australia to stop all forms of official interactions with and stop sending wrong signals to “Taiwan independence” separatists, FM spokeswoman Mao Ning said after a group of Australian lawmakers visited the Taiwan region.",ChinaDaily,China
