Text,Media,GPE
": US politicians have no curiosity about the motives, aspirations or concerns of the other, no use for a dialogue of equals, no tolerance for difference, no capacity for diplomacy.",globaltimesnews,USA
"China's Foreign Ministry on Thu urged the US to stop politicizing and weaponizing economic and trade issues, after reports of the US' plan to remove some Chinese firms from a red flag trade list.",globaltimesnews,USA
"Chinese electric vehicle battery maker CATL told GT that the company is considering investment options in possible US plant, but a decision hasn’t been made yet.",globaltimesnews,USA
"China, the EU and Russia criticized US’ decoupling moves at a WTO meeting on Wed, showing that those with a sense of justice all oppose to US hegemony, the Chinese FM said on Thurs, urging the US to correct its mistakes, abide by WTO rules.",globaltimesnews,USA
""" debt trap"" hype aims to paint China as an unreliable partner, lays bare empty US commitments to Africa: African scholar",globaltimesnews,USA
"urges to stop taking discriminatory and unfair practices against specific Chinese enterprises, and stop politicizing and weaponizing economic and trade issues, spokesperson comments on US planning to remove some Chinese firms from a red flag trade list.",globaltimesnews,USA
"-based healthcare firm Abbott Nutrition said it will stop selling infant and children nutrition products in the mainland in 2023 to focus on medical equipment and drugs, stressing that its long-term investment in the market remains unchanged.",globaltimesnews,USA
": As long as China and the US adhere to the spirit of mutual respect, professionalism and practical cooperation, they will be able to find a feasible cooperation path that meets their respective legal and regulatory requirements.",globaltimesnews,USA
": We hope that the audit cooperation between China and the US can continue to advance, and serve as a demonstration of the cooperation between China and the US.",globaltimesnews,USA
US added 36 Chinese high-tech companies to “” in what experts said was a last-ditch effort as they run out of effective methods to hobble China’s chip industries.,globaltimesnews,USA
: US in Africa vs China in Africa.,globaltimesnews,USA
"Japan, China, UK and many economies sold their in Oct, with China's holdings hitting a 12-year low. Analysts said that the selling was a sign of waning confidence in US Treasury bond.",globaltimesnews,USA
"' move to frequently include Chinese enterprises in the ""entity list"" damages market rules and international economic and trade order, which is not conducive to China, the US, or the whole world, MOFCOM spokesperson said.",globaltimesnews,USA
"China strongly condemns the deadly attack at a hotel in Kabul, Afghanistan, which reminds us all that terrorism is the enemy of mankind, and that the intl community should continue to work together and combat terrorist forces, said Chinese envoy at UN Zhang Jun on Thu.",globaltimesnews,USA
Chinese ambassador to the US met with US Treasury Secretary Janet Yellen on Thu. They had an in-depth exchange of views on implementing the consensus reached by the Chinese and US presidents in Bali and to continue to strengthen on bilateral economic and trade issues.,globaltimesnews,USA
"welcomes the decision made by the regulatory authority based on the professional consideration of supervision, and looks forward to working with the US side to continue to promote the annual audit supervision cooperation: official",globaltimesnews,USA
"US prolongs Russia-Ukraine conflict for three aims, aggravates nuclear war risk: experts at",globaltimesnews,USA
"The US & EU have not made substantial efforts to ease Russia-Ukraine conflict, but even in the opposite direction by providing weapons and ammunition. The key to solving it lies in their hands: Zhou Li, former vice minister of the Intl Department of the CPC Central Committee",globaltimesnews,USA
"“US is no longer in prime of its life, no longer the protagonist of movies like 007 who are handsome, elegant, quick in action.” Chinese foreign policy experts discuss China-US relations at the .",globaltimesnews,USA
"The US has 3 goals in the Russia-Ukraine conflict: to comprehensively weaken Russia, to stabilize the regime in Ukraine and to push Europe to follow US policies, said Wu Xinbo, an international studies expert at Fudan Univ, at the",globaltimesnews,USA
"All dirty tactics used by the US to contain China are useless. They cannot stop China's development, nor can they stop the narrowing of gap between China’s comprehensive national strength & that of the US, PLA Navy rear admiral Yang Yi told",globaltimesnews,USA
"The US is like a mafia boss in his old age, can barely walk but with particularly large power, Jin Canrong, associate dean of the School of International Studies at the Renmin University of China, told the",globaltimesnews,USA
"The DPP authorities had failed to fool Foxconn into investing in the US, and now they want to stab it again to show their loyalty to Washington.",globaltimesnews,USA
: US’ anti-China games.,globaltimesnews,USA
"… and if each unit wants to seize leadership or pursue its own interests as it seeks to engage in competition with China, the US govt's China strategy may be derailed: analysts",globaltimesnews,USA
": China and the US used to be a major power and a superpower, but now they are becoming two superpowers. This requires the two countries to have a new model of relations, said experts at the 2023 Global Times Annual Conference",globaltimesnews,USA
": The reason why the US fails to produce an effective China policy lies in its wrong perception of national interests & its overall wrong grasp of China ties. No matter how many units focusing on China are launched, it will be futile.",globaltimesnews,USA
"China, the US, the EU and 52 other participants have completed domestic ratification of the WTO’s Joint Statement Initiative on Services Domestic Regulation, which could help firms save $150 billion in annual costs.",globaltimesnews,USA
"US’ latest move in extending tariff exclusions on 352 Chinese goods sends positive signs as it is beneficial to normalize bilateral trade, Chinese experts said.",globaltimesnews,USA
"Jonathan Tepperman, former editor of magazine, wrote that should adjust policies to deal with a ""collapsing ."" Many Western media reports have intensified ""China collapse"" fearmongering, an attempt to cover up crises in the West.",globaltimesnews,USA
"China appreciates Australia’s attitude to correct mistakes made by its former govt and willingness to bring the ties back on track ASAP, but also warned that US and anti-China forces within Australia may interrupt the recovery of ties: experts",globaltimesnews,USA
": No matter how China relaxes its COVID policies, it is safe to say that this has been conducted much more thoroughly and objectively than the outright disregard for human life demonstrated by countries like the US.",globaltimesnews,USA
"GT launched its annual global survey to collect public opinion on major international events, which was conducted across 33 countries. How has US'/China's international influence changed? What change do you expect to see in China-US relationship? Check out the results:",globaltimesnews,USA
"Opinion: The US has tried to “decouple” itself from China economically. However, this is self-inflicted harm to its own economy. The last example is Gallagher’s remarks saying he plans to focus scrutiny on US investments in China.",globaltimesnews,USA
…stressing that the recovery of China-Australia relations could also pave way for the easing of tensions between China and the US.,globaltimesnews,USA
": China is the only country that has earnestly fought the battle against COVID with strict measures for three years, unlike the US, which had given up fighting the virus long long ago.",globaltimesnews,USA
: at US airports.,globaltimesnews,USA
": The key to solving the Russia-Ukraine conflict lies in the hands of the US & EU. Right now, we must be vigilant against a protracted and expanded conflict between Russia and Ukraine, experts said at .",globaltimesnews,USA
"The China-Russia joint naval drill comes at a complicated time when the US keeps promoting its Indo-Pacific strategy and Japan has broken away from its defense-only principle, with tensions remaining high in the Taiwan Straits.",globaltimesnews,USA
"China is constantly optimizing its response to strike a balance between epidemic prevention & economic & social development, Chinese FM responded to remarks from US on global concerns over China’s epidemic situation.",globaltimesnews,USA
": From China-Russia cooperation, what the US and the West read should not be ""threats,"" but the proper way to get along.",globaltimesnews,USA
"China's top securities regulator on Wednesday vowed to establish a regularized mechanism for cooperation in supervision between and the , in a bid to cultivate a more stable and predictable international regulatory cooperation environment.",globaltimesnews,USA
": The divergence of economic forecasts about the Chinese and US economies points to the challenges ahead, which calls for more cooperation than confrontation pushed by Washington.",globaltimesnews,USA
"Edgar Snow’s descendant hopes China, US can still find common ground, carry on ties recognized in reply letter from Xi",globaltimesnews,USA
: US’ bullying harms world trade.,globaltimesnews,USA
"Analysts believe that Zelensky's first known foreign visit since the Russia-Ukraine conflict aims to rally more military support from the US. As battlefields in certain areas become more intense, prospect of reaching a peaceful settlement becomes slimmer.",globaltimesnews,USA
"Measured by the capacity by which new infrastructure serves the public, China dwarfs the US with its super digital infrastructure. The sector is set to welcome further investment as China prioritizes stabilizing economic growth in 2023.",globaltimesnews,USA
"Asked about whether will accept the offer of vaccines to deal with the ongoing surge, the Chinese FM said Wed that China has enough medical supplies to meet the demand & will continue cooperating with the international community.",globaltimesnews,USA
: Only after one has abided by rules can it require others to do so. This is the basic principle of human society. Why on earth should the US be an exception?,globaltimesnews,USA
": US uses ""Indo-Pacific Partnership for Maritime Domain Awareness (IPMDA)"" to stir confrontation in South China Sea, leading militarization of the region, while China seeks blue economy partnerships with ASEAN.",globaltimesnews,USA
": The irresponsible US is alone in the WTO. It has neither the power nor the ability to drive China or anyone else out, nor does it have the courage to withdraw from this cornerstone organization of international trade.",globaltimesnews,USA
": Washington hopes Manila to take sides with the US in its confrontation with China and the South China Sea dispute, leaving room for the US to intervene. US attempts to stir up trouble in the South China Sea won’t succeed.",globaltimesnews,USA
"If Washington continues with its reckless approach to cause global trade disruptions and turn the WTO framework into a mere figurehead, a failing multilateral regime will eventually boomerang on the US: observers",globaltimesnews,USA
: Why is Quad's Indo-Pacific Partnership for Maritime Domain Awareness (IPMDA) widely seen a plan targeting China? How does it push US' hegemonic ambition? How do Southeast Asian countries view IPMDA?,globaltimesnews,USA
"China urged the US to respect a WTO panel ruling that rejected US’ origin labelling requirement for HKSAR products. Admonishing the US against politicizing trade issues, China crystallized its stance on upholding a rules-based multilateral trade system.",globaltimesnews,USA
"Zelensky’s visit to Washington shows that he was making great efforts to make “supporting Ukraine to fight Russia” an “unchallengeable political correctness” in the US, while the two parties have shown different opinions recently, said analysts…",globaltimesnews,USA
": The Russia-Ukraine conflict is bound to become more brutal, intense, and prolonged as the US increases its support for Ukraine. With the risk of spillover of the war, the world, already in crisis, is unlikely to see peace soon in the new year.",globaltimesnews,USA
Chinese Commerce Ministry on Thu said it welcomes WTO's ruling that the marking requirement imposed on Hong Kong SAR products by the US is inconsistent with WTO rules. The ministry urges the US to correct wrong practices and uphold the rules-based multilateral trading system.,globaltimesnews,USA
"While answering the question of and ' role in Africa, Mo Ibrahim said in an interview with CNN: ""For some years now China has been investing in infrastructure in Africa… While we need the US to be really engaged with Africa.""",globaltimesnews,USA
"In face of -led Western containment, it’s important to seek more partners in non-Western world. can use its own advantages under One Country, Two Systems to seek more international cooperation: expert",globaltimesnews,USA
"Washington is habitually turning to groundless human rights claims to justify its interference in normal business operations, experts said, slamming the latest instance of denialism as a continuation of US hostility against China.",globaltimesnews,USA
": Every time the US has harmed China's national interests, China has launched reciprocal countermeasures in a timely manner.",globaltimesnews,USA
"US grills 8 major automakers on supply chain links to alleged ""forced labor"" in Xinjiang, in fresh instance of denialism amid continued hostility toward China: experts",globaltimesnews,USA
"Analysts said that the US needs to strengthen the credibility of its China policy, control the negative factors and actively maintain the trend of positive cooperation brought by the latest meeting between the heads of state.",globaltimesnews,USA
"Chinese State Councilor and Foreign Minister Wang Yi had a phone conversation with US Secretary of State Antony Blinken on Friday, during which Wang called on the US to stop its old tricks of unilateral bullying and containing China’s development.",globaltimesnews,USA
"Affairs in the Xizang region are 's internal affairs and the US has no right and is not qualified to interfere; any intervention will face China's firm countermeasures, FM spokesperson said after China sanctioned two US individuals.",globaltimesnews,USA
"The US can't talk cooperation while stabbing China – this is not reasonable competition but only intensifies conflict. Such an old trick of unilateral bullying had not and will never work on China, said Wang.",globaltimesnews,USA
"Chinese State Councilor and FM Wang Yi had a phone talk with US Secretary of State Antony Blinken on Friday, during which Wang said the top leaders' meeting last month sent positive signals but the US is calling for dialogue while at the same time trying to contain China.",globaltimesnews,USA
"Chinese FM announced sanctions on Yu Maochun, known as Miles Yu in the US, and Todd Stein as countermeasures to US’ illegal sanction on two Chinese officials citing so-called human rights issues in China’s Xizang",globaltimesnews,USA
"The office urged those in the US to immediately correct their wrong words and deeds on the Taiwan question and warned the DPP authorities that ""Taiwan independence"" has no way forward, and ""relying on the US to seek independence"" is a dead end.",globaltimesnews,USA
"The resolution of the Taiwan question is the Chinese people's own business, and should be decided by the Chinese people, Taiwan Affairs Office of the State Council said in response to the US' 2023 National Defense Authorization Act that contains negative content concerning China.",globaltimesnews,USA
"China deplores and firmly opposes the US' approval and signing into law the National Defense Authorization Act for Fiscal Year 2023, which contains negative content concerning China, and China has made serious démarches to the US, Chinese Foreign Ministry said Sat.",globaltimesnews,USA
": The US has become the grey rhino of the international trade system. The damage aroused by its collision may lead to the collapse of the international trade system, which will inevitably trigger severe global consequences.",globaltimesnews,USA
": The world's trading powers must act to prevent a global trade war. If the US continues to add fuel to the fire at such a time of global crisis, it is engaging in criminal acts against the common interests of humankind.",globaltimesnews,USA
"China's genuine openness in sharing the use of greatly contrasts with and offsets the current turbulence around the world, result of US political games of forcing countries to take a side in bloc confrontation, even in space: analysts",globaltimesnews,USA
"As this marked the 1st time the US government will finance weapons for the island, China expressed an intense response & strong opposition, and experts said that this could trigger China's firm countermeasures.",globaltimesnews,USA
": Recently, almost all annual US' NDAA contains content on Taiwan, exposing US defense budget is far from being used for its defense, but interfering in internal affairs of other countries. US defense policy is offensive, not defensive.",globaltimesnews,USA
"Overall successful diplomatic work helped navigate complex global and regional issues, advance some consensus and strike a balance in maintaining strategic stability in relations with other major countries such as the and : experts",globaltimesnews,USA
: The Capitol riot is an ugly scar in the history of US partisanship. The final report on this event has highlighted such hideousness and the embarrassment it has brought US politics.,globaltimesnews,USA
"The US and Japan both announced on Fri increases in defense budgets for next year, naming Taiwan question among the reasons. This reflects that the two countries are preparing to interfere in the Taiwan question militarily, experts warned.",globaltimesnews,USA
": The ""decoupling"" pushed by US, and the forced revision of international order into a Cold War style confrontation, is not in the interests of Europe. US’ allies should think twice about following US foreign policies when it comes to “decoupling.”",globaltimesnews,USA
"China strongly urges the US to refrain from implementing the negative China-related provisions in the National Defense Authorization Act, which plays up ""China threat"" in disregard of the facts, poisons relations between the two countries and militaries.",globaltimesnews,USA
"A medical school apologized for conducting dozens of unethical medical experiments including putting pesticides and herbicides on men’s skin and injecting it into their veins on at least 2,600 incarcerated men in the 1960s and 1970s, US media reported.",globaltimesnews,USA
Wang stressed that facts have shown that China and the US cannot decouple from each other. Playing up competition leads to nothing good and seeking cooperation is a necessity rather than a choice.,globaltimesnews,USA
"We firmly resist the wrong US policy toward China and will work to find a correct way for China and the US to get along as two major countries, Chinese State Councilor and FM Wang Yi said on Sunday during a symposium on international relations and China's diplomacy",globaltimesnews,USA
"China lodged solemn representations over the US passage of National Defense Authorization Act, which plays up ""China threat"" theory in disregard of facts. It undermines China's sovereignty, security, and poisons bilateral & military ties: Ministry of National Defense",globaltimesnews,USA
": They were grateful to the US just a few days ago, imagining that they have acquired more capital to ""confront the mainland and seek independence,"" but the PLA drill immediately brought them back to reality.",globaltimesnews,USA
"Any economic agreement signed by US and DPP authorities of an ""official nature"" will be strongly counteracted by the mainland, especially considering that such a provocative demonstration may lead to similar negative moves mirrored by US' allies: expert.",globaltimesnews,USA
": At a time when China and the US have already won hard-earned results in bilateral auditing cooperation, it is unwise for the US to signal that more political pressure may be coming for US-listed Chinese companies.",globaltimesnews,USA
: Some US & Western media use the epidemic as an anti-China tool. Anything China does in this regard will be criticized. China's society is very resilient and it is not easy to mess up China. Their ulterior motives will turn to be wishful thinking.,globaltimesnews,USA
: US has adopted the same approach to Kiev as it did to Kabul: pay for the entire military and most of the government and prop them up as proxies. Except this conflict is far more intense. It's someone else bleeding out to death here.,globaltimesnews,USA
"PLA drills around Taiwan island on Sunday in response to recent US-Taiwan collusion were record-breaking, surpassing even the large-scale drills in August following US House Speaker Nancy Pelosi's provocative visit to Taiwan: observers",globaltimesnews,USA
China's publicly traded high-end manufacturing companies withstood the US trade war and tech coercion to achieve a compound revenue growth rate of 12 percent from 2017 to 2021.,globaltimesnews,USA
"US electric carmaker Tesla told the Global Times that reports about its Shanghai plant suspension “are inaccurate”, responding to a Reuter report which claimed Tesla is suspending production at its Shanghai plant.",globaltimesnews,USA
"Video shows the ongoing severe weather in , New York. The heavy storm has killed at least 18 people, AP reported. More than 1.7 million people were still without power as of Monday morning, according to a US power monitoring website.",globaltimesnews,USA
": As TikTok has gained a larger market share in US, there has been a menacing resurfacing of national security allegations, which offers a glimpse into the deterioration of regulatory environment there.",globaltimesnews,USA
"Taking place at a time when US&Japan constantly instigates tensions over hotspot issues involving Taiwan Straits, Korean Peninsula and South China Sea, experts said shows strength and determination to safeguard regional peace&stability.",globaltimesnews,USA
"The plan, which has been strongly opposed by Taiwan people, is viewed by experts as a deplorable decision to push Taiwan people, especially youth, to the frontline of a possible military conflict under the irresistible pressure of the US.",globaltimesnews,USA
"Consular sections at US Embassy in , and Consulates Guangzhou and Shenyang will resume routine consular services on Jan 3. Shanghai will continue emergency operations until further notice, while CG Wuhan has resumed part of US citizen services: US Embassy Tue",globaltimesnews,USA
": In 2023, the ""eye of the storm"" for humanity will continue to be the US. Standing back to back, Moscow and Beijing will resist the onslaught of the West and at the same time try to build a new world order.",globaltimesnews,USA
"In Asia, 2022 was the year with hidden risks growing due to the provocation of the on question. Experts believe that overall regional stability will continue being challenged by the US-led hegemony toward which China should be well-prepared.",globaltimesnews,USA
": NATO's intent is to crack Belgrade down by backing Kosovo. As Serbia maintains close ties with both Russia and China, two of Washington's top rivals, the country has long been a thorn of the US.",globaltimesnews,USA
"Blindly following US and fanning the flames of camp confrontation in the region is harmful to its national interests. Seoul should tread cautiously and strive to ease regional tension, otherwise it will make major mistakes in its strategy: analysts",globaltimesnews,USA
Chinese ambassador to the US Qin Gang published a video of him trying his first throw at an NBA game with Washington Wizards. Qin tweeted it was a renewal of the special relationship as Washington Wizards was the first NBA team to visit China.,globaltimesnews,USA
"HEAT or EAT? That is a hard choice for many British families in this winter. ""No one can tell us for sure how severe the winter will must be desperately worrying for many other people."" Founder of told GT reporter in her show.",globaltimesnews,USA
": It seems the real problem of Zelensky is not to convince the US political establishment about the need to continue supporting Kiev, but rather to preserve the Ukrainian narrative in the focus of the US public.",globaltimesnews,USA
": China has taken a big test in 2022, which made us stronger and more determined. We kept marching forward while biting the bullet. Navigating through wind and storm, we never stopped.",globaltimesnews,USA
"Experts called restrictions on China travelers by countries such as US and Japan a discriminatory move, and their real intention is to sabotage China’s three years of COVID-19 control efforts and attack the country's system.",globaltimesnews,USA
"The PLA is well-equipped with minesweeping equipment, including robots, that can nullify threats from the mine-laying systems the US is planning to sell to the island of Taiwan, experts said.",globaltimesnews,USA
Australian media viewed Farrell's remark as a signal of a potential relations thaw. Chinese experts said Australia should seize the chance of common development with the world's second-largest economy while better balancing relations with US.,globaltimesnews,USA
"This shows that the Chinese carrier is ready to defend the country against potential US attacks launched from Guam, including military interference attempts over the Taiwan question, analysts said.",globaltimesnews,USA
