Text,Media,GPE
"The Liaoning aircraft carrier group of the PLA Navy was recently spotted for the first time sailing close to Guam, a key US military node in the second island chain, during its ongoing exercises in the West Pacific, according to Japan's Defense Ministry.",globaltimesnews,USA
"Among US’ malign trade behavior, the harshest crackdowns were aimed at containing China’s chip advance, the bans the have further intensified last year, but China stands firm, fights back, and continues to emerge stronger under a top-to-down determination.",globaltimesnews,USA
The cancellation of three exchanges between the Chinese & US militaries was a necessary countermeasure against the US’ moves that intentionally created a major crisis and violated China's sovereignty & territorial integrity: Chinese Defense Ministry,globaltimesnews,USA
"If the US truly wants to resume constructive dialogue and exchanges with the Chinese military, it must show honesty through action: Chinese Defense Ministry",globaltimesnews,USA
"greenlights conditional import of US' antiviral Lagevrio while Pfizer's COVID-19 treatment drug Paxlovid has become available in some community clinics in Beijing, as the country steps up efforts in medical treatment amid surging infections.",globaltimesnews,USA
US' latest arms sales to Taiwan are conniving and supporting the Taiwan secessionists and undermining peace and stability across the Taiwan Straits. DPP's collusion with external forces is doomed to fail: Taiwan Affairs Office spokesperson Zhu Fenglian,globaltimesnews,USA
China urged the US to stop such dangerous provocative actions and stop smearing China. China will continue taking necessary measures to firmly safeguard its sovereignty and security and support the peace in the South China Sea: FM spokesperson Wang Wenbin,globaltimesnews,USA
"The US has frequently sent ships and planes to conduct close-in reconnaissance against China, and the provocative and dangerous actions of the US are the root cause of maritime security problems: Chinese Foreign Ministry on reports about US and Chinese jets' close encounter",globaltimesnews,USA
China has always been firmly opposed to US arms sales to China's Taiwan region and will take strong measures to firmly safeguard sovereignty and security interests: spokesperson Wang Wenbin,globaltimesnews,USA
"We urge the US to abide by one-China principle, earnestly implement the promise made by US leader not to support ""Taiwan independence"", stop arms sales and military contacts with Taiwan: FM spokesperson on US latest approval of $180 million arms sales to Taiwan Wenbin",globaltimesnews,USA
"Opinion: While following the ""political correctness"" of being tough against China, the US government in 2023 should at least bring its trade policy back to a rational footing in consideration of the actual costs to its own economy.",globaltimesnews,USA
