Text,Media,GPE
"Opinion: It is understandable that some US politicians may soften their tone to appease the market at time when the US is facing serious economic headwinds, but China will follow its own rhythm in modernizing its strategic industries.",globaltimesnews,USA
": Some US elites have a shameless double standard: They condemn and even sentence those who incite violence in the US to long prison terms; but when it comes to anti-China disruptors, they spare no effort to defend them.",globaltimesnews,USA
": US hypes ""China threat"" to justify its nuclear expansion.",globaltimesnews,USA
"As inflation outpaces wage growth in the US, the traditional shopping season at the end of the year seems to have lost steam, with spending per consumer falling sharply. Meanwhile, Made-in-China clearly remains indispensable for US consumers.",globaltimesnews,USA
"FM slams US smearing of China's efforts in epidemic control, saying China is sharing a big market with the world, and providing cost-effective products with stable industrial & supply chains, citing data such as China's foreign trade in goods rising 9.9% from Jan to Sep.",globaltimesnews,USA
"President Xi and President Biden had in-depth, constructive and strategic discussions on major issues concerning China-US relations and prospects for world peace & development in Bali, Chinese FM said Thur after US Secretary Antony Blinken said the meeting was vitally important",globaltimesnews,USA
"Challenging US' Inflation Reduction Act (IRA) is an exercise of China’s rights as a WTO member, MOFCOM said, explaining Chinese delegation expressed concern over distorting trade subsidies contained in IRA & measures that disrupt global semiconductor industry at .",globaltimesnews,USA
"Developing ties with China is actually the better way for EU to reduce its dependency on US and diversify its economy. However, the US has increased its attempts to force the EU to join its anti-China fleet: expert",globaltimesnews,USA
: The transatlantic relationship is currently in a critical historical period. The steel frame of the bridge supporting it has been severely loosened. The US has neither the will nor the ability to repair it.,globaltimesnews,USA
"""China challenge"" will not help US, France, or EU resolve their tensions. The US wants to create rivalry, forcing all sources to flow to US and sacrificing the interests of its allies to suit the US strategic appeal: expert",globaltimesnews,USA
: The White House brought out all the ceremonial objects it could think of to host Macron. All this was a strong contrast with the rift between the US and France on various issues.,globaltimesnews,USA
"Unlike , which always imposes geopolitical conditions on cooperation with countries, China-Arab cooperation is reciprocal and benefits people from both sides: experts",globaltimesnews,USA
"Chinese FM urges US to perceive China correctly and follow through on President Biden’s commitment of not seeking decoupling from China, halting China’s economic development or containing China.",globaltimesnews,USA
"China doesn’t oppose the development of normal relations between the US and France, but their development of ties should not harm the interests of a third party: Zhao responds after US-France joint statement claimed “China challenge.”",globaltimesnews,USA
"The US has made a fortune in the Ukraine crisis, while Europe is bleeding and paying for higher energy prices due to inflation. No wonder some European media say that Europe must ask: Why should our peace and prosperity depend on the interests of the US? Zhao said.",globaltimesnews,USA
"The US introduced the “Inflation Reduction Act” for its own interests while ignoring the impact on other countries, including its so-called allies and partners, Chinese FM spokesperson Zhao Lijian said. “This is another example of the America-first hegemony.”",globaltimesnews,USA
": With its shady case against Meng Wanzhou, the US also made a fool out of Canada's government, and Ottawa's response is that it will go all in in following the US' confrontational approach against China. That is truly regrettable.",globaltimesnews,USA
: More people died of COVID-19 in the US in the last three weeks than in China since the beginning of the pandemic. Fewer people have died in the whole of China than in an average US town. Here is why.,globaltimesnews,USA
"Opinion: Facing “deglobalization” and “decoupling” headwinds orchestrated by the US, it is imperative for the EU and China to stand together and say no to Washington’s attempt to debilitate our world.",globaltimesnews,USA
"：What kind of weapons the US develops is its own business. But if its purpose is to threaten and intimidate China, it is doomed to be a daydreaming.",globaltimesnews,USA
": Not only will B-21 fail to prove ""US deterrence,"" but it will only become the latest proof on the showcase of ""source of American chaos.""",globaltimesnews,USA
: Europe struggles to survive double pressure of energy crisis and US Inflation Reduction Act.,globaltimesnews,USA
The EU’s potential filing of a complaint over the US so-called Inflation Reduction Act at the WTO represents widespread global concerns over the US act: experts,globaltimesnews,USA
"The US’ new B-21 bomber has inherited some select strengths & drawn lessons from major shortcomings of the B-2, as it can be mass-produced and is more pragmatic in major power competitions, posing new challenges to the national defense of China: analysts",globaltimesnews,USA
"More people in the EU now realize how they have been caught in the US' trap, as the latter uses the EU crisis as an opportunity to enrich itself at the expense of the EU.",globaltimesnews,USA
": The US is not only aimed at China. Its series of moves also sowed seeds of future confrontation and conflicts among regional powers, threatening peace and stability for the region.",globaltimesnews,USA
"No matter how EU and US handle the conflict over US’ Inflation Reduction Act and how the game unfolds, the transatlantic relationship is destined to suffer damages, analysts said.",globaltimesnews,USA
: Austin undisguisedly showed his desire to continue US hegemony in his Saturday speech. But he cannot stop the trend that Washington’s hegemony is collapsing faster and faster while losing its grip on allies and partners.,globaltimesnews,USA
"The pressure from the US against the EU economy is an opportunity for China-EU relations, as now European leaders are engaging with both the US and China, and French President Emmanuel Macron is expected to visit China next month, and…",globaltimesnews,USA
"Once the Chinese mainland is determined to reunify with Taiwan by force, we will destroy all the army and aircraft carriers dispatched by the US if they choose to intervene and fight with the PLA: Global Times Commentator Hu Xijin",globaltimesnews,USA
"China resolutely opposes the US and the EU to interfere in China's internal affairs and to slander China, said FM spokesperson Mao Ning on Mon in response to relevant remarks made during the fourth high-level meeting of the US-EU Dialogue on China.",globaltimesnews,USA
"The offshore Chinese yuan rose by more than 300 points to 6.9848 per US dollar on Monday morning, stronger than 7 for the first time since September: report",globaltimesnews,USA
": If the US and EU can only reach a coordinated approach in dealing with the so-called China challenges, then their shaky ""friendship"" will be far from enough to bridge their divide exposed by Washington's pursuit of its own interests.",globaltimesnews,USA
"As Russia has warned on Mon to respond to a Western price cap on its crude oil, an initiative led by the US and endorsed by the G7 and allies to curb Russia’s income, Chinese experts pointed out that the price cap would bring limited losses for Russia.",globaltimesnews,USA
Wonder what the ‘world’s best institute’ does in ? Dr. Stidham from the can tell stories about ’s unique legacies and how China-West collaboration made science advance over the past decade.,globaltimesnews,USA
The report that accuses hackers linked to the Chinese govt of stealing millions in US COVID relief benefits is ridiculous and an old trick to divert domestic attention from “Twitter Files” controversy related to : Chinese expert,globaltimesnews,USA
"China’s FM expressed opposition to unilateral tariffs that violate WTO rules and vowed necessary measures to protect interests, as the US reportedly pushes for tariffs on Chinese steel and aluminum.",globaltimesnews,USA
: US attempts to win over Africa with empty promises of .,globaltimesnews,USA
: The UK became the first victim of the current chaos US policy is creating in Europe. But unless European governments show some independence from the US it will be far from the last.,globaltimesnews,USA
"The malicious legislation promulgated by the US and enforced on China’s Xinjiang based on the ""forced labor"" lies seriously disruptes normal trade in PV products between China & the US, violates market laws & intl trade rules. This’ll eventually backfire: FM spokesperson",globaltimesnews,USA
"is against any attempt that violates WTO rules and unilaterally-imposed illegal tariffs, as they are bad for all parties. China will take necessary measures to safeguard its rights, says FM, responding to reports of US’ possible new tariffs on China’s steel and aluminum.",globaltimesnews,USA
": The three-way rotations of US-Australian-Japanese troops are a tactic under the “Indo-Pacific Strategy.” The US is calling black white by hyping China’s “dangerous and coercive actions,” and the real intention is to contain China.",globaltimesnews,USA
Canberra needs to make sure it has the political wisdom & governance ability to properly manage differences… China would not meet Australia's wishful thinking on other aspects if it is just siding with the US and challenging China's core interests: expert,globaltimesnews,USA
"The higher the US military presence in Australia is, the weaker Australia's strategic autonomy, experts said, noting that it’s a pointless act of adventurism to sacrifice Australians’ interests for the sake of US hegemony.",globaltimesnews,USA
: US to increase military presence in Australia.,globaltimesnews,USA
"US lawmakers have eased new restrictions on the use of Chinese-made chips, showing the US business community’s growing displeasure over the US govt’s increasingly reckless crackdown campaign.",globaltimesnews,USA
": The images of China and the US in the eyes of African countries also have a functional role in making it clear to more countries that China is much more reliable, much more trustworthy, and much more predictable than the US.",globaltimesnews,USA
"TSMC’s moves in the US, which came under intense political pressure from Washington, may lead to a trend that could “empty” Taiwan’s industrial base and harm the regional economy: analyst",globaltimesnews,USA
"Thomas Stidham, a US paleontologist and travel enthusiast, is known in China as “Teacher Tom” to children who love paleontology. Having been in China for over 10 years, he has learned about the nation through fossils, nature and people.",globaltimesnews,USA
"S.China’s Hainan is increasing intl air routes for duty-free goods. It restarted cargo services to Paris, Milan, Zurich, Sydney, Singapore. It will add flying frequency or start new routes to SE Asia, Europe&US to facilitate duty-free goods entry.",globaltimesnews,USA
": TSMC, which takes up half of the global chip manufacturing industry, has the right to choose where to set up factories and invest. But setting up a factory in the US is obviously not just about doing business.",globaltimesnews,USA
"“More Gulf countries understand that when the US mentions ‘security,’ it has become unsecure for them while China-proposed ideas promoting peace and development are much more welcomed,” said an expert.",globaltimesnews,USA
"GT poll shows that more Arab respondents favor China and only 20.7 percent favor US. US' hegemony has brought upheaval and instability to the region, giving these Western nations and the US a terrible reputation in the Arab world, analysts said.",globaltimesnews,USA
": TSMC is building a new chip plant in Arizona, US. No matter how Washington performs, it will be a key event marking a dark turn in the development history of the global semiconductor industry.",globaltimesnews,USA
"Such sales would not change the total military advantage the Chinese mainland holds, but experts underlined that the US again laid bare its poor credibility on Taiwan question.",globaltimesnews,USA
"The US, in consecutive provocative moves over the Taiwan question, has in the past few days approved another arms sale to the island of Taiwan and advanced its National Defense Authorization Act.",globaltimesnews,USA
"A discussion of shift to use Chinese yuan in China-Saudi oil settlement is becoming increasingly prominent amid an ongoing visit by Chinese President Xi Jinping, a move that may dent US dollar hegemony & inject stability into bilateral trade: observers",globaltimesnews,USA
"More than half of Arab respondents hope China will surpass the US to play a bigger role in the Middle East, according to a GT poll. Both Chinese and Arab people believe the two sides should enhance cooperation in energy and economic diversification.",globaltimesnews,USA
"Netherlands unlikely to blindly follow ’ chip export controls, as complementary nature of and Dutch economies will contribute to the Netherlands’ recovery.",globaltimesnews,USA
"Caribbean Community countries call for an immediate and unconditional end to the economic, commercial, and financial blockade implemented by the US government against Cuba on Wed during the eighth CARICOM-Cuba Summit.",globaltimesnews,USA
: uses as a pawn to contain China. ✏️,globaltimesnews,USA
"Japan and Australia vowed to bolster security ties, citing ""China’s threat"" as an excuse. Analysts said Japan, Australia – two spearheads of the US – will bring more instability to the region.",globaltimesnews,USA
"GT on the spot: join us visiting an ordinary home in Saudi Arabia, which was full of Chinese elements.",globaltimesnews,USA
"China firmly opposes the US move of using National Defense Authorization Act to approve negative contents against China. The US should stop playing the ""Taiwan card"" and cut military ties with Taiwan island: Chinese FM.",globaltimesnews,USA
"China's CPI rose 1.6% in November year-on-year, easing from a 2.1 percent rise in October. It underscores that China's inflation is kept at ""moderate"" range this year despite runaway inflation elsewhere in the US and Europe.",globaltimesnews,USA
"As of November 28, China's confirmed cases ratio is 1/374 of the global average, or 1/1,348 of US', and the death rate is 1/232 of the global average, said Zhong Nanshan, Jiankang Shibao reported on Friday.",globaltimesnews,USA
"2022 Hurun Global 500 released Friday shows that there are 35 Chinese companies on the list this year, second only to the US, with a total value of 19 trillion yuan accounting for 6% of the total.",globaltimesnews,USA
"New Omicron subvariants BQ.1 and BQ.1.1 account for nearly 70 percent of new COVID-19 cases in the United States in the latest week, according to estimates released Friday by the U.S. Centers for Disease Control and Prevention (CDC).",globaltimesnews,USA
": Should Japanese semiconductor companies again become the cannon fodder of the US ""chip war"" today? Japan is advised to think about the potential consequences before once again betting on Washington to deliver.",globaltimesnews,USA
": The US is ratcheting up pressure on its allies to follow its lead. If the US ropes in enough allies to launch a ""chip war,"" then the global chip industry, especially domestic industries in those countries, will pay a huge price.",globaltimesnews,USA
": Once the US loses the case, not only will it not accept the result, but it will even accuse the WTO of not being qualified to judge its rights and wrongs, as in the so-called ""lose the lawsuit and demolish the court.""",globaltimesnews,USA
"…and they urged that if Washington really wants to manage the competition and boost cooperation, it should keep its promises on sensitive topics like Taiwan question and stop hostile containment approaches against China, otherwise the US won’t get what it wants.",globaltimesnews,USA
The US announced Saturday that a delegation formed by senior officials on Asia-Pacific affairs will visit China soon. Chinese analysts it’s obvious that the US is seeking stabilization of ties with China more desperately…,globaltimesnews,USA
": As more African nations lose trust in it, all the US can do is fill “promises” with empty words and visions that sound grand. Whatever it will say during the US-Africa Leaders Summit is likely to be another empty promise that no one will buy.",globaltimesnews,USA
Office of the Commissioner of the Chinese FM in the on Sun rejected irresponsible comments of some US politicians on Hong Kong court’s law-based ruling against Lai Chee-ying.,globaltimesnews,USA
"urges US to correct its wrongdoings, and work with China and other members to safeguard the multilateral trading system, as showed defiance over a new WTO ruling.",globaltimesnews,USA
": Japan does not seek direct military confrontation with China, but rather to strengthen its own military power through hype so that it can meet the deployment needs of the US strategy and promote Japan's fundamental national strategic goals.",globaltimesnews,USA
"The US State Department's statement on the latest sentence of Jimmy Lai ignores facts, undermines the rule of law in HK and interferes in China's internal affairs, which we strongly condemn, a spokesperson for the Office of the Commissioner of Chinese FM in HKSAR said on Sun.",globaltimesnews,USA
": China’s circle of friends is expanding, which, however, is not the result of competition with the US, but because China’s development has substantively benefited the world. China’s connection with the world is bound to become closer.",globaltimesnews,USA
took legal action against the in the over export control measures on Monday.,globaltimesnews,USA
": The recent financial events, such as Blackstone's limits on redemptions, are the inevitable results of US' excessive innovation in the financial sector over the years, which could be seen as a sign of a liquidity problem surfacing in the US.",globaltimesnews,USA
: The upcoming - summit in Washington is the first time the US has restarted this mechanism in eight years. Yet the US should not politicize Africa's development demands with the event.,globaltimesnews,USA
": It is hoped that the US delegation can accurately convey China’s attitude back to Washington, which is that we welcome China-US cooperation, but will never accept “cooperation” aimed at weakening, containing and suppressing China.",globaltimesnews,USA
"While the US has been stepping up pressure on South Korea to join its so-called “Chip 4” alliance and other moves targeting China, there is also growing calls in both China and South Korea for cooperation instead of “decoupling.”",globaltimesnews,USA
"China launched a suit against the US in the WTO over its chip export control measures on Mon, China’s Ministry of Commerce said. It is a way of seeking to address Chinese concerns through legal means, and a necessary way to defend China’s legitimate interests.",globaltimesnews,USA
"Observers say that no matter how many fancy words the US uses in its upcoming summit with African leaders, it still sees Africa as an arena to serve its own strategic goal of competing with China.",globaltimesnews,USA
": While China and the US are among the most critical external stakeholders on security, peace and prosperity of the African continent, the US is keen on using Africa as a tool in a competition with China.",globaltimesnews,USA
"The Xi-Biden meeting helped prevent - ties from further declining and the latest talks between senior officials of the two countries have paved the way for future dialogue, but it’s unrealistic to expect a drastic change: experts",globaltimesnews,USA
"Biden’s bullish description of US economy is not true, based on manipulation of nominal GDP which has been driven up by elevated inflation, analysts say.",globaltimesnews,USA
"China’s steel, aluminum sectors on Mon expressed appreciation for the WTO’s ruling that US tariffs on Chinese steel & aluminum products were in breach of its rules, urging US to correct wrongdoings.",globaltimesnews,USA
"Chinese Vice Foreign Minister Xie Feng met US Assistant Secretary of State for East Asian and Pacific Affairs Daniel Kritenbrink and National Security Council Senior Director for China and the island of Taiwan Laura Rosenberger in Langfang, North China's Hebei from Sun to Mon",globaltimesnews,USA
": 8 years after the first US-Africa Leaders Summit held in 2014, the 2nd - Leaders Summit will be held in Washington from Dec 13-15. But the US is facing a growing 'trust deficit.' Check the graphic to learn more:",globaltimesnews,USA
": In comparative terms, the tendency to lecture African leaders is an obvious feature in US engagement with Africa which isn't observable in China-Africa relations. There are mutually agreed principles which underpin China-Africa relations.",globaltimesnews,USA
"As the mounts efforts to intensify crackdown on China's industry by tightening controls over chip products exports and roping in allies across Asia and Europe, China strongly fights back by filing a lawsuit with the .",globaltimesnews,USA
"The US’ scheme is to use the hypersonic missile and the recently revealed B-21 stealth bomber to penetrate China’s air defense, but the PLA has what it takes to defend the country, experts said.",globaltimesnews,USA
"After a series of failures, the US Air Force on Monday announced that it has finally succeeded in the test launch of its air-launched hypersonic missile, a technology China has long mastered and has even put on public display in a recent air show.",globaltimesnews,USA
Chinese developer Guangzhou R&F Properties Co Ltd clarified on Tuesday it did not provide any security money toward bail for director Zhang Li in a court matter and has taken legal action on a false bribery charge against Zhang.,globaltimesnews,USA
": African countries hope to build good relationship with the US, but they don’t want to achieve it at the cost of China-Africa development and cooperation.",globaltimesnews,USA
"When US Defense Secretary Lloyd Austin warned African leaders that “China and Russia were destabilizing Africa,” he probably forgot about the pain & chaos the US has brought to the continent, and how much infrastructure China has built for Africa: experts",globaltimesnews,USA
": US has made its Africa strategy a Gordian knot. It has set its goal to prevent China’s development instead of helping African countries, which fundamentally goes against the wishes of African countries and damages their interests.",globaltimesnews,USA
"The US is holding a summit with African countries and will try to convince Africans that the US offers a “better option” than other major powers, especially China, but Chinese analysts said…",globaltimesnews,USA
"Chinese smartphone maker Oppo unveiled second self-developed microchip, a fresh effort as more Chinese companies speed up investment in the semiconductor sector amid a relentless US crackdown.",globaltimesnews,USA
"US scientific breakthrough in nuclear fusion creating nuclear reaction that generates more energy than it consumes is believed to aim at developing nuclear weapons, but efficiency to be improved: experts",globaltimesnews,USA
"18 PLA bombers, capable of carrying 100+ missiles, reportedly held drills near Taiwan island in a single day, setting record & sending warning to collusion between Taiwan se-cessionists, external forces after recent US arms sales, Western official visits",globaltimesnews,USA
: The energy deal between the US and UK will over time only draw both ever closer in the area of energy security and it is obvious which “partner” will emerge dominant: America will call the shots.,globaltimesnews,USA
"China opposes US' generalization of concept of national security & unreasonable suppression of Chinese firms, an approach that will backfire, the FM said in response to a report that US Congress introduced bills to keep foreign firms like Huawei out of its financial system.",globaltimesnews,USA
"The US has repeatedly stretched the concept of national security and been abusing export control measures to block & hobble foreign firms. It is pure economic coercion and sci-tech bullying, the FM spokesperson said, responding to US’ plan to blacklist over 30 Chinese firms.",globaltimesnews,USA
"Opinion: Though November CPI came in at 7.1%, it doesn’t indicate the US Federal Reserve has succeeded in controlling inflation, as the central bank will be haunted by persistently elevated grocery prices and cost of services.",globaltimesnews,USA
: Global economy bears the pain from aggressive US rate hikes.,globaltimesnews,USA
Opinion: The chip export control measures adopted by the US in Oct are in direct violation of the WTO's obligations and market rules. All countries should unite and use existing international mechanisms to fight against the US hegemony.,globaltimesnews,USA
"Opinion: If the US was actually helping to build roads, bridges, schools and hospitals in Africa, it wouldn’t need a summit to demonstrate its ""commitment"". The summit has been awkward for US officials, as they tiptoe around warning of ""Chinese influence"".",globaltimesnews,USA
