Text,Media,GPE
"In backing US tariffs on China, big trade unions are doing more harm than good",SCMPNews,USA
Airline accidentally flies pet dog to Saudi instead of US,SCMPNews,USA
Africa has ‘more options on the table’ as US seeks to reset ties,SCMPNews,USA
Man who stole millions in bitcoin from device seized by US to plead guilty,SCMPNews,USA
Nobel-winning US professor accused of sex harassment by former students,SCMPNews,USA
Trial of FTX’s Sam Bankman-Fried possibly 18 months out as US prosecutors put together case against crypto titan,SCMPNews,USA
US officials hail Japan’s national security and defence shifts as good for Indo-Pacific stability,SCMPNews,USA
"When it comes to China, Britain should decouple from the US",SCMPNews,USA
Normally bellicose China’s meek response to US chip restrictions raises eyebrows,SCMPNews,USA
US steps into ‘Middle East of renewables era’ – and direct competition with China,SCMPNews,USA
China’s pet economy purrs along: owners to spend US$116 billion in 2025,SCMPNews,USA
Can China’s yuan energy deals erode the power of the US petrodollar?,SCMPNews,USA
Amber Heard settles US defamation suit with ex-husband Johnny Depp,SCMPNews,USA
"Toll of Covid-19 in China is a concern for the world, says US State Department",SCMPNews,USA
Canada moves to seize US$26 million from Russian oligarch Roman Abramovich,SCMPNews,USA
Amber Heard makes ‘difficult decision’ to settle US defamation suit with ex-husband Johnny Depp,SCMPNews,USA
No more ‘scramble for Africa’ for China and the US,SCMPNews,USA
"Li Ka-shing’s CK Life Sciences adds to wine holdings in Australia, buying Edinger Estate vineyard for US$7.3 million",SCMPNews,USA
"When it comes to China, Britain should decouple from the US",SCMPNews,USA
"Australia eyes B-21 to contain China, but will US sell advanced stealth bomber?",SCMPNews,USA
"SFC no longer a ‘toothless tiger’ after it imposed US$707 million in fines over 11 years to clean up misconduct, outgoing CEO says",SCMPNews,USA
3/5: Parsing the normally bellicose China’s meek response to US chip restrictions,SCMPNews,USA
"Ukraine’s Zelensky to visit US on first trip abroad since war began, US media reports",SCMPNews,USA
3/5: ‘Hope is in front of us’: China’s travel sector looks past misfortune of 2022,SCMPNews,USA
"Taliban free two Americans in ‘goodwill gesture’, US State department says",SCMPNews,USA
World Bank approves additional US$610 million in financing for Ukraine,SCMPNews,USA
A US House committee has referred Donald Trump to face four criminal charges.,SCMPNews,USA
"A flight carrying 288 people hit severe turbulence in the US, injuring 36 people.",SCMPNews,USA
"As its vilification grows, Tiktok’s future in the US remains in limbo",SCMPNews,USA
China accuses US of driving wedge between Beijing and Manila in South China Sea spat,SCMPNews,USA
A US House committee has referred Donald Trump to face four criminal charges.,SCMPNews,USA
"A flight carrying 288 people hit severe turbulence in the US, injuring 36 people.",SCMPNews,USA
China’s top semiconductor company owners are poorer under US sanctions,SCMPNews,USA
US ‘insurrection’ and HK ‘peaceful’ rallies reflect height of hypocrisy,SCMPNews,USA
"Malaysia’s PM Anwar sues Muhyiddin for defamation over claim of US$3.38 million pay as Selangor adviser, wants compensation",SCMPNews,USA
China calls on US to lift Iran sanctions to revive nuclear talks,SCMPNews,USA
Hong Kong set for higher prime rates as US Fed keeps up inflation fight,SCMPNews,USA
Australia names ‘most eminent and sought-after’ China expert Kevin Rudd as new US ambassador,SCMPNews,USA
US lawmakers to include ban on TikTok on government devices in major spending bill,SCMPNews,USA
"Chinese companies turn to Switzerland, Frankfurt to sell shares as regulatory woes make US market unappealing",SCMPNews,USA
"‘I believe in us’: woman pays fiancé’s US$26,000 debt, refuses betrothal cash",SCMPNews,USA
"‘I believe in us’: woman pays US$26,000 debt for fiance she met a month ago and refuses betrothal cash from him, triggers debate in China",SCMPNews,USA
US trade chief urges new tools against China’s ‘20-year’ market distortions,SCMPNews,USA
US trade chief says new tools needed to counter China’s ‘20-year distortions’ affecting global economy,SCMPNews,USA
FTX founder Sam Bankman-Fried accepts extradition to US to face fraud charges,SCMPNews,USA
"US to provide Patriot missile system to Ukraine, says Secretary of State Antony Blinken",SCMPNews,USA
US rivalry with China and Russia is elevating the global role of Africa and the Middle East,SCMPNews,USA
WTO rules for Hong Kong in its trade dispute with US,SCMPNews,USA
Why China’s yuan-for-oil push in the Middle East is no threat to the US dollar,SCMPNews,USA
Li Ka-shing’s property unit buys Kai Tak land for bargain price of US$1.12 billion as developers shy away from big bids,SCMPNews,USA
The United States cannot blame China for its economic troubles,SCMPNews,USA
"Hours after North Korea slammed Japan's military build-up plan, the US conducted joint drills with South Korea.",SCMPNews,USA
"Twitter cost-cutting averted US$3 billion shortfall, Elon Musk claims",SCMPNews,USA
Winter solstice: what Chinese solar calendar can teach us about eating well,SCMPNews,USA
"‘I will not be back’: US rapper Azealia Banks slams ‘broke, racist’ Australians",SCMPNews,USA
Chinese EV maker Nio is being blackmailed by hacker for US$2.25 million in bitcoin after data breach,SCMPNews,USA
"Hours after North Korea slammed Japan's military build-up plan, the US conducted joint drills with South Korea.",SCMPNews,USA
Landlord sues shop owner for US$3.2 million as unpaid-rent cases spike,SCMPNews,USA
Donald Trump’s tax returns to be released by US Congress,SCMPNews,USA
A US House committee has referred Donald Trump to face four criminal charges.,SCMPNews,USA
"A flight carrying 288 people hit severe turbulence in the US, injuring 36 people.",SCMPNews,USA
"Hours after North Korea slammed Japan's military build-up plan, the US conducted joint drills with South Korea.",SCMPNews,USA
Hong Kong landlord linked to Chinese Estates sues I.T Group companies for US$3.2 million over unpaid rent,SCMPNews,USA
5/5: US moves to strengthen Taiwan military ties ‘a sign of malice’,SCMPNews,USA
China’s ByteDance finds staff inappropriately gained access to TikTok user data in US,SCMPNews,USA
"FTX founder Sam Bankman-Fried allowed US$250 million bond, house arrest",SCMPNews,USA
"Australia’s Rudd well qualified as envoy to US, but may find diplomatic life constricting",SCMPNews,USA
Global mining giant faces US$12 billion damages trial in UK over Brazil dam collapse,SCMPNews,USA
"US moves to strengthen Taiwan military ties ‘a sign of malice’, says Chinese analyst",SCMPNews,USA
Tencent joins open-source chip design community RISC-V as China seeks to mitigate impact from US sanctions,SCMPNews,USA
Why the late George H.W. Bush is the most underrated great US president,SCMPNews,USA
Microsoft fined US$64 million over advertising cookies by French regulator,SCMPNews,USA
Behind the scenes of Zelensky’s daring 10-hour wartime visit to US,SCMPNews,USA
Behind the scenes of Ukraine leader Zelensky’s daring 10-hour wartime visit to US,SCMPNews,USA
China must import mRNA vaccines to stop Covid-19 ‘disaster’: US health experts,SCMPNews,USA
Former executives plead guilty to US fraud charges in FTX collapse,SCMPNews,USA
Hong Kong commerce chief urges US to respect WTO ruling against ‘Made in China’ label,SCMPNews,USA
"Ukraine’s Zelensky delivers Congress speech, meets Biden in wartime visit to US",SCMPNews,USA
Chinese smart EV maker Xpeng sets up unit to design and produce battery packs with investment of US$717.5 million,SCMPNews,USA
"Donald Trump should never hold office again, US insurrection report says",SCMPNews,USA
FTX executives’ plea deals kept secret to get founder Sam Bankman-Fried back to US,SCMPNews,USA
More than 90 million people in the US are under weather alerts as an Arctic blast sweeps in ahead of the holiday weekend.,SCMPNews,USA
"As US and China slug it out, will Europe and Russia be left out in the cold?",SCMPNews,USA
Binance puts up a brave face even as investors pulled US$6 billion in 3 days from the world’s largest cryptocurrency exchange,SCMPNews,USA
More than 90 million people in the US are under weather alerts as an Arctic blast sweeps in ahead of the holiday weekend.,SCMPNews,USA
Struggling Sri Lanka waits on China to unlock its US$2.9 billion IMF bailout,SCMPNews,USA
"Ukraine’s multiple air defence systems: US Patriot, French Crotale, German IRIS-T, Norwegian NASAMS",SCMPNews,USA
Facebook parent Meta to settle Cambridge Analytica scandal case for US$725 million,SCMPNews,USA
More than 90 million people in the US are under weather alerts as an Arctic blast sweeps in ahead of the holiday weekend.,SCMPNews,USA
"‘If you don’t eat shellfish, that is your problem’: chef on his US$360 no-choice menu at Noi, Italian restaurant in the Four Seasons Hong Kong",SCMPNews,USA
East Asia Super League secures US$40m to fund expansion as CEO Matt Bayer talks up ‘bullish’ outlook,SCMPNews,USA
"Arctic ‘bomb cyclone’ grips US, sparking White House warning",SCMPNews,USA
‘Offensive’: US university reprimands chancellor for mocking Asians,SCMPNews,USA
US spy planes edge closer to China’s shores in 2022: think tank,SCMPNews,USA
"US raises arms race risk with Taiwan security bill, Chinese analysts warn",SCMPNews,USA
Chinese companies back on track in Tanzania after winning US$2.2 billion railway contract,SCMPNews,USA
Going potty: Hong Kong toilet mania and city’s solid gold US$3.5 million ‘throne’,SCMPNews,USA
"US ‘bomb cyclone’ winter storm leaves 1 million without power, wrecks holiday travel",SCMPNews,USA
"‘Finally, they can leave that zoo’: China welcomes news of the return of giant pandas Ya Ya and Le Le from US zoo after mistreatment claims",SCMPNews,USA
Busloads of migrants dropped off near US VP Kamala Harris’ home in amid record freeze,SCMPNews,USA
"NFL teams, fans adapt as deep freeze hits US",SCMPNews,USA
"18 die as monster Christmas Eve storm brings rain, snow, cold across US",SCMPNews,USA
"""This is a war with Mother Nature."" Parts of the US battled the most severe winter storm in decades as millions were left without power supply.",SCMPNews,USA
‘Blizzard of the century’ leaves nearly 50 dead across US,SCMPNews,USA
"""This is a war with Mother Nature."" Parts of the US battled the most severe winter storm in decades as millions were left without power supply.",SCMPNews,USA
"""This is a war with Mother Nature."" Parts of the US battled the most severe winter storm in decades as millions were left without power supply.",SCMPNews,USA
PLA sends record 71 warplanes near Taiwan after US increases military aid,SCMPNews,USA
Stranded South Korean tourists find refuge from US snowstorm in New York couple’s home,SCMPNews,USA
Hainan spends US$717 million on Formula E race circuit to give China’s electric-car industry a jolt,SCMPNews,USA
Dozens dead in brutal US winter storm as crisis unfolds in Buffalo,SCMPNews,USA
US Supreme Court rules to keep immigration limits in place indefinitely,SCMPNews,USA
"4/5: China eased Covid rules to spur its economy, but are US firms as eager?",SCMPNews,USA
"Where US sees India as an Indo-Pacific security provider, Pakistan sees an arm race",SCMPNews,USA
US House administration arm bans TikTok on official government devices,SCMPNews,USA
US investigates how US$372 million vanished in hack after FTX bankruptcy,SCMPNews,USA
China’s army sends a record 71 warplanes near Taiwan in response to the US decision to increase military aid for the island.,SCMPNews,USA
How to steer the US and China away from conflict? Asean showed us,SCMPNews,USA
"US: 6 months after Roe end, Illinois abortion providers treat ‘historic high’ number of out-of-state patients",SCMPNews,USA
"China eased Covid rules to spur economic growth, but US companies still plot manufacturing shifts",SCMPNews,USA
China’s army sends a record 71 warplanes near Taiwan in response to the US decision to increase military aid for the island.,SCMPNews,USA
China’s army sends a record 71 warplanes near Taiwan in response to the US decision to increase military aid for the island.,SCMPNews,USA
China’s antitrust body fines academic database platform owner CNKI US$12.6 million for monopolistic practices,SCMPNews,USA
"US security officials may ask TikTok owner ByteDance to sell US unit, report says",SCMPNews,USA
3/5: US will require travellers from China to test negative for Covid-19 before entering,SCMPNews,USA
US may require travellers from China to test for Covid-19 before entering,SCMPNews,USA
China’s change in Covid policy doesn’t compel students in US to return for holiday,SCMPNews,USA
Coronavirus: US may require travellers from China to test for Covid-19 before entering,SCMPNews,USA
"US marks four-year anniversary of Paul Whelan’s detention in Russia, Blinken calls it an ‘unfathomable ordeal’",SCMPNews,USA
Coronavirus: could US restrictions on travellers from China raise tensions further?,SCMPNews,USA
"Heavenly King’s ransom: Hong Kong star Aaron Kwok lands US$144,000 mainland payout",SCMPNews,USA
"Malaysians appalled their dishes rank lower than UK, US food in ‘50 best world cuisines’ list",SCMPNews,USA
"Heavenly King’s ransom: Hong Kong Cantopop star Aaron Kwok lands US$144,000 payout over illegal use of his image in mainland China",SCMPNews,USA
‘Meltdown’: Southwest faces storm of criticism over US travel chaos,SCMPNews,USA
Country Garden gets US$647 million no-interest lifeline from China’s richest woman Yang Huiyan following asset sale,SCMPNews,USA
Alameda lent Sam Bankman-Fried US$546 million for Robinhood stake,SCMPNews,USA
"Nepal-China ties get a ‘happy’ boost with new leftist PM, but India and US wary",SCMPNews,USA
‘Complete meltdown’: Southwest Airlines faces storm of criticism over US travel chaos,SCMPNews,USA
"Hysan earmarks US$256 million for ‘Lee Gardens Rejuvenation’ in Causeway Bay, turn it into ‘home of luxury’",SCMPNews,USA
5/5: Latest Taiwan arms sale reflects US indifference to mainland China’s reaction,SCMPNews,USA
"A police officer in the midwestern US state of Ohio narrowly escaped being hit by a truck sliding down an icy freeway on December 25, 2022.",SCMPNews,USA
Latest Taiwan arms sale reflects US indifference to mainland China’s reaction,SCMPNews,USA
Ukraine war: Zelensky securing US Patriot defence system will shift balance but not end fighting,SCMPNews,USA
"A police officer in the midwestern US state of Ohio narrowly escaped being hit by a truck sliding down an icy freeway on December 25, 2022.",SCMPNews,USA
"People travelling from China, including Hong Kong and Macau, into the United States will soon have to produce a negative Covid-19 test to gain entry.",SCMPNews,USA
"China becomes East Asia’s second-largest market for US beef exports, region on course for record 2022 shipments",SCMPNews,USA
"A police officer in the midwestern US state of Ohio narrowly escaped being hit by a truck sliding down an icy freeway on December 25, 2022.",SCMPNews,USA
"People travelling from China, including Hong Kong and Macau, into the United States will soon have to produce a negative Covid-19 test to gain entry.",SCMPNews,USA
China Fortune Land to raise US$1.78 billion from asset sales to repay creditors,SCMPNews,USA
New World Development sells Pentahotel in Hong Kong for US$257 million as it disposes of non-core assets to reduce debt,SCMPNews,USA
"United Cup: Taylor Fritz, Madison Keys give Team USA early lead at mixed teams event",SCMPNews,USA
US approves potential US$180 million sale of anti-tank systems to Taiwan,SCMPNews,USA
"People travelling from China, including Hong Kong and Macau, into the United States will soon have to produce a negative Covid-19 test to gain entry.",SCMPNews,USA
Hong Kong’s Link Reit buys two Singaporean malls for US$1.6 billion in biggest Southeast Asian property deal this year,SCMPNews,USA
"A Chinese fighter jet flew within metres of a US air force plane over the South China Sea, forcing the American aircraft to take “evasive manoeuvres”.",SCMPNews,USA
"The first licensed marijuana shop in New York officially opened for business on December 29, 2022, well over a year after the US state legalised the drug for recreational use.",SCMPNews,USA
US chocolate firm Hershey being sued after tests reveal ‘dangerous and harmful’ heavy metals in 23 bars,SCMPNews,USA
China names ambassador to US Qin Gang as new foreign minister,SCMPNews,USA
"A Chinese fighter jet flew within metres of a US air force plane over the South China Sea, forcing the American aircraft to take “evasive manoeuvres”.",SCMPNews,USA
US frets about ‘erosion of influence’ as China and Ecuador move closer to a free-trade deal,SCMPNews,USA
"The first licensed marijuana shop in New York officially opened for business on December 29, 2022, well over a year after the US state legalised the drug for recreational use.",SCMPNews,USA
"Zhangzhou offers subsidies of up to US$4,321 to homebuyers as more cities move to spur struggling housing market",SCMPNews,USA
"Tech war: Huawei posts flat 2022 revenue as US sanctions continue to bite, vows to seek ‘quality’ survival in coming year",SCMPNews,USA
"The first licensed marijuana shop in New York officially opened for business on December 29, 2022, well over a year after the US state legalised the drug for recreational use.",SCMPNews,USA
US billionaire Warren Buffett jumps into hometown politics to fight US$306 million Omaha tram plan,SCMPNews,USA
"Tech war: China to revamp chip strategy under US pressure, but US$143 billion support package is not on the cards",SCMPNews,USA
Chinese fighter jet flies within metres of US military plane in South China Sea,SCMPNews,USA
Joe Biden signs US$1.7 trillion bill funding government operations,SCMPNews,USA
"China’s local authorities misused US$5 billion from special purpose bonds, auditors tell legislature",SCMPNews,USA
Questions on effectiveness follow US screening policy for travellers from China,SCMPNews,USA
"Coronavirus: US screening policy for travellers from China sparks anger, questions on effectiveness",SCMPNews,USA
